"issuekey","type","components","storypoint","title","description_text"
"ALOY-1157","Bug","Tooling",5,"Creating sample app from advanced/android_density doesn't copy resolution-specific image folders ","""*Steps:*    1. Create a new Alloy app from the advanced/android_density sample         Note that the source android_density code includes the following res-* folders each containing 'theImage.png' at different pixel densities.        2. Examine contents of the generated Alloy project's *appname/app/assets* directory.     *Results*    The res-* folders and contents were not copied into the new project's corresponding assets/android/images folder, as shown below:        *Expected*  The res-* folders and their contents are merged in with the existing assets/android/images folder contents.    """
"ALOY-1241","Bug","Widgets",5,"Alloy: Widget is loaded - initialized twice","""Widget within TableViewSection is initialized twice.    index.xml      widget.xml      widget.js      Console output:  """
"ALOY-1158","Improvement","Testing",3,"Alloy Model/Collection tests need to be updated for supporting also Backbone 1.1.2","""h5. Problem description  According to https://jira.appcelerator.org/browse/ALOY-576 we are upgrading Backbone version from 0.9.2 to 1.1.2    Backbone 0.9.2 will still there but will be deprecated in Alloy 1.6.0 - also 1.1.2 is going to break old samples and code, therefore need to be updated.     See also docs: https://jira.appcelerator.org/browse/TIDOC-1895  """
"ALOY-1160","Improvement","Samples & Templates",3,"Replace splash screens & icons for new projects","""We need to replace the draft Alloy icons & splash screens used for new projects prior to the 1.6 release."""
"ALOY-1159","Improvement","Builtins",3,"Update underscore library to latest version","""Update underscore lib, per PR https://github.com/appcelerator/alloy/pull/578    Need to update both runtime and build-time versions of the lib."""
"ALOY-1162","Bug","Models",3,"Backbone 1.1.2 : <model/property> sample returning unexpected data for model attributes","""h5. Problem description  Using Backbone 1.1.2, sample app included in <model/properties> returns unexpected data values when fetching for stored persistent Model data (using properties adapter).    h5. Steps to reproduce  Currently working on narrowing down the sample code. However it can be reproduced by getting the alloy sample for model/properties (https://github.com/appcelerator/alloy/tree/master/test/apps/models/properties )    1. Import the sample code  2. Add backbone support in config.json and in the 'exports.definition = {}' add:    3. Edit models/modelTab.js and add    4. Run  5. Click on Increment a few times. Then close the app.  Result: label is updated accordingly as expected, incrementing the count. Displayed label is something like:    6. Reopen the app  Displayed label is now different than expected, returning a new model with count 0 and the previous created/incremented models.   See attachment.      """
"ALOY-1161","Bug","Models",3,"MobileWeb: using 'backbone 1.1.2' dependency, app crashes on MobileWeb","""h5. Problem description  Accordingly to https://jira.appcelerator.org/browse/ALOY-1074 Backbone 1.1.2 is now selectable in config. json  However, if 1.1.2 is selected, MobileWeb projects are not runnable.     h5. Steps to reproduce  1. Create a new Alloy project  2. Edit config.json and add    3. Run on MobileWeb    Result: Application error is displayed. See screenshot    Using Backbone 0.9.2 it runs as expected."""
"ALOY-1165","Bug","Styling",3,"Compile error when merging backgroundGradient","""PR: https://github.com/appcelerator/alloy/pull/588    Review pull request, create test case / sample app to be added to test suite"""
"ALOY-1167","Improvement","Tooling",3,"Update travis.yml to exit w/non-zero value on errors","""GitHub builds are marked as passing even when errors are encountered by Travis. Our test scripts must be exiting with a non-zero value in the case of errors.    We should add an {{after_script}} section that exits with 0/non-zero to properly signal build state.    http://docs.travis-ci.com/user/build-configuration/"""
"ALOY-1166","Bug","Samples & Templates",2,"Direction arrow in models/binding_dataFunction test sample not correct on Android ","""https://github.com/appcelerator/alloy/tree/master/test/apps/models/binding_dataFunction    1. Build and run for Android and iPhone.    Results: Direction arrow on Android is center-aligned; on iOS, the arrow is left-aligned.    Expected: Arrow position same on both platforms."""
"ALOY-1170","Bug","Samples & Templates",3,"SQL runtime error when running models/listview_binding test app","""Steps:    1. Build/run https://github.com/appcelerator/alloy/tree/1_5_X/test/apps/models/binding_listview for Android or iOS    Results:   On iOS, the following error is generated:    {quote}  [DEBUG] 2014-10-16 10:02:57.854 binding_listview[31708:445138] [ERROR] A SQLite database error occurred on database '/Users/tstatler/Library/Developer/CoreSimulator/Devices/861898C4-B00A-46FE-B8BF-AF20F274270C/data/Containers/Data/Application/8411B43C-2D41-4140-BD17-9F5275B43166/Library/Private Documents/_alloy_.sql': Error Domain=com.plausiblelabs.pldatabase Code=3 """"An error occured parsing the provided SQL statement."""" UserInfo=0x7c93c470 {com.plausiblelabs.pldatabase.error.vendor.code=1, NSLocalizedDescription=An error occured parsing the provided SQL statement., com.plausiblelabs.pldatabase.error.query.string=INSERT INTO info (title,subtitle,image) VALUES (?,?,?);, com.plausiblelabs.pldatabase.error.vendor.string=table info has no column named title} (SQLite #1: table info has no column named title) (query: 'INSERT INTO info (title,subtitle,image) VALUES (?,?,?);')  [ERROR] Script Error {  [ERROR]     backtrace = """"#0 () at file:///Users/tstatler/Library/Developer/CoreSimulator/Devices/861898C4-B00A-46FE-B8BF-AF20F274270C/data/Containers/Bundle/Application/DA7AB9EB-0FAB-4D30-BB29-2E1CD5D26933/binding_listview.app/alloy/models/Info.js:54\n#1 Migrate() at file:///Users/tstatler/Library/Developer/CoreSimulator/Devices/861898C4-B00A-46FE-B8BF-AF20F274270C/data/Containers/Bundle/Application/DA7AB9EB-0FAB-4D30-BB29-2E1CD5D26933/binding_listview.app/alloy/sync/sql.js:245\n#2 () at file:///Users/tstatler/Library/Developer/CoreSimulator/Devices/861898C4-B00A-46FE-B8BF-AF20F274270C/data/Containers/Bundle/Application/DA7AB9EB-0FAB-4D30-BB29-2E1CD5D26933/binding_listview.app/alloy/sync/sql.js:341\n#3 () at file:///Users/tstatler/Library/Developer/CoreSimulator/Devices/861898C4-B00A-46FE-B8BF-AF20F274270C/data/Containers/Bundle/Application/DA7AB9EB-0FAB-4D30-BB29-2E1CD5D26933/binding_listview.app/alloy.js:128\n#4 () at file:///Users/tstatler/Library/Developer/CoreSimulator/Devices/861898C4-B00A-46FE-B8BF-AF20F274270C/data/Containers/Bundle/Application/DA7AB9EB-0FAB-4D30-BB29-2E1CD5D26933/binding_listview.app/alloy/models/Info.js:59"""";  [ERROR]     line = 93;  [ERROR]     message = """"invalid SQL statement"""";  [ERROR]     nativeLocation = """"-[TiDatabaseProxy execute:] (TiDatabaseProxy.m:191)"""";  [ERROR]     nativeReason = """"Error Domain=com.plausiblelabs.pldatabase Code=3 \""""An error occured parsing the provided SQL statement.\"""" UserInfo=0x7c93c470 {com.plausiblelabs.pldatabase.error.vendor.code=1, NSLocalizedDescription=An error occured parsing the provided SQL statement., com.plausiblelabs.pldatabase.error.query.string=INSERT INTO info (title,subtitle,image) VALUES (?,?,?);, com.plausiblelabs.pldatabase.error.vendor.string=table info has no column named title}"""";  [ERROR]     sourceId = 299232704;  [ERROR]     sourceURL = """"file:///Users/tstatler/Library/Developer/CoreSimulator/Devices/861898C4-B00A-46FE-B8BF-AF20F274270C/data/Containers/Bundle/Application/DA7AB9EB-0FAB-4D30-BB29-2E1CD5D26933/binding_listview.app/alloy/sync/sql.js"""";  [ERROR] }   [ERROR] Script Error Module """"alloy/models/Info"""" failed to leave a valid exports object  {quote}"""
"ALOY-1174","Improvement","Models",5,"Update sync adapters to support promises in addition to callbacks","""Per comments at [Hacking alloy to get promises to work|https://github.com/aaronksaunders/tiConnectSampleApp#hacking-of-alloyjs-to-get-promises-to-work], the core model/collection constructors could be modified simply to support using promises in addition to callbacks. As shown in [Aaron's TiConnect sample|https://github.com/aaronksaunders/tiConnectSampleApp/blob/master/app/alloy.js#L22] the change involves returning the results of the sync call.    Resolving this cannot break existing apps, so extensive testing should be done on all platforms."""
"ALOY-1173","Story","Tooling",5,"Add functionality from alloy-smelter to Alloy","""The https://github.com/k0sukey/alloy-smelter offers some nice capabilities that should perhaps be included in Alloy itself. For example, copying/moving/renaming/deleting controllers.    Sub-tickets will be needed to implement the individual features.    Alternately, alloy-smelter could be wrapped, providing """"alloy foo"""" commands that call to smelter."""
"ALOY-1172","Bug","Samples & Templates",3,"Properties test sample: Collection view doesn't update after adding first item on Android","""Steps:    1. Create an Alloy application from the [models/properties|https://github.com/appcelerator/alloy/tree/master/test/apps/models/properties] sample.  2. Build, run on Android.  3. Click Collections tab.  4. Enter text in input and click add/+ buttton.    Results: New item doesn't appear in TableView.  Expected: Item appears in tableview.    Subsequent items added to the collection appear in the TableView, it's just the first one that doesn't. Works as expected on iOS (sim)."""
"ALOY-1177","Improvement","XML",3,"Implicitly set ns attribute for SearchView to Ti.UI.Android","""When declaring a SearchView element in XML markup, Alloy should assign it the 'Ti.UI.Android' namespace.  Alloy is currently doing this for a lot of iOS-specific components.    These two items should be equivalent.      """
"ALOY-1175","Bug","XML",5,"Cannot call methods or access properties on MenuItems declared in markup","""DESCRIPTION:  Cannot call methods or access properties using the `id` attribute of MenuItems created in XML markup.  Related feature ticket: ALOY-1098    REPRODUCTION:  Run the Alloy application below.  Hit the Expand or Collapse action items or try to expand the action view from the overflow menu.    RESULTS:  Trying to call a method or accessing a property results in 'Cannot read property of undefined` or `Cannot call method X of undefined`.                `index.xml`      `index.js`      Classic Examples:      """
"ALOY-1209","Bug","XML",8,"Compile error when a view's attribute contains an escaped quote","""The following view:        Will result in the following compile error:        I'd expect this to work fine since the {{""""}} is escaped?"""
"ALOY-1225","Bug","Builtins",3,"social.js authorize UI crashes on android","""Upon calling the 'authorize' method, the loading view opens and then immediately crashes, resulting in the following error.     [INFO] :   libc: Fatal signal 11 (SIGSEGV) at 0x00000014 (code=1), thread 2206 (KrollRuntimeThr)    The behavior is consistent. However, if I open and close a facebook authorize dialog before opening the twitter authorize dialog, the twitter dialog will usually work. The issue may lie in the """"popIn"""" animation: it appears that the window expands beyond the mobile screen viewport, and will crash at about the time the window should zoom back into the viewport.   See the attached video for a demo of the bug.     Functionality is fine in iOS v 8.1.     Other notes:  * Line 514 of the social.js file makes us of the deprecated """"Ti.UI.AUTODETECT_NONE""""   * The default navigation/action bar at the top becomes visible"""
"ALOY-1195","Improvement","Samples & Templates|Tooling",3,"Alloy Migrations: Template up.down functions do not match documentation","""When generating a migration with the Alloy CLI (1.5.1), the generated file has this code:      But documentation uses 'migrator' in place of 'db' for the function parameter.    Since the passed-in object itself has a 'db' parameter, the 'migrator' naming helps to avoid potential confusion.    migrator.db.execute(...)    vs.    db.db.execute(...)"""
"ALOY-1206","Bug","Tooling",8,"Alloy compiler doesn't regenerate controllers if only change is made to the distribution target","""When building for a different target environment (development, test or production) conditional code in {{app/alloy.js}} is not updated in {{Resources/\[platform\]/app.js}}. This can cause serious errors when relying on the conditions for particular behaviour in ad-hoc and app store builds.    h1. Test case    1. Create a project: {{ti create -t app -p ios -n conditions --id test.conditions -d .}}  2. Make it Alloy: {{cd conditions && alloy new}}  3. Insert the following snippet in both {{app/alloy.js}} and {{app/controllers/index.js}}:        4. Build the production for Simulator: {{ti build -p ios -b}}  5. Confirm that both {{Resources/iphone/app.js}} and {{Resources/iphone/alloy/controllers/index.js}} only have {{console.debug(""""if (ENV_DEVELOPMENT)"""");}} which is correct  6. Build for ad-hoc or to device: {{ti build -p ios --target dist-adhoc}}  7. Confirm that {{Resources/iphone/app.js}} still has {{console.debug(""""if (ENV_DEVELOPMENT)"""");}} while {{Resources/iphone/alloy/controllers/index.js}} is correctly updated to have {{console.debug(""""if (ENV_PRODUCTION)"""");}}"""
"ALOY-1202","Bug","Samples & Templates",3,"Update ti.paint module in HarnessTemplate with a 64-bit compatible version","""The HarnessTemplate includes the ti.paint module for use with the test/apps/advanced/native_modules sample. The version included is 32-bit only. Update to a 64-bit version.    Incidentally, there is an Android version of this module. The sample app could be updated to work on both iOS and Android (it is iOS-only currently)."""
"ALOY-1215","Bug","Samples & Templates",3,"Samples: Alloy RSS Reader sample does not work on iPad","""This is not a regression as the issue occurs in SDK 3.4.0.GA as well.    Steps to Reproduce:  1. Import the Alloy - RSS Reader sample in studio  2. Run the sample project on iPad device or simulator    Actual Result:  The app installs and launches successfully but does not show any content. Only waiting spinner is shown continuously.    Expected Result;  The RSS Reader sample app should show the RSS feeds"""
"ALOY-1205","Bug","Samples & Templates",2,"Alloy launch image for 667h has the wrong filename","""It is named {{Default-Portrait-667h@2x.png}} but should be {{Default-667h@2x.png}} like the classic template has:    https://github.com/appcelerator/titanium_mobile/tree/master/iphone/templates/app/default/template/Resources/iphone    PR: https://github.com/appcelerator/alloy/pull/637"""
"ALOY-1210","Improvement","Runtime",5,"Alloy: Add support for DIST in the Project Configuration File","""Recently, in Alloy 1.4.0 {{DIST_ADHOC}} and {{DIST_STORE}} were added the options for [conditional code in controllers|http://docs.appcelerator.com/titanium/latest/#!/guide/Alloy_Controllers-section-34636384_AlloyControllers-ConditionalCode].    I'd like to also have support the same conditions in {{config.json}}.    The use case would be to have different endpoints, keys or other configuration variables for production ad-hoc builds and production store-builds.    Example:    """
"ALOY-1207","Improvement","Themes",5,"Alloy: Theme ""lib"" folder","""Although there's no real difference between the Alloy {{assets}} and {{lib}} folder, themes should also support the latter so that to theme a utility module you have in {{app/lib/util.js}} you no longer need to put this in {{app/themes/mine/assets/util.js}}.    PR incoming.."""
"ALOY-1232","Bug","Tooling",5,"--deploy-type ignored on android builds for emulator and device","""h4. Problem Description  The argument --deploy-type or -D is ignored if the target is android, always generating 'development' for emulator and 'test' for device, even if specified the other way. iOS works fine. I didn't test all the others platforms.    h4. Steps to reproduce  Since we use these settings to trigger our testing scripts, figured I'd give it a test. Ti.App.deployType seems to work fine here. But your settings from the config.json file do not.  added the following to my alloy.js to test faster:      Results:  Genymotion Google Nexus 5 - 5.0.0 - API 21 - 1080x1920 (5.0.0)        Genymotion Samsung Galaxy S5 - 4.4.4 - API 19 - 1080x1920 (4.4.4)        Device Samsung S4        h4. Steps to reproduce  I used these commands for testing:                  h4. Extra info  Seems like CFG.js doesn't get updated under resources once you switch the deployType flag. Deleting the content of Resources (aka forcing regeneration of CFG.js) will go and use the right config."""
"ALOY-1214","Improvement","Samples & Templates",3,"Button in Inheritance sample app difficult to click on iOS","""Steps    1.Build and run https://github.com/appcelerator/alloy/tree/master/test/apps/advanced/inheritance on an iPhone device or simulator.  2. Try to click the baseDialog button.    Results: Because the button is partially covered by the status bar it's hard to click, even with a mouse pointer.  Expected: Button easy to click with finger or mouse.        """
"ALOY-1285","Bug","Styling",5,"TSS conditional statement is ignored by items dynamically generated on runtime","""Below is the sample of the TSS condition statement:  """".date[if=false]"""": {   backgroundColor: """"#f00""""   }    This always gets executed, even if logically it shouldn't be.  It happens to elements created on runtime by this code:    label = $.UI.create('Label', { text: displayDate, classes: ['date']} );"""
"ALOY-1216","Improvement","Tooling",5,"Speed compilation by enabling selective compiles of specified files","""Community PR https://github.com/appcelerator/alloy/pull/625     * PR needs testing to confirm it works as described and introduces no side-effects/regressions  * Add unit tests  * Open related docs tickets, update ALOY-757 & ALOY-620 as needed.  """
