"issuekey","type","components","storypoint","title","description_text"
"ALOY-1097","Improvement","Samples & Templates",3,"Update Popover samples to use contentView in all cases","""Adding views to contentView is the preferred technique. Adding views directly to the popover might still work, but our samples should not show that technique.    Need to update:    * test/apps/ui/popover  * test/apps/testing/ALOY-983"""
"ALOY-1108","Bug","Samples & Templates",2,"Some .svn directories slipped into the GIT repo of Alloy","""Dear Alloy guru's, I found some .svn folders in the GIT repo that break an SVN checkout. It's minor I know, but just to let you know. Thanks, Wouter Monkhorst"""
"ALOY-1127","Bug","Models",13,"Alloys Data Binding feature does not respect formFactor property","""Similar to ALOY-691 the same example fails if using the {{formFactor}} attribute. See following example using Alloy 1.4.1 . It results in a crash.    {code:title=views/index.xml}  <Alloy>      <Collection src=""""test"""" />      <Window id=""""index"""" platform=""""ios"""" formFactor=""""tablet"""">          <View id=""""content"""" dataCollection=""""test"""" dataFunction=""""render"""">              <View></View>          </View>      </Window>      <Window id=""""index"""" platform=""""ios"""" formFactor=""""handheld"""">          <TableView>              <TableViewRow dataCollection=""""test"""" dataFunction=""""render"""">                  <View></View>              </TableViewRow>          </TableView>      </Window>  </Alloy>      {code:title=models/test.js}  exports.definition = {       configuration : {      """"columns"""": {        """"username"""":""""string""""      },      """"adapter"""": {        """"type"""": """"sql"""",        """"collection_name"""": """"test""""      },    },       extendModel: function(Model) {         _.extend(Model.prototype, {});         return Model;    },       extendCollection: function(Collection) {         _.extend(Collection.prototype, {});         return Collection;    }  }    exports.destroy = function() {      __alloyId5.off(""""fetch destroy change add remove reset"""", render);      __alloyId12.off(""""fetch destroy change add remove reset"""", render);  };    'undefined' is not an object (evaluating '__alloyId5.off')  {code}    Link to Q&A: http://developer.appcelerator.com/question/176639/alloys-data-binding-feature-does-not-respect-handheld-property"""
"ALOY-1103","Bug","XML",5,"<headerview formFactor=""handheld""> not working and throwing an error","""h5. Problem description    formFactor='handheld' is not correctly applied if applied to <HeaderView> object.  Depending on the target, could either be not visible or crashing the app.      h5. Steps to reproduce    Use the following sample code:    h6. index.xml        h6. index.tss      1. Build and run on Android Tablet (tested with Google Nexus 7 4.3)    Expected result:  App runs. Both Headerview and View are not visible.    Result:   App crashes with the following error log:        2. Build run on iOS tablet  Result: app runs. <Headerview> and <View> are not visible as expected    3. Build run on Android and iOS handheld  Result: app runs. <Headerview> however is not displayed, while <View> is correctly displayed as expected.   Expected result: <Headerview> should be displayed."""
"ALOY-1102","Bug","XML",3,"Module for ListView is not working when using SDK 3.2.3","""h2. Description  Following ticket ALOY-1082 I tried to create a module for ListView. While the code (pasted below) works fine using SDK 3.3.0.GA, an error is thrown when building with 3.2.3.GA.    h2. Code  Code as proposed by [~skypanther] is the following:    lib/customlist.js        index.xml        index.js        h2. Error    Following the error when running the app on iOS Simulator:    """
"ALOY-1105","Bug","Tooling",5,"Widget assets are not copied to the compiled app","""In testing widgets, I've found that widget assets are not copied to the compiled app.    Steps to reproduce:    1. Make sure you're using a 1.5.0 branch of Alloy  2. From the repo directory, run {{jake app:run dir=ALOY\-898}} This sample app happens to use the loading widget, which contains a set of graphic assets.  3. When the app opens, click Open Window. You'll see messages in the console that the image assets cannot be found.  4. Copy the file path from one of those log messages. Open Finder and choose Go, Go to Folder. Paste in that path -- before you click Open, change the two instances of %20 to spaces in the path.  5. Right-click Harness.app and choose Show package contents. There should be an images/com.appcelerator.loading folder containing simlinks to a set of PNG assets. It's not there.  6. Change to Alloy 1.4.1 and repeat the preceding steps. The images will be there."""
"ALOY-1104","Bug","Tooling",5,"Fail build with clear message if controllers/index.js is missing","""h6. Problem description  Build fails on Android if the 'asset' folder is being deleted from the app project and is also not present in the Resources files folder.     h6. Steps to reproduce  1. Create a new Alloy project  2. Delete everything in app folder except """"views/index.xml"""" and """"controllers/index.tss"""". Also delete config.json and alloy.js files.   3. Run on Android    Result: app build and does not properly start with error:    """
"ALOY-1107","Improvement","Styling|Tooling",2,"Rollback Theme ""i18n"" and ""platform"" folders implementations","""Remove changes made to Alloy to implement this feature. A better solution has been proposed to handle this at the platform level and Alloy can then use it to more safely theme these folders."""
"ALOY-1220","Improvement","Tooling|Widgets|XML",13,"Widgets can not be used in ListView Templates","""When leveraging templates in a ListView, the alloy compiler fails when trying to compile an ItemTemplate that contains a Widget tag."""
"ALOY-1113","Bug","Samples & Templates",3,"Fix case on 'alloy info adapters' command output","""""""alloy info adapters"""" command returns the contents of description in the tag name """"description"""". However, """"alloy info samples"""" (or even templates) have the contents in """"Description"""" tag/field. Studio is expecting the same tag for all samples, templates and adapters. I believe the tag name has to be """"Description"""" for all commands."""
"ALOY-1112","Improvement","Styling",3,"Styles TSS: Support spaces in comma-separated lists of targets in the platform attribute","""h5. Improvement description  See ALOY-1090  Spaces in comma-separated lists of targets in the platform attribute could be supported also in styles .TSS.    For example:  1. Create a new project and use the following code:      2. Run on android and ios.    Result:  In this case, no errors are displayed and the only the first target is (android) is currently recognized and styles applied.    Expected result:  Both target platforms should be recognized."""
"ALOY-1229","Bug","Tooling|XML",5,"iOS: ListView filling template incorrectly","""The ListView is not filling out incorrectly. The first label """"#faultyLabel"""" should be replace with text and have a backgroundColor=""""magenta"""", but what's happening is a new label is appearing behind the next line, with its backgroundColor=""""magenta"""" and the text either not displayed or displayed out of view.    Create a new Alloy project and drop the three attached files to see the issue. The ListView works correctly in Android (screenshot also attached)"""
"ALOY-1115","New Feature","Samples & Templates|Tooling",3,"CLI command to create a project from an Alloy test case ","""In a recent email thread, [~skypanther] had an idea to add an {{alloy}} CLI to create a new Alloy project from a given sample, e.g. {{alloy create_sample basics/simple}}. Moar:    bq. ...The samples are actually installed to the developer’s computer...as is a shell/template app. Such a command could merge the two, putting the resulting files in the developer’s workspace directory.      There is also a [doc ticket|TIDOC-1849] to better expose the samples, but this type of tool enhancement would be nice, too.  """
"ALOY-1240","Improvement","Styling|Tooling",5,"Date picker type cannot be specified in the TSS","""views/index.xml contains:      styles/index.tss contains:      Result: Date picker shows as expected.    However, when the type definition is moved into the .tss (usual case):    views/index.xml contains:      styles/index.tss contains:      Result: The entire picker is not displayed at all. The class .datePicker is not defined anywhere else in index.tss. Any attempts to assign a date value to the picker results in an app crash.      This was tested on a Samsung Galaxy Note 2 LTE running Android 4.3. Project is based on the Default Alloy Project template."""
"ALOY-1116","Improvement","Models",5,"sql sync adapter: optimize update method for adding/updating models","""Community PR: https://github.com/appcelerator/alloy/pull/518    The proposed change should offer speed improvements but implements no functional changes (in other words, existing code should continue to work).    Per the comment on the PR: Consider adding a batch update method that would be faster because it would process all model changes in a single SQL statement rather than by opening repeated connections to the database. (Likely that's a separate ticket)"""
"ALOY-1221","Improvement","Tooling|Widgets|XML",0,"Support Widgets and Require in ListItem Templates","""Currently, it is not possible to use <Widget> or <Require> within a ItemTemplate like this:        Alloy Compiler fails with error:        as described in https://jira.appcelerator.org/browse/ALOY-611"""
"ALOY-1121","Improvement","Tooling",3,"Update extract-i18n command to extract strings from XML files in addition to TSS","""Community PR https://github.com/appcelerator/alloy/pull/527    Ticket is to test, confirm functionality and applicability."""
"ALOY-1122","Improvement","Tooling",3,"Consistent naming for platform-specific folders","""There is a discrepancy in the naming of the folder for iOS-specific resources in the Alloy file structure.    For assets and libs, the folder is called """"iphone"""".    For controllers, views, and styles, the folder is called """"ios"""".    I think we should have one consistent folder name for Alloy."""
"ALOY-1123","Improvement","Styling",2,"When a new project is created in Appcelerator Studio app.tss should be created","""When a new project is created in Appcelerator Studio app.tss should be created since it is not.    This is similar to the alloy.js file which is included as an empty file with instructions as to what would go inside    app.tss holds global styles"""
"ALOY-1125","Bug","Runtime",8,"Alloy: Button - Click event doesn't trigger","""Click event doesn't trigger correctly. After few (~3) clicks the event is not triggered at all. Button basically behave as it was without any event listener.    Please look at it ASAP.    index.js (only)  """
"ALOY-1124","Bug","XML",3,"When using view-model binding, whitespace outside curly braces for ImageViews crashes the app","""h5. Problem description  When using view-model binding, putting a whitespace outside curly braces, in the quotes, when using ImageViews, crashes the app    h5. Steps to reproduce  1. Grab the sample code for https://jira.appcelerator.org/browse/ALOY-716 : https://github.com/appcelerator/alloy/tree/master/test/apps/testing/ALOY-716  2. Run on iOS  Result: app crashes with following error:      3. Edit index.xml and remove the space outside the curly braces for the ImageView object, changing into something like this:    and run.  Result: app is not crashing but the binding is also lost, therefore also reopening https://jira.appcelerator.org/browse/ALOY-716    h5. Note  Not reproducible with Alloy 1.4.1, therefore is a regression."""
"ALOY-1132","Bug","Samples & Templates",2," 'testing/ALOY-1058' sample code is using quoted type value","""h5. Problem description  Sample code for ALOY-1058 is using a value for the type property with quotes, while, setting the type from the TSS, it should be used with no quotes.  Not a regression.     From the sample code """"index.tss"""", type is defined in this way:      while type should be:      h5. Steps to reproduce  1. Run the sample code  Result: Running the sample, the picker is actually showing DATE as a type when run, but the constant values should be used with no quotes in the TSS.  Here is the compiled code from Resources/iphone/alloy/controller/index.js:      2. Change index.tss picker stile to:      Result: compiled code is:       However, DATE type picker is still shown (not DATE_AND_TIME).  Considering the generated code, this could be a behavior issue relative to how SDK is handling the Picker type property, not Alloy. Investigating and creating a Classic Titanium sample.    3. Change the picker style to:       Result: Picker DATE_AND_STYLE is shown. Compiled code also looks good:      h5. Note  My suggestion for the sample is to use the DATE_AND_TIME picker as type in case of iOS.  i.e.  """
"ALOY-1131","Bug","Samples & Templates",2,"ALOY-1028 sample test is not included in master or 1_5_X branch","""ALOY-1028 sample test is not icluded in master or 1_5_X branch  In present in 1_4_X branch (and works fine with latest 1_5_X). """
"ALOY-1130","Bug","Samples & Templates",2,"""ui/map"" sample code error for mobileweb","""h5. Problem description  Ui/Map module sample is not runnable on MobileWeb for a typo in the code    h5. Steps to reproduce  1. Import ui/map sample  2. Run in MobileWeb  Result: 'Uncaught reference - ti is not defined at /index.html'    The code for MobileWeb is       """"ti.map"""" should be changed into """"Ti.Map"""".  """
"ALOY-1129","Improvement","Models",3,"Delete method shouldn't reset model's id","""Community PR https://github.com/appcelerator/alloy/pull/547    """"Model's ID should not be deleted (reset) in the adapter. The problem is that after the Sync is done Backbone will trigger destroy which will execute a method called _onModelEvent -> remove ,but model doesn't have an id anymore ,so it won't be deleted from a collection - set _byId. If you try to add a new model to the collection with the same ID, backbone will not allow you to do that because the ID already exists in the set."""""""
"ALOY-1134","Improvement","Samples & Templates",3,"Add @3x images and new icon sizes to new-app templates and samples","""To support the iPhone 6/6+ screen sizes, we will need to add new icons and launch screen images to our new-app templates and samples.    See https://developer.apple.com/library/prerelease/ios/documentation/UserExperience/Conceptual/MobileHIG/IconMatrix.html#//apple_ref/doc/uid/TP40006556-CH27-SW1 for the complete list.    For iPhone 6, launch images:     750 x 1334 (@2x) for portrait  1334 x 750 (@2x) for landscape    For iPhone 6 Plus:    1242 x 2208 (@3x) for portrait  2208 x 1242 (@3x) for landscape    New icons: 180x180, 120x120, 87x87 """
"ALOY-1133","Bug","Models|Tooling",3,"Alloy 1.5b fails to build a project using Napp Drawer if one of the menus is <Required> ed in.","""h4. Expectation  Project to build    h4. Reality  Project doesn't build    """
"ALOY-1135","Bug","Styling",2,"iOS: TextField: Textfield is not visible on window when styles applied in tss file","""Textfield not visible on window when styles applied in tss  Not a regression. Since issue occurs with 3.3.0.GA also    *Steps to reproduce:*  1. Create Alloy Project. Replace the js files with code mentioned below  2. Run the app.    index.js:      index.xml:      index.tss:      {color:green}*Expected Result:*{color}  2. Textfield must be visible.    {color:red}*Actual Result:*{color}  Textfield is not visible.    Note: if the styles are applied on xml file itself. Then Textfield is visible.      """
"ALOY-1137","Bug","Samples & Templates",3,"Jake: not able to run project from Studio on Genymotion if not manually editing tiapp.xml","""h5. Problem description  After using Jake to import, setup and run an Alloy project in Appcelerator Studio, is not possible to run it on Genymotion emulators if not manually editing first tiapp.xml.    h5. Steps to reproduce  1. Import the Harness project in Appcelerator Studio  2. Import any Alloy project using Jake.  ex.    3. Run on Genymotion simulator the Harness project from Studio.    Result:  App fails to build and run      3. Open tiapp.xml and save. Run again.  Result: project build and run and expected.    Seems to be reproducible only when building/running on Genymotion. Android Emulator and Android device launch as expected."""
"ALOY-1139","Story","Tooling",8,"Investigate options for automated testing","""Investigate the use of tiO2 for automated runtime testing to improve our test coverage and improve quality for Alloy development."""
"ALOY-1138","Bug","Appcelerator Studio|Tooling",3,"Error creating a new Widget from Studio if config.json is not present","""h5. Problem description  If no config.json file is present, creating a new Widget returns an error.    h5. Steps  1. Create a new Alloy project  2. Delete config.json file in the root project folder  3. From Appcelerator Studio, left click and create a new Widget    Result: a problem occurred creating a new widget.  Widget folder is created but config.json file is not found and an error is thrown.      Ideal result would probably be to automatically create a default config.json file and add in there the informations regarding the new created Widget.    If config.json file is removed, then, in order to create a new Widget, the user has to re-create manually a new config.json file just including : {{ {} }}      h5. Note  Not a regression.   """
"ALOY-1140","Bug","Appcelerator Studio",8,"Windows: The path format for app.js is different from controller files in sourcemap","""The sourcemap contains different source location path format for app.js file compared to controller files on Windows platform.    The map file for app.js is :      The map file for index.js is :      Due to the difference of path formats, Studio fails to parse the paths and the debugger fails to stop at the expected breakpoints.    We need to investigate the difference in the path generation and ideally, in order to handle the paths consistently across all platforms, it might be better to have the paths in unix format."""
"ALOY-1142","Bug","Samples & Templates",2,"iOS: ALOY-720 sample: <NavigationGroup> object needs to be changed to <NavigationWindow>","""h5. Problem description  <NavigationGroup> is no longer supported for iOS. Instead, NavigationWindow object should be used.     Sample https://github.com/appcelerator/alloy/tree/master/test/apps/testing/ALOY-720 needs to be updated as still using NavigationGroup and currently failing to run.     Ideally, a mobileweb folder using NavigationGroup should be created in the sample."""
"ALOY-1141","Bug","Samples & Templates",3,"iOS, Jake: Harness project from Studio on iPhone simulators might use wrong Sim version","""h5. Problem description  Following https://jira.appcelerator.org/browse/ALOY-956, SDK hardcoded version has been removed from tiapp.xml when importing a project in the Harness project.    Using iOS 8 simulators and Studio this could lead to running a wrong Simulator version if running the project just after importing it without first editing tiapp.xml    h5. Steps to reproduce  1. Import Harness project in Studio (included in <alloy repo>/test/projects/Harness  2. Setup a sample test.  For example:    3. Run the project from Studio on iOS8>iPhone6+ simulator    Result: iPhone 5S/iOS8 simulator is launched instead    4. Edit tiapp.xml from Studio. Studio will add tiapp.xml version selected from """"ti sdk select"""". Change nothing but save and close. Run the project again on iOS8>iPhone6+ simulator  Result: iPhone6+ simulator is correctly launched now.     h5. Note  Apparently this happens only for iOS 8 simulators.   Been able to launch the desired Simulator version choosing OS v7.1 or v7.0.3 """
"ALOY-1145","Story","Testing",2,"Add ALOY-1144 test case app to master branch","""A community pull request for ALOY-1144 was merged to master. It did not include a test app. I added one for the corresponding PR I created to implement the fix in the 1_5_X branch. This ticket is to add that test app to the test/apps/testing folder for the master branch."""
"ALOY-1144","Bug","Styling",3,"Alloy: createStyle turns proxy objects into JS objects","""In Alloy 1.5.0 [{{Alloy.createStyle()}}|https://github.com/appcelerator/alloy/blob/master/Alloy/lib/alloy.js#L233] uses a new utility method [{{deepExtend}}|https://github.com/appcelerator/alloy/blob/master/Alloy/lib/alloy.js#L609] to clone the merged properties. However, because of its implementation a proxy object like the transform passed as a default in the following example [will be turned into a JS object|https://github.com/appcelerator/alloy/blob/master/Alloy/lib/alloy.js#L652]:    {code:js}  $.someView.animate($.createStyle({    id: 'someId',    transform: Ti.UI.create2DMatrix().scale(.5, .5),    duration: 500  }));  {code}    I have a PR to fix {{deepExtend}} by checking for {{.__prototype}} before cloning objects:    - https://github.com/appcelerator/alloy/pull/567"""
"ALOY-1152","Bug","XML",5,"Alloy 1.5.0 RC3: Compiler fails on TextArea with child control","""Problem:    Placing a child control inside a TextArea that is part of a ListView template causes the Alloy compiler to fail with:    {quote}  [ERROR]  Cannot read property 'symbol' of undefined  [ERROR]  Alloy compiler failed  {quote}    Test:     Build the sample code below.    {code:title=index.xml}  <Alloy>   <Window>          <ListView>              <Templates>                  <ItemTemplate name=""""tMsg"""">                      <TextArea bindId=""""cMsg"""">                          <Label bindId=""""lHintText"""" />                      </TextArea>                  </ItemTemplate>              </Templates>              <ListSection>                  <ListItem itemId=""""liMessage"""" template=""""tMsg"""" />                                  </ListSection>          </ListView>   </Window>  </Alloy>  {code}      If you remove {{<Label bindId=""""lHintText"""" />}} from the TextArea control. It compiles fine.      The code above worked fine under Alloy 1.3 and 1.4.    """
"ALOY-1149","Bug","Styling",5,"iOS: Gradient array properties are converted into objects","""h5. Problem description  Gradients contain properties as array, for example the 'color' property.   In Alloy, those properties are now converted and passed as objects and an app is crashing if using those properties.     The issue seems to be introduced after ALOY-1051 as is not reproducible using Alloy version 1.4.1 (and Alloy 1.5.0-rc3 as well - see ALOY-1146, where a regression was introduced breaking Aloy-1051), but is reproducible with Alloy 1.5.0-rc, 1.5.0-rc2 and 1.5.0-rc5.  Is therefore a regression.    h5. Steps to reproduce  1. Grab the sample code for ALOY-717 : https://github.com/appcelerator/alloy/tree/master/test/apps/testing/ALOY-717  2. Run the sample app on iOS (any version)  Result: App crashes with an """"Application Error - Invalid type passed to function at alloy.js""""  See error log attached and screenshot.     3. Edit index.tss and comment the 'colors' property for .bgGradient class:    and run on iOS devices  Result: app runs fine and no error are thrown.   """
"ALOY-1148","Improvement","Samples & Templates",2,"Update model template code to include Backbone 1.1.2 support code","""Per ALOY-1074, if a developer uses Backbone 1.1.2 (rather than the default 0.9.2), he/she must extend the collection definition to account for a breaking change in backbone.    Add this to the modelcode.js template file to provide guidance to developers attempting to use this feature.    """
"ALOY-1150","Bug","Documentation",1,"Release notes: there is no date for the 1.5.0 release","""h5. Problem description  A date for the 1.5.0 release should be added to the release notes.  Alloy CHANGELOG.md in the Github 1.5.0 branch currently says:      Therefore the current release date (09/29/2014) should be added.  """
"ALOY-1156","Improvement","Documentation",2,"Update readme to prune outdated information","""Text in the Getting Started, Additional Notes, Feedback, Contributing, and Contributors sections is perhaps dated. We should confirm that text still applies and prune outdated or extraneous information as needed.    Add info on the new --testapp attribute in the Running Sample Test Apps section    Update jakelib/readme.md to note commands to use with the new iOS8 simulators (how to launch a specific sim)`  """
"ALOY-1163","Bug","Runtime|Styling",5,"Using $.UI.create on a ListView with Custom Data templates causes to hide rows when templates are created programmatically.","""h4. Problem Description  When using the $.UI.create function for ListViews using custom item templates causes the listitems not to show.    h4. Steps to reproduce  1. Create a new mobile project  2. Add this testcase  h4. index.xml:      h4. index.js (Example from docs)      However, switching to Ti.UI.create<Type>() {} works:  index.js:    3. Test in device    h4. Results  According to the Appcelerator documentation Alloy Dynamic Styles """"Since Alloy 1.2.0, Alloy supports changing styles dynamically or during runtime. There are two methods to support dynamic styling in Alloy. You can either generate a dynamic style dictionary that can be passed to applyProperties or a create method, or modify TSS class styles to an existing component on the fly.""""    Using """"$.UI.create"""" in SDK 3.4.0.GA and Alloy 1.5.1 causes listview rows hide. Whether in SDK 3.3.0.GA and Alloy 1.4.0 it works fine.    h4. Extra information  Both examples used to work in Ti SDK 3.3.X and iOS 7.X and Alloy 1.4.X  """
