"issuekey","type","components","storypoint","title","description_text"
"CLOV-1143","Suggestion","Documentation",1,"Remove obsolete pages from Clover 3.1 space","""Hi Melanie,    May I ask your team to delete following pages from CLOVER space? All of them are obsolete or available in spaces for older Clover releases. They are unnecessarily cluttering current documentation.     https://confluence.atlassian.com/display/CLOVER/Changes+in+2.6.3.2+for+IDEA  https://confluence.atlassian.com/display/CLOVER/Changes+in+2.6.3+for+IDEA  https://confluence.atlassian.com/display/CLOVER/Changes+in+2.6.0+for+IDEA  https://confluence.atlassian.com/display/CLOVER/Changes+in+2.5.1+for+IDEA  https://confluence.atlassian.com/display/CLOVER/Changes+in+2.5.0+for+IDEA  https://confluence.atlassian.com/display/CLOVER/Changes+in+2.4.3+for+IDEA  https://confluence.atlassian.com/display/CLOVER/Changes+in+2.4.2+for+IDEA  https://confluence.atlassian.com/display/CLOVER/Changes+in+2.4.1+for+IDEA  https://confluence.atlassian.com/display/CLOVER/Changes+in+2.4.0+for+IDEA  https://confluence.atlassian.com/display/CLOVER/Changes+in+2.3.2-beta5+for+IDEA  https://confluence.atlassian.com/display/CLOVER/Changes+in+2.3.2-beta4+for+IDEA  https://confluence.atlassian.com/display/CLOVER/Changes+in+2.3.2-beta3+for+IDEA  https://confluence.atlassian.com/display/CLOVER/Changes+in+2.3.2-beta2+for+IDEA  https://confluence.atlassian.com/display/CLOVER/Changes+in+2.3.1-beta1+for+IDEA    https://confluence.atlassian.com/display/CLOVER/Changes+in+2.6.3+for+Eclipse  https://confluence.atlassian.com/display/CLOVER/Changes+in+2.6.2+for+Eclipse  https://confluence.atlassian.com/display/CLOVER/Changes+in+2.6.0+for+Eclipse  https://confluence.atlassian.com/display/CLOVER/Changes+in+2.5.1+for+Eclipse  https://confluence.atlassian.com/display/CLOVER/Changes+in+2.5.0+for+Eclipse  https://confluence.atlassian.com/display/CLOVER/Changes+in+2.4.3+for+Eclipse  https://confluence.atlassian.com/display/CLOVER/Changes+in+2.4.2+for+Eclipse  https://confluence.atlassian.com/display/CLOVER/Changes+in+2.4.0+for+Eclipse  https://confluence.atlassian.com/display/CLOVER/Changes+in+2.3.2+for+Eclipse  https://confluence.atlassian.com/display/CLOVER/Changes+in+2.3.1+for+Eclipse  https://confluence.atlassian.com/display/CLOVER/Changes+in+2.2.1+for+Eclipse  https://confluence.atlassian.com/display/CLOVER/Changes+in+2.1.0+for+Eclipse  https://confluence.atlassian.com/display/CLOVER/Changes+in+2.0.3+for+Eclipse  https://confluence.atlassian.com/display/CLOVER/Changes+in+2.0.2+for+Eclipse  https://confluence.atlassian.com/display/CLOVER/Changes+in+2.0.1+for+Eclipse  https://confluence.atlassian.com/display/CLOVER/Changes+in+2.0.0+for+Eclipse  https://confluence.atlassian.com/display/CLOVER/Changes+in+2.0.0.b2_1+for+Eclipse    https://confluence.atlassian.com/display/CLOVER/Changes+in+2.6.3+for+Ant  https://confluence.atlassian.com/display/CLOVER/Changes+in+2.6.2+for+Ant  https://confluence.atlassian.com/display/CLOVER/Changes+in+2.6.0+for+Ant  https://confluence.atlassian.com/display/CLOVER/Changes+in+2.5.1+for+Ant  https://confluence.atlassian.com/display/CLOVER/Changes+in+2.5.0+for+Ant  https://confluence.atlassian.com/display/CLOVER/Changes+in+2.4.3+for+Ant  https://confluence.atlassian.com/display/CLOVER/Changes+in+2.4.2+for+Ant  https://confluence.atlassian.com/display/CLOVER/Changes+in+2.4.0+for+Ant  https://confluence.atlassian.com/display/CLOVER/Changes+in+2.3.2+for+Ant  https://confluence.atlassian.com/display/CLOVER/Changes+in+2.3.1+for+Ant  https://confluence.atlassian.com/display/CLOVER/Changes+in+2.3.0+for+Ant  https://confluence.atlassian.com/display/CLOVER/Changes+in+2.2.1+for+Ant  https://confluence.atlassian.com/display/CLOVER/Changes+in+2.2.0+for+Ant  https://confluence.atlassian.com/display/CLOVER/Changes+in+2.1.0+for+Ant  https://confluence.atlassian.com/display/CLOVER/Changes+in+2.0b2+for+Ant  https://confluence.atlassian.com/display/CLOVER/Changes+in+2.0b1+for+Ant  https://confluence.atlassian.com/display/CLOVER/Changes+in+2.0a5+for+Ant  https://confluence.atlassian.com/display/CLOVER/Changes+in+2.0a4+for+Ant  https://confluence.atlassian.com/display/CLOVER/Changes+in+2.0a3+for+Ant  https://confluence.atlassian.com/display/CLOVER/Changes+in+2.0a2+for+Ant  https://confluence.atlassian.com/display/CLOVER/Changes+in+2.0a1+for+Ant  https://confluence.atlassian.com/display/CLOVER/Changes+in+2.0.3+for+Ant  https://confluence.atlassian.com/display/CLOVER/Changes+in+2.0.2+for+Ant  https://confluence.atlassian.com/display/CLOVER/Changes+in+2.0.1+for+Ant  https://confluence.atlassian.com/display/CLOVER/Changes+in+2.0.0+for+Ant    https://confluence.atlassian.com/display/CLOVER/Changes+in+2.6.0+for+Maven+2  https://confluence.atlassian.com/display/CLOVER/Changes+in+2.5.0+for+Maven+2  https://confluence.atlassian.com/display/CLOVER/Changes+in+2.4.3+for+Maven+2  https://confluence.atlassian.com/display/CLOVER/Changes+in+2.4.2+for+Maven+2  https://confluence.atlassian.com/display/CLOVER/Changes+in+2.3.2+for+Maven+2  https://confluence.atlassian.com/display/CLOVER/Changes+in+2.3.0+for+Maven+2  https://confluence.atlassian.com/pages/viewpage.action?pageId=110035179  https://confluence.atlassian.com/pages/viewpage.action?pageId=134873325  https://confluence.atlassian.com/pages/viewpage.action?pageId=103710921    https://confluence.atlassian.com/display/CLOVER/%5BTRASH%5D+Using+Clover+for+Maven+2+with+the+gwt-maven-plugin  https://confluence.atlassian.com/display/CLOVER/%5BTRASH%5D+Using+Clover+with+the+GWT-maven+plugin    https://confluence.atlassian.com/pages/viewpage.action?pageId=93683890  https://confluence.atlassian.com/pages/viewpage.action?pageId=71599635  https://confluence.atlassian.com/display/CLOVER/%5BTRASH%5D+Clover-for-Eclipse+User%27s+Guide  https://confluence.atlassian.com/display/CLOVER/%28hidden+draft%29+Clover-for+Eclipse+Upgrade+Guide  """
"CLOV-1144","Bug","Groovy|Maven plugin",3,"Support *.groovy files in src/main/java folder for groovy-eclipse-plugin","""*Problem:*    Clover fails during instrumentation of *.groovy files in case when sources are put in src/main/java directory, instead of src/main/groovy and when the groovy-eclipse-plugin is used.     *Steps to reproduce:*     * create a project with groovy-eclipse-plugin and maven-clover2-plugin   * put a *.groovy file inside src/main/java   * run build    *Expected error:*        A reason is that Java compiler is involved here, Clover is called, it filters out all files which do not have *.java extension and as a consequence it passes wrong argument to CloverInstr.    *Solution:*    1) Add check to AbstractInstrumenter (maven-clover2-plugin) so it does not call CloverInstr in case no matching files are found    2) Add support for src/main/java, src/test/java directories for Groovy - probably in GroovySourceScanner + CloverInstrumentInternalMojo      *Workaround:*    Put Groovy files in correct location i.e. src/main/groovy - they'll be handled correctly by Clover.    *Background:*    According to groovy-eclipse-plugin documentation, they recommend putting groovy files inside java folder - it's not nice, but it's the fastest set-up.     http://groovy.codehaus.org/Groovy-Eclipse+compiler+plugin+for+Maven"""
"CLOV-1150","Bug","Groovy|Maven plugin",5,"Clover does not instrument groovy source files, (groovy-eclipse compiler) when located in src/main/groovy","""When building a groovy project with maven, I am trying to get clover code coverage reports. With all source files in .java and in src/main/java, clover works fine. However, with all source files in .groovy and in src/main/groovy, clover can not instrument the files (clover2:instrument, or clover2:setup).     Everything that I can find is saying that clover versions after 3.1.3 support the maven groovy eclipse compiler (so long as the groovy files are located in src/main/groovy). See this ticket: https://jira.atlassian.com/browse/CLOV-1021?page=com.atlassian.jira.plugin.system.issuetabpanels:changehistory-tabpanel      There is another support ticket that I found that seems to cover the same issue, however I cannot access it. Here is the link  https://support.atlassian.com/browse/CLV-5878    A partial output log is included here. I will try to come up with a small test project that I can upload here. Any help would be appreciated.    """
"CLOV-1149","Suggestion","CEP Plugin",1,"Make possible to see instrumented sources in Clover-for-Eclipse","""Clover-for-Eclipse: Clover instrumentation in performed in memory during compilation. As a consequence when there is any build error, we can see original source only and cannot check whether the problem lies in the Clover instrumenter itself.     For example, in Clover-for-IDEA we can see instrumented sources because they're stored in temporary directory.    To be implemented: add an option to get instrumented sources in Eclipse too."""
"CLOV-1151","Bug","Instrumentation",1,"Clover fails to find coverage snapshot files when IBM JRE is used","""*Problem:* it seems that IBM JRE implementation differs from Oracle JRE in such way that Object.hashCode() can return a negative value. As a consequence, file name suffix generated for coverage snapshot and test slice snapshot may be composed not only of '0-9a-z_' characters, but also have minus """"-"""" sign in it.     As a result such file name does not match regular expression used for searching of coverage files and coverage is not read.     *Workaround:* rename coverage snapshot file(s) and remove """"-"""" character.  """
"CLOV-1162","Suggestion","Ant Tasks|Database",8,"Generate cumulative statement / complexity metric for need of methodContext filtering","""A method context has maxComplexity / maxStatements attributes which allow to reduce the scope of context filter for methods where these metrics are lower than defined level (by default maxComplexity/maxStatements is Int.MAX_VALUE, i.e. all methods are taken into account). Example:    {code:xml}  <methodContext name=""""trivial"""" regexp="""".*"""" maxStatements=""""1""""/>  {code}    However, customer reported a problem that it excludes methods containing inline classes, for instance:    {code:java}  // the getListener() method has only one statement: """"return <object>;""""  // if you use <methodContext name=""""trivial"""" regexp="""".*"""" maxStatements=""""1"""">  // then the whole code block will be filtered-out, including the actionPerformed() method  ActionListener getListener() {     return new ActionListener() {         public void actionPerformed(ActionEvent e) {             System.out.println(""""statement #1"""");             System.out.println(""""statement #2"""");         }     };   }  {code}    In the case above ActionListener() is an inner class so it has their own metrics. And because of fact that context filters are """"cumulative"""" (so that whenever any code pattern is matched, then the whole block is excluded), the whole getListener() method is filtered-out, including inner class.    *Solution:*    We cannot change existing metrics (without breaking backward compatibility) and we cannot change the way how blocks are excluded (it would make no sense). But we can create new metrics called: cumulativeComplexity and cumulativeStatements. It would work as follows:     * for every interface, class, enum or method find all inner classes, interfaces, enums or methods (*)   ** this can be checked by matching occupied code regions (on a database level during metric calculation - preferred) or during instrumentation (code parser)   * calculate cumulativeComplexity and cumulativeStatements by adding cumulative value from all inner objects to current entity complexity/statements value   * add maxCumulativeComplexity / maxCumulativeStatments to Ant clover-setup/clover-instr and Maven clover2:setup / clover2:instr goals   ** html reports would probably remain unchanged (just grey-out)    (*) yes we should make code more flexible in order to make it ready to support code constructs like default methods in Java8 interfaces or Scala's functions inside functions etc   """
"CLOV-1161","Suggestion","CEP Plugin|CIJ Plugin",2,"Add drop-down with two options for coverage","""Add the """"drop-down"""" listbox which will have """"show cumulative coverage"""" and """"show coverage from last run"""" options. It should be added in Eclipse and IDEA.    Note that the """"span"""" option is already available (Window > Preferences > Clover) but we can have either:   * have time-based span or    * set it to 0seconds which means load everything.      Background reason: coverage is cumulative. Some customer have pointed out that coverage data for successive incremental change/save/compile/test cycles can lie and show coverage that's no longer there. That's because we aggregate all coverage data since the last full rebuild. We will hopefully have a better way of showing this in the future. In the meantime, scrubbing the coverage for a project and re-running the tests will show the coverage of tests just run.    """
"CLOV-1160","Suggestion","Ant Tasks|CEP Plugin|CIJ Plugin",2,"Change default sort order in coverage report for packages/classes/methods","""Coverage report - show the least covered packages/classes/methods first. Table should not start with the highest coverage (starting from 100%) at the top, because developer is not interested in code which is already covered and tested, but in white spots. Add the possibility to sort by any column.    Affected: HTML/IDE"""
"CLOV-1159","Suggestion","Ant Tasks|CEP Plugin|CIJ Plugin",1,"Create small legend for Top Risks and Quick Wins in Cloud report","""Currently user does not know what the font size and colour means until he reads the documentation. Add small legend box or at least a single-line description for these two reports.     Affects HTML report as well as Eclipse/IDEA views. """
"CLOV-1157","Suggestion","CEP Plugin",1,"Run with Clover as on a project with no Clover","""Clover-for-Eclipse. When you have a project with Clover disabled, the """"Run with Clover as"""" and """"Run optimized"""" buttons are still active. It makes no sense, buttons should be grayed-out."""
"CLOV-1156","Suggestion","Documentation",1,"Refresh clover.atlassian.com","""The http://clover.atlassian.com/ page was not updated for last 2 years. Re-activate Bamboo builds related with this site to have live data. Add a link to this page on main Clover product page:    http://www.atlassian.com/software/clover/overview  """
"CLOV-1155","Suggestion","CIJ Plugin",2,"Simple installer for Clover-for-IDEA","""When someone downloads the Clover-for-IDEA from www.atlassian.com he gets clover-idea-x.x.x.jar file. What to do next? Of course you have to open IDEA, select Settings > Plugins > Install from disk, but user might not know. Especially when taking into account that """"Install from disk"""" is not available in older IDEA versions.     New feature: provide simple installer for Clover-for-IDEA. When user double-clicks on a JAR, a GUI installer starts (class defined in MANIFEST.MF) which asks for location of IDEA installation. Simple check whether selected folder contains config/plugins directory and copy jar into given location. Show also message how it can be installed from IDEA GUI.    Business value: makes Clover evaluation easier.  """
"CLOV-1154","Bug","CIJ Plugin",2,"Inconsistent popup menu in different IDEA versions","""IDEA 10 and newer is not showing the """"Exclude from compile"""" option when sources are instrumented. In IDEA9 it was working fine. See 'popup_menu_in_ideas.png' screenshot. My suspicion is that IDEA somehow does not treat instrumented file as a source code, thus hiding this option from popup menu.    What's more, when you click on the """"Jump to source"""" it opens the Explorer window, instead of opening the source file in IDEA.    See also:    META-INF/plugin.xml  com.cenqua.clover.idea.CloverPlugin.initComponent()    com.intellij.openapi.actionSystem.IdeActions;      @NonNls String GROUP_COMPILER_ERROR_VIEW_POPUP = """"CompilerErrorViewPopupMenu"""";    com.intellij.compiler.imp.CompilerErrorTreeView.addExtraPopupMenuActions();  """
"CLOV-1165","Bug","Ant Tasks",1,"Fix AbstractAntLogger","""The AbstractAntLogger class logs the message only if Ant Task is not null:        As a consequence, no log is availalbe in case when code it's called outside Ant - problem was found in open-source Gradle Clover Plugin."""
"CLOV-1166","Bug","Groovy|Maven plugin",2,"Clover does not work with Groovy 2.x","""*Problem:*    Clover instrumentation fails for Groovy 2.x with a stack trace like below:        *Reason:*    RecorderGetterBytecodeInstruction extends org.codehaus.groovy.classgen.BytecodeInstruction  and implements a following method:  public void visit(groovyjarjarasm.asm.MethodVisitor methodVisitor)    In Groovy 1.x MethodVisitor is an interface. In Groovy 2.x MethodVisitor is a class. Although RecorderGetterBytecodeInstruction compiles correctly with both Groovy versions, it fails at runtime during bytecode verification, becase visit() method gets different bytecode signature.    *Solution:*    Compile RecorderGetterBytecodeInstruction against two different Groovy versions. Load proper version using reflections at runtime.   """
"CLOV-1167","Bug","Grails Plugin|Groovy",1,"Grails Clover Plugin does not intercept 'testc' compiler","""Grails 2.x has introduced a new compiler for building unit tests (from test/unit directory). The 'testc' task is the *org.codehaus.groovy.grails.test.compiler.GrailsTestCompiler* Build log looks like this:        Clover does not intercept this compiler call (it supports Groovyc, Grailsc, GrailsCompiler). As a consequence unit tests are not instrumented and not included in coverage."""
"CLOV-1170","Bug","Maven plugin",1,"CloverOptimizerMojo does not support full include/exclude syntax","""*Problem:*    CloverOptimizerMojo does not support full include/exclude syntax, which can be handled by maven-surefire-plugin. Two cases are not handled right now:    (1) multiple paths separated by comma       (2) regular expression instead of Ant-style pattern      See: http://maven.apache.org/plugins/maven-surefire-plugin/examples/inclusion-exclusion.html    *Workaround:*    (1) use separate entries, like:      (2) not available; user can try to replace regexp by set of Ant-style patterns      *Implementation:*    CloverOptimizerMojo relies an Ant-style patterns underneath. The CloverOptimizerMojo.createFileSet() method has          fix for (1) - split every element in includes/excludes arrays using the comma delimiter and pass expanded arrays to appendIncludes()    fix for (2) - find all elements from includes/excludes arrays having %regexp keyword, run file search on _directory_ using a filename matcher with regexp, create include/exclude for every file matched  """
"CLOV-1173","Suggestion","Maven plugin",2,"Add maxComplexity / maxStatements for Clover-for-Maven","""Ant has extra maxComplexity and maxStatements attributes available which are not supported in Maven plugin, for example:    in Maven we have _name_ and _regexp_ attributes only:    *Possible solution*    Create <methodContextsExt> which would accept entries like:    Alternatively, extend parsing of existing <methodContexts> tag so whenever it finds the <methodContext> entry it will not treat it as name of new context but as a structure from sample above.    See also [-CLOV-1162-|../browse/CLOV-1162]."""
"CLOV-1177","Bug","CEP Plugin",1,"Errors in ErrorLog when toggling between projects with Dashboard view active","""1) Toggle between cloverized projects. Dashboard visible.    Message: Unexpected URI in the Dashboard view: C:\Users\Marek\.workspace-eclipse-3.4.2\Moneybags\.clover\report\dashboard-eclipse.html          2) Right click on a closed project, which  was cloverized before. Dashboard view visible.     Message: Error creating the dashboard        3) Cloverized project selected in Package Explorer, Dashboard view opened. Close the selected project.    Message: Problem generating Dashboard report      """
"CLOV-1175","Suggestion","Reporting",2,"Make HTML report more consistent about number of classes","""See attached screenshot. HTML report should list interfaces too."""
"CLOV-1185","Bug","CIJ Plugin",2,"Test optimization is broken in IDEA11 and above","""JetBrains have changed sth in IDEA 11 regarding unit test run configuration, as a consequence Clover does not """"see"""" and thus does not optimize all unit tests. Problem does not occur on IDEA 9.x, 10.x, 10.5.x. It is present on IDEA 11.x and probably also on 12.x.    See attached images."""
"CLOV-1184","Bug","CIJ Plugin",1,"Check Now button does not work if project is not opened in IDEA","""Install the latest Clover plugin version in IDEA. Click Settings > IDE Settings > Clover > Auto Update > Check now button.     If project is opened then pop-up is shown that the latest version is already installed. If no project is opened (i.e. you're on a IDEA's welcome page), pop-up is not shown. See attached images.    Problem occurs on IDEA 11.x and 12.x. """
"CLOV-1183","Bug","CIJ Plugin",2,"Cloud Report in IDEA shows interfaces","""Cloud Report in IDEA is inconsistent with a Cloud Report in Eclipse - it shows interfaces, which does not actually have any executable code. It shows also annotations.    Fix: don't list objects (interfaces, classes) which do not have any statements in the Cloud Report. Note that simple check if !isInterface() is not sufficient as interfaces in Java8 will have default methods with code."""
"CLOV-1182","Suggestion","CEP Plugin",3,"Multiple test cases in Test Runs view in Eclipse","""If unit tests are executed several times since the last build, the Test Run view shows multiple test results. Not a bug actually, but it could be improved by showing last results only. See screenshot. Affects all supported eclipse versions. """
"CLOV-1181","Suggestion","CIJ Plugin",2,"Multiple test cases in Test Run Explorer in IDEA","""Quickly click 'run' button in order to execute multiple sets of unit tests in parallel. IDEA runs them in parallel, as a consequence we've got duplicated test cases on a list. See attached screenshot. Affects all supported IDEA versions.     We should have test cases from last test run only."""
"CLOV-1179","Suggestion","Reporting",5,"Highlight whole method body if method is not covered","""If given method was not executed at all, the HTML report shows red highlighting only for method header. It's not a bug in code - our Velocity templates are just written this way. We should highlight the whole method body in red - in the same way as Eclipse/IntelliJ does. See screenshot. """
"CLOV-1178","Bug","CEP Plugin",1,"Fix ruler coloring when include coverage from passed only is enabled","""Eclipse. Java Editor. Left ruler showing coverage colours (green/yellow/blue). Rules shows """"yellow coverage"""" when the """"include from passed only"""" option is enabled. There should be no yellow colour in such case.     Note: source code is highlighted correctly, metrics are fine too.    See screenshot."""
"CLOV-1186","Bug","CIJ Plugin",5,"IDEA12 JavaSourceTransformingCompiler functionality has been removed","""Since build 122.694 Clover 3.1.8 cannot work with IDEA12 EAP, because the """"external"""" build functionality was introduced and the JavaSourceTransformingCompiler is no longer supported. See issue    http://youtrack.jetbrains.com/issue/IDEA-94612"""
"CLOV-1187","Suggestion","Grails Plugin",1,"Don't spam the console with println anytime clover grails plugin is installed","""From looking at the _Events.groovy hooks in the plugin, there are several println statements which will execute in all contexts, not just testing and not just when clover.on is specified. Specifically, the set classpath and compile start/end hooks will happen everytime any Grails command is run.    This is bad practice for a plugin. The println statements should be changed to use the grailsConsole which is available automatically    println """"foo"""" => grailsConsole.log """"foo""""    or grailsConsole.updateStatus """"foo""""    Secondly, this should probably be wrapped in a helper which only prints if the the clover is enabled, ie:    def logStuff(msg) {      if( config.on ) grailsConsole.log msg  }"""
"CLOV-1188","Suggestion","Ant Tasks|CEP Plugin|CIJ Plugin|Maven plugin|Reporting",13,"Aggregate coverage by current author and commit regex","""I love CIJ.  When I use git, I find myself making a lot of commits, and I want to see my test coverage aggregated by the jira ticket I've put in my commit log.  For example, let's say I'm working on a project for 3 days.  I might make 50 commits.  All throughout my development, I'd like to keep a running track of how the test coverage is *for my code, bounded by a commit regex*.  In other words, I'd like to use something like git blame, married with coverage, to give me feedback like """"Hey Zim, the feature you're working on only has 52% coverage"""".  Awesome-er still would be something like the class coverage pane, but using only lines I've changed.  So I could have a window that shows the classes I've changed, and a summary of the coverage for the lines that I've changed, again bounded by a the jira ticket in my commit logs.    This would be crazy to do in something other than a lightning fast DVCS like git or mercurial...but I have totally drunk the git cool aid."""
