"issuekey","type","components","storypoint","title","description_text"
"CLOV-1086","Bug","CEP Plugin|CIJ Plugin|Reporting",2,"Line coverage data is inconsistent","""I'm running 2.4.1 on IDEA 7 and get inconsistent line and branch coverage in the editor: every line that is hit by the a test always gets """"1"""" as the hitcount.  """
"CLOV-379","Bug","Maven plugin",2,"Surefire classpath is incorrect when depending on a jar and a test-jar from the same maven module","""We have two different applications that have the same symptom. Their test cases work properly when executed without clover, but when we run them with clover, they fail because classes or resource files are missing from the classpath.    When running the builds with clover, the test cases are executed multiple times. Only the last time they run they fail. When checking the maven debug output (using the -X option), I found that the last time the test cases are run, a JAR file is missing from the classpath. With both applications it is a jar file from a maven module for which we both depend on the jar and test-jar types of the module.     For example we have the following in the pom.xml file:            <dependency>              <groupId>${parent.groupId}</groupId>              <artifactId>server-data-access</artifactId>              <version>${version}</version>              <type>test-jar</type>              <scope>test</scope>          </dependency>          <dependency>              <groupId>${parent.groupId}</groupId>              <artifactId>server-data-access</artifactId>              <version>${version}</version>          </dependency>    And for some reason, when the test cases are executed for the last time, the following second dependency is not included in the list of jars in the classpath.    I have attached the pom.xml files from the module for which the test cases fail (server-web.pom), the pom.xml files from its parents, the pom.xml file for the module that generates both a jar and a test-jar (server-data-access.pom) and the log file that I get when running maven with the -X option.    This is the classpath when the test cases fail (notice that  /opt/bamboo/Bamboo/xml-data/build-dir/MONITORING-NIGHTLY/monitoring-server/server-data-access/target/server-data-access-1.0.2-SNAPSHOT.jar is missing):  build 20-Nov-2008 08:47:57 [DEBUG]   /opt/bamboo/Bamboo/xml-data/build-dir/MONITORING-NIGHTLY/monitoring-server/server-web/target/test-classes  build 20-Nov-2008 08:47:57 [DEBUG]   /opt/bamboo/Bamboo/xml-data/build-dir/MONITORING-NIGHTLY/monitoring-server/server-web/target/classes  build 20-Nov-2008 08:47:57 [DEBUG]   /opt/bamboo/.m2/repository/xerces/xercesImpl/2.9.1/xercesImpl-2.9.1.jar  build 20-Nov-2008 08:47:57 [DEBUG]   /opt/bamboo/.m2/repository/xml-apis/xml-apis/1.3.04/xml-apis-1.3.04.jar  build 20-Nov-2008 08:47:57 [DEBUG]   /opt/bamboo/Bamboo/xml-data/build-dir/MONITORING-NIGHTLY/monitoring-server/server-model/target/server-model-1.0.2-SNAPSHOT.jar  build 20-Nov-2008 08:47:57 [DEBUG]   /opt/bamboo/.m2/repository/commons-lang/commons-lang/2.1/commons-lang-2.1.jar  build 20-Nov-2008 08:47:57 [DEBUG]   /opt/bamboo/Bamboo/xml-data/build-dir/MONITORING-NIGHTLY/monitoring-server/server-actions/target/server-actions-1.0.2-SNAPSHOT.jar  build 20-Nov-2008 08:47:57 [DEBUG]   /opt/bamboo/.m2/repository/commons-logging/commons-logging/1.0.4/commons-logging-1.0.4.jar  build 20-Nov-2008 08:47:57 [DEBUG]   /opt/bamboo/.m2/repository/log4j/log4j/1.2.13/log4j-1.2.13.jar  build 20-Nov-2008 08:47:57 [DEBUG]   /opt/bamboo/.m2/repository/com/i4commerce/bml/util/8.19.0/util-8.19.0.jar  build 20-Nov-2008 08:47:57 [DEBUG]   /opt/bamboo/.m2/repository/com/i4commerce/bml/tk-util/8.19.0/tk-util-8.19.0.jar  build 20-Nov-2008 08:47:57 [DEBUG]   /opt/bamboo/.m2/repository/org/jboss/netty/netty/3.0.0.GA/netty-3.0.0.GA.jar  build 20-Nov-2008 08:47:57 [DEBUG]   /opt/bamboo/.m2/repository/org/springframework/spring/2.5.6/spring-2.5.6.jar  build 20-Nov-2008 08:47:57 [DEBUG]   /opt/bamboo/Bamboo/xml-data/build-dir/MONITORING-NIGHTLY/monitoring-server/server-core/target/server-core-1.0.2-SNAPSHOT.jar  build 20-Nov-2008 08:47:57 [DEBUG]   /opt/bamboo/Bamboo/xml-data/build-dir/MONITORING-NIGHTLY/monitoring-server/server-data-access/target/server-data-access-1.0.2-SNAPSHOT-tests.jar  build 20-Nov-2008 08:47:57 [DEBUG]   /opt/bamboo/.m2/repository/org/hibernate/hibernate/3.2.6.ga/hibernate-3.2.6.ga.jar  build 20-Nov-2008 08:47:57 [DEBUG]   /opt/bamboo/.m2/repository/net/sf/ehcache/ehcache/1.2.3/ehcache-1.2.3.jar  build 20-Nov-2008 08:47:57 [DEBUG]   /opt/bamboo/.m2/repository/commons-collections/commons-collections/2.1.1/commons-collections-2.1.1.jar  build 20-Nov-2008 08:47:57 [DEBUG]   /opt/bamboo/.m2/repository/javax/transaction/jta/1.0.1B/jta-1.0.1B.jar  build 20-Nov-2008 08:47:57 [DEBUG]   /opt/bamboo/.m2/repository/asm/asm-attrs/1.5.3/asm-attrs-1.5.3.jar  build 20-Nov-2008 08:47:57 [DEBUG]   /opt/bamboo/.m2/repository/dom4j/dom4j/1.6.1/dom4j-1.6.1.jar  build 20-Nov-2008 08:47:57 [DEBUG]   /opt/bamboo/.m2/repository/antlr/antlr/2.7.6/antlr-2.7.6.jar  build 20-Nov-2008 08:47:57 [DEBUG]   /opt/bamboo/.m2/repository/cglib/cglib/2.1_3/cglib-2.1_3.jar  build 20-Nov-2008 08:47:57 [DEBUG]   /opt/bamboo/.m2/repository/asm/asm/1.5.3/asm-1.5.3.jar  build 20-Nov-2008 08:47:57 [DEBUG]   /opt/bamboo/.m2/repository/org/hibernate/hibernate-annotations/3.3.0.ga/hibernate-annotations-3.3.0.ga.jar  build 20-Nov-2008 08:47:57 [DEBUG]   /opt/bamboo/.m2/repository/javax/persistence/persistence-api/1.0/persistence-api-1.0.jar  build 20-Nov-2008 08:47:57 [DEBUG]   /opt/bamboo/.m2/repository/org/hibernate/hibernate-commons-annotations/3.3.0.ga/hibernate-commons-annotations-3.3.0.ga.jar  build 20-Nov-2008 08:47:57 [DEBUG]   /opt/bamboo/.m2/repository/org/hibernate/hibernate-validator/3.0.0.ga/hibernate-validator-3.0.0.ga.jar  build 20-Nov-2008 08:47:57 [DEBUG]   /opt/bamboo/.m2/repository/org/hibernate/hibernate-search/3.0.0.GA/hibernate-search-3.0.0.GA.jar  build 20-Nov-2008 08:47:57 [DEBUG]   /opt/bamboo/.m2/repository/org/apache/lucene/lucene-core/2.2.0/lucene-core-2.2.0.jar  build 20-Nov-2008 08:47:57 [DEBUG]   /opt/bamboo/.m2/repository/javax/servlet/servlet-api/2.3/servlet-api-2.3.jar  build 20-Nov-2008 08:47:57 [DEBUG]   /opt/bamboo/.m2/repository/org/drools/drools-core/4.0.7/drools-core-4.0.7.jar  build 20-Nov-2008 08:47:57 [DEBUG]   /opt/bamboo/.m2/repository/org/mvel/mvel/1.3.1-java1.4/mvel-1.3.1-java1.4.jar  build 20-Nov-2008 08:47:57 [DEBUG]   /opt/bamboo/.m2/repository/commons-io/commons-io/1.4/commons-io-1.4.jar  build 20-Nov-2008 08:47:57 [DEBUG]   /opt/bamboo/.m2/repository/javax/j2ee/1.3/j2ee-1.3.jar  build 20-Nov-2008 08:47:57 [DEBUG]   /opt/bamboo/.m2/repository/com/sun/xml/bind/jaxb-impl/2.1.3/jaxb-impl-2.1.3.jar  build 20-Nov-2008 08:47:57 [DEBUG]   /opt/bamboo/.m2/repository/javax/xml/bind/jaxb-api/2.1/jaxb-api-2.1.jar  build 20-Nov-2008 08:47:57 [DEBUG]   /opt/bamboo/.m2/repository/javax/xml/stream/stax-api/1.0-2/stax-api-1.0-2.jar  build 20-Nov-2008 08:47:57 [DEBUG]   /opt/bamboo/.m2/repository/javax/activation/activation/1.1/activation-1.1.jar  build 20-Nov-2008 08:47:57 [DEBUG]   /opt/bamboo/.m2/repository/com/i4commerce/common/common-configuration/1.0.25/common-configuration-1.0.25.jar  build 20-Nov-2008 08:47:57 [DEBUG]   /opt/bamboo/.m2/repository/opensymphony/oscache/2.1.1/oscache-2.1.1.jar  build 20-Nov-2008 08:47:57 [DEBUG]   /opt/bamboo/.m2/repository/com/i4commerce/bml/bml-core/8.20.0-SNAPSHOT/bml-core-8.20.0-SNAPSHOT.jar  build 20-Nov-2008 08:47:57 [DEBUG]   /opt/bamboo/.m2/repository/com/i4commerce/bml/cache/8.20.0-SNAPSHOT/cache-8.20.0-SNAPSHOT.jar  build 20-Nov-2008 08:47:57 [DEBUG]   /opt/bamboo/.m2/repository/com/i4commerce/common/common-spring-util/1.0.25/common-spring-util-1.0.25.jar  build 20-Nov-2008 08:47:57 [DEBUG]   /opt/bamboo/.m2/repository/esper/esper/2.2.0/esper-2.2.0.jar  build 20-Nov-2008 08:47:57 [DEBUG]   /opt/bamboo/.m2/repository/org/antlr/antlr-runtime/3.0.1/antlr-runtime-3.0.1.jar  build 20-Nov-2008 08:47:57 [DEBUG]   /opt/bamboo/.m2/repository/org/antlr/stringtemplate/3.1-b1/stringtemplate-3.1-b1.jar  build 20-Nov-2008 08:47:57 [DEBUG]   /opt/bamboo/.m2/repository/quartz/quartz/1.5.2/quartz-1.5.2.jar  build 20-Nov-2008 08:47:57 [DEBUG]   /opt/bamboo/.m2/repository/junit/junit/3.8.1/junit-3.8.1.jar  build 20-Nov-2008 08:47:57 [DEBUG]   /opt/bamboo/.m2/repository/com/mockrunner/mockrunner/0.3.1/mockrunner-0.3.1.jar  build 20-Nov-2008 08:47:57 [DEBUG]   /opt/bamboo/.m2/repository/com/i4commerce/common/common-abstract-unit-tests/1.0.25/common-abstract-unit-tests-1.0.25-tests.jar  build 20-Nov-2008 08:47:57 [DEBUG]   /opt/bamboo/.m2/repository/com/i4commerce/bml/unittest/8.20.0-SNAPSHOT/unittest-8.20.0-SNAPSHOT.jar  build 20-Nov-2008 08:47:57 [DEBUG]   /opt/bamboo/Bamboo/xml-data/build-dir/MONITORING-NIGHTLY/monitoring-server/server-data-access/target/server-data-access-1.0.2-SNAPSHOT-tests.jar  build 20-Nov-2008 08:47:57 [DEBUG]   /opt/bamboo/.m2/repository/com/oracle/oracle_jdbc/10.2.0.2.0/oracle_jdbc-10.2.0.2.0.jar    This is the classpath for when it succeeds:  build 20-Nov-2008 08:45:07 [DEBUG]   /opt/bamboo/Bamboo/xml-data/build-dir/MONITORING-NIGHTLY/monitoring-server/server-web/target/test-classes  build 20-Nov-2008 08:45:07 [DEBUG]   /opt/bamboo/Bamboo/xml-data/build-dir/MONITORING-NIGHTLY/monitoring-server/server-web/target/classes  build 20-Nov-2008 08:45:07 [DEBUG]   /opt/bamboo/.m2/repository/xerces/xercesImpl/2.9.1/xercesImpl-2.9.1.jar  build 20-Nov-2008 08:45:07 [DEBUG]   /opt/bamboo/.m2/repository/xml-apis/xml-apis/1.3.04/xml-apis-1.3.04.jar  build 20-Nov-2008 08:45:07 [DEBUG]   /opt/bamboo/Bamboo/xml-data/build-dir/MONITORING-NIGHTLY/monitoring-server/server-model/target/server-model-1.0.2-SNAPSHOT.jar  build 20-Nov-2008 08:45:07 [DEBUG]   /opt/bamboo/.m2/repository/commons-lang/commons-lang/2.1/commons-lang-2.1.jar  build 20-Nov-2008 08:45:07 [DEBUG]   /opt/bamboo/Bamboo/xml-data/build-dir/MONITORING-NIGHTLY/monitoring-server/server-actions/target/server-actions-1.0.2-SNAPSHOT.jar  build 20-Nov-2008 08:45:07 [DEBUG]   /opt/bamboo/.m2/repository/commons-logging/commons-logging/1.0.4/commons-logging-1.0.4.jar  build 20-Nov-2008 08:45:07 [DEBUG]   /opt/bamboo/.m2/repository/log4j/log4j/1.2.13/log4j-1.2.13.jar  build 20-Nov-2008 08:45:07 [DEBUG]   /opt/bamboo/.m2/repository/com/i4commerce/bml/util/8.19.0/util-8.19.0.jar  build 20-Nov-2008 08:45:07 [DEBUG]   /opt/bamboo/.m2/repository/com/i4commerce/bml/tk-util/8.19.0/tk-util-8.19.0.jar  build 20-Nov-2008 08:45:07 [DEBUG]   /opt/bamboo/.m2/repository/org/jboss/netty/netty/3.0.0.GA/netty-3.0.0.GA.jar  build 20-Nov-2008 08:45:07 [DEBUG]   /opt/bamboo/.m2/repository/org/springframework/spring/2.5.6/spring-2.5.6.jar  build 20-Nov-2008 08:45:07 [DEBUG]   /opt/bamboo/Bamboo/xml-data/build-dir/MONITORING-NIGHTLY/monitoring-server/server-core/target/server-core-1.0.2-SNAPSHOT.jar  build 20-Nov-2008 08:45:07 [DEBUG]   /opt/bamboo/Bamboo/xml-data/build-dir/MONITORING-NIGHTLY/monitoring-server/server-data-access/target/server-data-access-1.0.2-SNAPSHOT.jar  build 20-Nov-2008 08:45:07 [DEBUG]   /opt/bamboo/.m2/repository/org/hibernate/hibernate/3.2.6.ga/hibernate-3.2.6.ga.jar  build 20-Nov-2008 08:45:07 [DEBUG]   /opt/bamboo/.m2/repository/net/sf/ehcache/ehcache/1.2.3/ehcache-1.2.3.jar  build 20-Nov-2008 08:45:07 [DEBUG]   /opt/bamboo/.m2/repository/commons-collections/commons-collections/2.1.1/commons-collections-2.1.1.jar  build 20-Nov-2008 08:45:07 [DEBUG]   /opt/bamboo/.m2/repository/javax/transaction/jta/1.0.1B/jta-1.0.1B.jar  build 20-Nov-2008 08:45:07 [DEBUG]   /opt/bamboo/.m2/repository/asm/asm-attrs/1.5.3/asm-attrs-1.5.3.jar  build 20-Nov-2008 08:45:07 [DEBUG]   /opt/bamboo/.m2/repository/dom4j/dom4j/1.6.1/dom4j-1.6.1.jar  build 20-Nov-2008 08:45:07 [DEBUG]   /opt/bamboo/.m2/repository/antlr/antlr/2.7.6/antlr-2.7.6.jar  build 20-Nov-2008 08:45:07 [DEBUG]   /opt/bamboo/.m2/repository/cglib/cglib/2.1_3/cglib-2.1_3.jar  build 20-Nov-2008 08:45:07 [DEBUG]   /opt/bamboo/.m2/repository/asm/asm/1.5.3/asm-1.5.3.jar  build 20-Nov-2008 08:45:07 [DEBUG]   /opt/bamboo/.m2/repository/org/hibernate/hibernate-annotations/3.3.0.ga/hibernate-annotations-3.3.0.ga.jar  build 20-Nov-2008 08:45:07 [DEBUG]   /opt/bamboo/.m2/repository/javax/persistence/persistence-api/1.0/persistence-api-1.0.jar  build 20-Nov-2008 08:45:07 [DEBUG]   /opt/bamboo/.m2/repository/org/hibernate/hibernate-commons-annotations/3.3.0.ga/hibernate-commons-annotations-3.3.0.ga.jar  build 20-Nov-2008 08:45:07 [DEBUG]   /opt/bamboo/.m2/repository/org/hibernate/hibernate-validator/3.0.0.ga/hibernate-validator-3.0.0.ga.jar  build 20-Nov-2008 08:45:07 [DEBUG]   /opt/bamboo/.m2/repository/org/hibernate/hibernate-search/3.0.0.GA/hibernate-search-3.0.0.GA.jar  build 20-Nov-2008 08:45:07 [DEBUG]   /opt/bamboo/.m2/repository/org/apache/lucene/lucene-core/2.2.0/lucene-core-2.2.0.jar  build 20-Nov-2008 08:45:07 [DEBUG]   /opt/bamboo/.m2/repository/javax/servlet/servlet-api/2.3/servlet-api-2.3.jar  build 20-Nov-2008 08:45:07 [DEBUG]   /opt/bamboo/.m2/repository/org/drools/drools-core/4.0.7/drools-core-4.0.7.jar  build 20-Nov-2008 08:45:07 [DEBUG]   /opt/bamboo/.m2/repository/org/mvel/mvel/1.3.1-java1.4/mvel-1.3.1-java1.4.jar  build 20-Nov-2008 08:45:07 [DEBUG]   /opt/bamboo/.m2/repository/commons-io/commons-io/1.4/commons-io-1.4.jar  build 20-Nov-2008 08:45:07 [DEBUG]   /opt/bamboo/.m2/repository/javax/j2ee/1.3/j2ee-1.3.jar  build 20-Nov-2008 08:45:07 [DEBUG]   /opt/bamboo/.m2/repository/com/sun/xml/bind/jaxb-impl/2.1.3/jaxb-impl-2.1.3.jar  build 20-Nov-2008 08:45:07 [DEBUG]   /opt/bamboo/.m2/repository/javax/xml/bind/jaxb-api/2.1/jaxb-api-2.1.jar  build 20-Nov-2008 08:45:07 [DEBUG]   /opt/bamboo/.m2/repository/javax/xml/stream/stax-api/1.0-2/stax-api-1.0-2.jar  build 20-Nov-2008 08:45:07 [DEBUG]   /opt/bamboo/.m2/repository/javax/activation/activation/1.1/activation-1.1.jar  build 20-Nov-2008 08:45:07 [DEBUG]   /opt/bamboo/.m2/repository/com/i4commerce/common/common-configuration/1.0.25/common-configuration-1.0.25.jar  build 20-Nov-2008 08:45:07 [DEBUG]   /opt/bamboo/.m2/repository/opensymphony/oscache/2.1.1/oscache-2.1.1.jar  build 20-Nov-2008 08:45:07 [DEBUG]   /opt/bamboo/.m2/repository/com/i4commerce/bml/bml-core/8.20.0-SNAPSHOT/bml-core-8.20.0-SNAPSHOT.jar  build 20-Nov-2008 08:45:07 [DEBUG]   /opt/bamboo/.m2/repository/com/i4commerce/bml/cache/8.20.0-SNAPSHOT/cache-8.20.0-SNAPSHOT.jar  build 20-Nov-2008 08:45:07 [DEBUG]   /opt/bamboo/.m2/repository/com/i4commerce/common/common-spring-util/1.0.25/common-spring-util-1.0.25.jar  build 20-Nov-2008 08:45:07 [DEBUG]   /opt/bamboo/.m2/repository/esper/esper/2.2.0/esper-2.2.0.jar  build 20-Nov-2008 08:45:07 [DEBUG]   /opt/bamboo/.m2/repository/org/antlr/antlr-runtime/3.0.1/antlr-runtime-3.0.1.jar  build 20-Nov-2008 08:45:07 [DEBUG]   /opt/bamboo/.m2/repository/org/antlr/stringtemplate/3.1-b1/stringtemplate-3.1-b1.jar  build 20-Nov-2008 08:45:07 [DEBUG]   /opt/bamboo/.m2/repository/quartz/quartz/1.5.2/quartz-1.5.2.jar  build 20-Nov-2008 08:45:07 [DEBUG]   /opt/bamboo/.m2/repository/junit/junit/3.8.1/junit-3.8.1.jar  build 20-Nov-2008 08:45:07 [DEBUG]   /opt/bamboo/.m2/repository/com/mockrunner/mockrunner/0.3.1/mockrunner-0.3.1.jar  build 20-Nov-2008 08:45:07 [DEBUG]   /opt/bamboo/.m2/repository/com/i4commerce/common/common-abstract-unit-tests/1.0.25/common-abstract-unit-tests-1.0.25-tests.jar  build 20-Nov-2008 08:45:07 [DEBUG]   /opt/bamboo/.m2/repository/com/i4commerce/bml/unittest/8.20.0-SNAPSHOT/unittest-8.20.0-SNAPSHOT.jar  build 20-Nov-2008 08:45:07 [DEBUG]   /opt/bamboo/Bamboo/xml-data/build-dir/MONITORING-NIGHTLY/monitoring-server/server-data-access/target/server-data-access-1.0.2-SNAPSHOT-tests.jar  build 20-Nov-2008 08:45:07 [DEBUG]   /opt/bamboo/.m2/repository/com/oracle/oracle_jdbc/10.2.0.2.0/oracle_jdbc-10.2.0.2.0.jar"""
"CLOV-1085","Bug","Test Optimization",2,"Message in Balloon after clean snapshot is bogus","""# Clean shapshot  # First Optimised test run the balloon message is ok (see CIJ-272 re my thoughts on it)  # Second optmised test run has some odd figures in it relating to expected savings and total test run time.    """
"CLOV-1084","Bug","CIJ Plugin",1,"No instrumentation Done, Always get two Tests run.","""Although 0 instr. was done, I still see two tests run.    """
"CLOV-701","Bug","Reporting",2,"Test Columns are empty (or -1) in project.js when generated via a JSON report  ","""When a JSON report is generated, the test fields:  """"ErroneousTests"""":0,""""FailingTests"""":0,""""FilteredElements"""":0.42738318,""""PassingTests"""":0,""""PcErroneousTests"""":-1,""""PcFailingTests"""":-1,""""PcPassingTests"""":-1,""""TestExecutionTime"""":0,""""Tests"""":0,    are all -1 or 0 in the project.js.  e.g.  https://bamboo.extranet.atlassian.com/browse/CCD-WCLV-488/artifact/Clover-HTML/project.js    The test data is definitely available in the HTML report."""
"CLOV-906","Bug","Grails Plugin",1,"Clover-for-Grails generates an exception when using the -clover.view option on the Grails command line.","""Clover-for-Grails generates an exception when using the -clover.view option on the Grails command line. According to Nick's assessment so far, this is a Windows-specific problem.    See output below:    """
"CLOV-930","Suggestion","Grails Plugin|Groovy",2,"Implement Test Optimization for Grails: -clover.optimize","""Running -clover.optimize will:  * save a clover.snapshot on the first build  * use this, to discern the optimal set of tests and their order, to run for subsequent builds based on:  ** which source files have been modified  ** length of test  ** test result - failed tests will always be re-run"""
"CLOV-940","Bug","Ant Tasks",3,"clover + ant + GWT does not compile and test with clover.","""https://support.atlassian.com/browse/BSP-2952      It looks like the GWT.clover.xxx are not executed.    build 06-May-2010 17:24:30 Build sequence for target(s) `clover.fullclean' is [clover.clean, clover.fullclean]  build 06-May-2010 17:24:30 Complete build sequence is [clover.clean, clover.fullclean, clover.save-history, GWT.clover.report, GWT.clover.json, checkstyle, common.checkstyle, buildonly, dist-dev, tools, apicheck-nobuild, apicheck, test, verify, common.all, build, doc, dist, -compile.emma.if.enabled, dev, GWT.with.clover, compile.emma.if.enabled, common.clean, GWT.clover.fullclean, common.build, GWT.clover.current, presubmit, all, GWT.clover.clean, GWT.clover.save-history, clover.snapshot, clover.json, clover.report, user, clover.log, common.compile.emma.if.enabled, ci, common.-compile.emma.if.enabled, GWT.clover.log, bikeshed, emma.merge, GWT.test, with.clover, jni, clean, clover.all, common.-create.emma.coverage.if.enabled, clover.xml, common.verify, -create.emma.coverage.if.enabled, buildtools, clover.current, samples, dist-bikeshed, soyc, GWT.clover.all, GWT.clover.xml, common.test, servlet, GWT.clover.snapshot, ]    However targets without GWT are executed."""
"CLOV-951","Bug","CIJ Plugin",2,"Assertion failing (call not made from EDT)",""""""
"CLOV-953","Bug","Build system|Grails Plugin|Groovy",3,"Occasionally clover is getting broken on the Hudson ","""We are using Grails 1.2.2 , Hudson, clover  From time to time Hudson fails with the following console output. Without any changes the next build can be fine.    Licensed under Apache Standard License 2.0  Grails home is set to: D:\Apps\grails-1.2.2    Base Directory: D:\Apps-Pub\HUDSON_HOME\jobs\LifePoints\workspace\Lifepoints  WARNING: Dependencies cannot be resolved for plugin [clover-3.0.2] due to error: null  Resolving dependencies...  Dependencies resolved in 1422ms.  Running script D:\Apps\grails-1.2.2\scripts\TestApp.groovy  Environment set to test  Clover: Using config: [on:true]  Using clover license path: D:\Apps-Pub\HUDSON_HOME\jobs\LifePoints\workspace\Lifepoints/clover.license    [taskdef] Could not load definitions from resource cloverlib.xml. It could not be found.  Error executing script TestApp: Problem: failed to create task or type clover-env  Cause: The name is undefined.  Action: Check the spelling.  Action: Check that any custom tasks/types have been declared.  Action: Check that any <presetdef>/<macrodef> declarations have taken place.    : Problem: failed to create task or type clover-env  Cause: The name is undefined.  Action: Check the spelling.  Action: Check that any custom tasks/types have been declared.  Action: Check that any <presetdef>/<macrodef> declarations have taken place.     at org.apache.tools.ant.UnknownElement.getNotFoundException(UnknownElement.java:484)   at org.apache.tools.ant.UnknownElement.makeObject(UnknownElement.java:416)   at org.apache.tools.ant.UnknownElement.maybeConfigure(UnknownElement.java:160)   at _Events.toggleCloverOn(_Events.groovy:302)   at _Events$_run_closure3.doCall(_Events.groovy:56)   at _GrailsEvents_groovy$_run_closure5.doCall(_GrailsEvents_groovy:58)   at _GrailsEvents_groovy$_run_closure5.call(_GrailsEvents_groovy)   at _GrailsEvents_groovy.run(_GrailsEvents_groovy:62)   at _GrailsEvents_groovy$run.call(Unknown Source)   at _GrailsClean_groovy$run.call(Unknown Source)   at _GrailsClean_groovy.run(_GrailsClean_groovy:29)   at _GrailsClean_groovy$run.call(Unknown Source)   at TestApp.run(TestApp.groovy:44)   at TestApp$run.call(Unknown Source)   at gant.Gant.processTargets(Gant.groovy:494)   at gant.Gant.processTargets(Gant.groovy:480)  Error executing script TestApp: Problem: failed to create task or type clover-env  Cause: The name is undefined.  Action: Check the spelling.  Action: Check that any custom tasks/types have been declared.  Action: Check that any <presetdef>/<macrodef> declarations have taken place."""
"CLOV-964","Bug","Groovy",1,"<testsources> does not work with Ant groovyc task","""Since TestSourceSet is not Serializable it doesn't work with Ant/groovyc.           """
"CLOV-977","Bug","Build system",1,"Clover's embedding of GSON brings in ""assembly-descriptor.xml"" into clover.jar which causes problems for ejbdoclet, others","""see support case https://support.atlassian.com/browse/CLV-5576 and forum post http://forums.atlassian.com/thread.jspa?messageID=257357810    the solution is to simply exclude this file when building the clover.jar  """
"CLOV-987","Bug","CIJ Plugin",1,"Cannot select contexts in IDEA 10.0.2","""I select either the filter button in the coverage panel or go via the project settings (same either way) to get to the clover setting dialog. I select the 3rd tab (Contexts) and check the check-boxes 'catch bosy' and 'property methods'. The boxes become checked but the Apply button remains disabled (this is the main issue).    I add a new custom context - and the Apply button is enabled.    I click apply and the check boxes all reset back to their un-set state. The custom context remains.    """
"CLOV-991","Suggestion","CEP Plugin|Reporting",2,"Ternary clauses never executed still get coverage","""I don't know if this is disoverable at all, but the following example will work with any ternary statement:    @Test  public void testTernaryStatement() {   ternaryStatement(true);  }    public static void ternaryStatement(boolean bool) {   String value = bool ? """"true"""" : """"false"""";   System.out.println(value);  }    This will mark the entire ternary statement as covered, while the false branch was in fact never triggered.      Since Clover is primarily a coverage tool, I marked this issue Major."""
"CLOV-1007","Bug","Maven plugin",1,"clover2:check fails with negative coverage if no class to instrument","""This happens either if no java class was found for instrumentation or if they were all excluded.  Clover then reports a negative coverage of -100%.    To my mind, this is not correct : strictly speaking, if no java class has to be tested for coverage, there is no relevant coverage value (I guess it is what the -100% means) but check should be OK.  """
"CLOV-1011","Bug","CIJ Plugin",1,"Coverage data not showing up in Intellij","""I've got the dev build from CLOV-1004, which worked for Intellij 10.3 but since I upgraded to 10.5.1, neither the latest public rev (3.1.0.v20110608114626-dev) nor the dev version of the plugin from CLOV-1004 works.    In the projects view, it looks like the code is instrumented.  But after I run a test, no coverage information is displayed.  When I explicitly update the clover database, nothing is updated.  The """"Test Runs"""" view behaves as if I never ran a test."""
"CLOV-1015","Bug","Maven plugin",5,"Test Optimization says 0 tests should run but all tests are run anyway","""Recently upgraded my Maven builds to use the Maven Surefire plugin version 2.9. Now my builds that run Clover2:optimized and say 0 tests should run, run all tests anyway. The upshot of this is that our optimized test runs are now taking over an hour versus the 15 to 20 minutes they were when the tests were correctly optimized away.      Here is a section of the log file that shows the problem:    """
