"issuekey","type","components","storypoint","title","description_text"
"DAEMON-173","Bug","appcd-plugin-windows",8,"windowslib: EBUSY error on wptool executable","""h5.Description    When running appcd exec /system-info/1.x/info/ it seemed to be taking longer than usual to return, checking the logs I saw the below, I think it's possible that two detect processes are attempting to build wptool at the same time. We apparently deal with this inside windowslib but it seems to be flaky, it might be wise to stagger the detects to allow one to build before the other runs    I've had trouble reproducing this in an appc cli build fwiw        h5.Steps to reproduce    # Remove wptool.exe from windowslib/bin folder  # Start the daemon {{[appc] appcd start}}  # Query system info {{[appc] appcd exec /system-info/1.x/info/}}    h5.Actual    Plugin hangs, windows error above shown in logs    h5.Expected    No hang"""
"DAEMON-171","Improvement","appcd",2,"appcd: Stop any running daemon instances post npm install","""After installing the Appc Daemon, the post install script should use the just installed Appc Daemon code to stop so that the new code will be run."""
"DAEMON-170","Improvement","appcd-default-plugins|appcd-plugin-android|appcd-plugin-genymotion|appcd-plugin-ios|appcd-plugin-jdk|appcd-plugin-system-info|appcd-plugin-windows",13,"Move plugins out of appcd-daemon repo into separate repos","""Once Appc Daemon 1.0.0 ships, we should move the plugins out of the {{appcd-daemon}} repo and into separate repos. This will allow each plugin to be versioned independently of each other and the Appc Daemon core.    Also move {{appcd-default-plugins}} into a separate repo so that we can add/remove plugins without having to publish a new appcd."""
"DAEMON-176","Improvement","appcd-plugin-genymotion|appcd-plugin-ios|appcd-plugin-jdk|appcd-plugin-system-info|appcd-plugin-windows",2,"Plugins: Pickup the imported values from the titanium config","""h5.Description    DAEMON-156 implemented importing the ti config, so lets implement it into the plugins. We should also watch the config for these values so we rescan if they get set"""
"DAEMON-182","Improvement","androidlib",5,"androidlib: Addons with a manifest.ini not detected","""At some point, Android SDK add-ons moved away from {{source.properties}} files and to a {{manifest.ini}} file. We need to support both."""
"DAEMON-181","Improvement","appcd-config",8,"appcd-config: Figure out how to set metadata for non-appcd config settings","""We currently do not have plugins define metadata for plugin specific config options. Plugins do not have access to the main config object, thus they cannot directly add metadata.    One solution would be for the plugin system to read a plugin specific metadata config and merge it into the main config."""
"DAEMON-179","Bug","androidlib",8,"Android NDK is blank in system-info ","""The android info fetched using """"appc appcd exec /android/latest/info"""" returns Android NDK as blank.    Attached is the android output returned by appcd and appc cli"""
"DAEMON-178","Bug","appcd",1,"Sync ""appc ti config"" with the ""appc appcd config"" ","""How and when do we sync {{appc ti config}} settings to {{appc appcd config}} - so that when studio is working with Appc Daemon it can only look for {{appc appcd config}}    Since everybody is trained to work with {{appc ti config}} and they might configure android.sdkPath, sdk.selected,etc., and expect they will be picked up directly in the studio    Any thoughts around it?  """
"DAEMON-185","Bug","appcd",1,"Unable to stop the daemon ","""Unable to stop the daemon using {{appc appcd stop}}. It's an intermittent issue - doesn't have all the time. However, it doesn't have any impact on the studio for 5.0 release.    """
"DAEMON-184","Bug","windowslib",5,"windowslib: Unable to build wptool project on a machine where the username contains spaces","""h5.Description    *This isn't a new bug, just exposed by how we decided to expose appcd*    One of my machines has a space in the name, this causes an error when building the wptool executable and we're not in the temp dir, we need to escape the project path correctly"""
"DAEMON-189","Bug","androidlib",3,"System-info doesn't have newly created Android AVD","""System-info doesn't have newly created android AVD. I've created a new android AVD from the studio and it appeared in the ti info but not in the appcd system-info.    Please find the attached files.   [^appcd_dump_master44.json]    [^appcd_systeminfo_master44.json]    [^appc_tiinfo_master44.json] """
