"issuekey","type","components","storypoint","title","description_text"
"DAEMON-5","New Feature","appcd-core",13,"appcd: JSON response filtering","""All the ability to filter JSON responses based on criteria from a dispatcher path.    For example, requests to `/appcd/status/system` would return only the system information:    """
"DAEMON-1","New Feature","appcd-core",13,"appcd: Integrate hook system into appc daemon","""The appc daemon needs to provide a evented hook system for plugins to use services to use and expose functionality to other services.    The hook system is based on the concepts of the hook system in the Titanium CLI. The main differences are the new hooks system will be based on ES6 promises.    The event names should follow the convention of """"module:foo.bar""""."""
"DAEMON-28","New Feature","appcd-plugin-amplify",13,"@appcd/plugin-amplify: Authentication service","""The AMPLIFY platform appcd plugin will use the amplify-platform-sdk to perform authentication. This service will also automatically refresh access tokens."""
"DAEMON-18","Story","appcd-plugin-amplify",13,"@appcd/plugin-amplify: AMPLIFY platform daemon plugin","""The AMPLIFY Platform appcd plugin (@appcd/plugin-amplify) is responsible for authentication. It contains services authenticating against Axway ID and retrieving, refreshing, and invalidating access tokens.    This plugin eventually will also contain the entitlements service."""
"DAEMON-11","New Feature","appcd-core",8,"appcd: Support for --config and --config-file options","""It would be useful if the appcd cli supported a {{\-\-config}} and {{\-\-config\-file}} options for the """"start"""" and """"restart"""" commands."""
"DAEMON-10","New Feature","jdklib",5,"jdklib v2","""jdklib is responsible for detecting the installed Java development environment.    jdklib needs to expose the new detect friendly interface, namely separating the search paths from the actual detection code."""
"DAEMON-4","New Feature","appcd-core",13,"appcd: Add analytics facilities","""The appc daemon needs to provide a mechanism for services and the daemon itself to generate analytics events. These events are then sent to the Appcelerator cloud so that the products can be improved. Analytics payloads must be anonymous.    Analytics payload will include:  * Machine ID  * Session ID  * Timestamp  * Operating system  * CPU architecture (32/64-bit)  * Number of CPUs  * Total system memory  * Installed appcd plugin info  * appcd configuration  * Event name  * Event type (action, error, etc)  * Event metadata    All events must be persisted to separate files disk prior to sending to the cloud. Only one process can send an event at any given time.    The endpoint will be https://api.appcelerator.net/p/v2/partner-track. As a reference, here's Appc CLI's analytics library: https://github.com/appcelerator/appc-platform-sdk/blob/master/lib/analytics.js.    Appc Daemon's guid:  * Production: ea327577-858f-4d31-905e-fa670f50ef48  * Preprod: 14c84daf-b01e-486c-96d3-b8f66da44481"""
"DAEMON-2","New Feature","appcd",13,"appcd: Add support for distributable Node executable","""The appc daemon needs the ability to lock down the Node.js version so that native modules can be pre-compiled. It currently has a placeholder for running a specific Node executable.    The Node executable will be downloaded from the registry server. Both 32 and 64-bit Node executables will be available. The required Node.js version will be the latest LTS version, currently 4.4.3. This will most likely change to 6.2.0 LTS October 2016."""
"DAEMON-13","Improvement","appcd-core",3,"appcd: Fix source/user agent support","""For analytics, the daemon records the client's """"user agent"""". This feature is currently implemented, but it's named """"userAgent"""" which was determined to be misleading.    We need a better term to describe this feature and a way to describe a client type, description, and version, possibly as a string instead of an object.    NPM has a user agent string that looks like {{npm/2.15.1 node/v4.4.3 darwin x64}}."""
"DAEMON-3","Improvement","ioslib",8,"node-ios-device: Re-run node-pre-gyp if binding doesn't exist","""node-ios-device v0.9.0 uses node-pre-gyp. When it is npm installed, node-pre-gyp downloads the pre-compiled binary. However, if the system Node.js version is changed, then node-pre-gyp needs to be re-run. In order for this to work, node-pre-gyp must be executed synchronously."""
"DAEMON-6","New Feature","node-appc",13,"appcd: Filesystem watcher","""androidlib, ioslib, jdklib, and windowslib need a filesystem monitoring library that can be notified when a specific path changes.    Node has a built-in {{fs.watch()}} function which works fine on Linux and Windows, but doesn't work well on OS X where it doesn't report the correct file path. This can be fixed by using the {{fsevents}} module.    The {{chokidar}} module comes close to solving this need, but I discovered two blocking bugs: one with watching paths that do not exist and one with nested paths. It also currently has 39 open issues, some of which are a little scary sounding. Additionally, {{chokidar}} uses {{readdirp}} which apparently has performance issues due to all of the file stating."""
"DAEMON-32","Bug","jdklib",1,"Windows: jdklib v2 - If you move your JDK while running jdklib.watch(), then ""TypeError: Path must be a string"" error is returned","""*Details:* On Windows, if you move your JDK while running jdklib.watch(), then {{TypeError: Path must be a string}} error is returned.    *Notes:* This is not reproducible with JDK on Mac.    *Steps to reproduce:*  # Make sure you are using Node 4.X.X on Windows  # Clone and run {{npm install}} on https://github.com/appcelerator/jdklib  # Symlink to the above built jdklib v2  # Run this Node script:    # Find your JDK and move it    *Actual:*  {{TypeError: Path must be a string}} error is returned:      *Expected:* No errors should be returned while watching the JDK."""
"DAEMON-33","Bug","androidlib",1,"Windows: androidlib v2 - If you call androidlib.detect(), then an empty array is returned for the results","""*Details:* If you make a androidlib.detect(), then an empty array is returned for the results.    *Notes:*  * This does not appear on Mac.  * ANDROID_SDK environment variable is set.  * Android SDK tools and platform-tools are set in the PATH.    *Steps to reproduce:*  # Make sure you are using Node 4.X.X  # Clone and run {{npm install}} on https://github.com/appcelerator/androidlib/tree/v2; make sure it's v2 branch  # Symlink to the above built androidlib v2  # Run this Node script:      *Actual:* An empty array appears for SDK.      *Expected:* There should not be an empty array for SDK."""
"DAEMON-30","Bug","appcd-core",5,"appcd status: Display the correct status if the daemon is not running","""If the Appc Daemon is not running and you run {{appcd status}}, it outputs:        It should output a more readable error for both """"report"""" and """"json"""" output modes."""
"DAEMON-29","New Feature","appcd-core",5,"appcd status: Add support for --json option","""The {{appcd status}} command needs to support outputting the status in a human readable """"report"""" format as well as JSON format.    Currently only the JSON output is supported."""
"DAEMON-31","Improvement","appcd-core",5,"Allow for multiple requests over the same WebSocket connection","""Currently the Appc Daemon only allows a single request over a single WebSocket connection. This encourages clients to establish multiple simultaneous connections. This is technically unnecessary.    The Appc Daemon should not close the socket when a request ends, but rather send a """"request closed"""" message and let the client determine if it should close the connection.    Be sure to update the wiki page under the """"Node.js Client"""" section: https://wiki.appcelerator.org/display/Daemon/Appcd+Client."""
"DAEMON-35","Improvement","appcd-core",5,"appcd-core: Replace ""pidusage"" with ""process.cpuUsage()""","""The daemon uses a NPM module called """"pidusage"""" to monitor the CPU usage, but this is no longer necessary since Node 6 includes a built-in {{process.cpuUsage()}} function. https://nodejs.org/dist/latest-v6.x/docs/api/process.html#process_process_cpuusage_previousvalue    Aside from removing a dependency, it's going to be more efficient to use Node's built-in {{process.cpuUsage()}} because """"pidusage"""" relies on file I/O and spawning {{ps}} and {{wmic}}."""
"DAEMON-36","Bug","node-appc",13,"node-appc: fs watch doesn't properly handle symlinks","""The filesystem watch function doesn't properly handle symlinks. It doesn't check if a file/directory is a symlink.    The problem is when there's a symlinked directory to a parent directory or a directory that is being watched.    The fs watcher needs to detect a symlinked directory, then watch the real path, not the symlink. We still need to track the symlink directory, but it needs to make sure that changes to the real path are propagated to the watcher of the original path."""
"DAEMON-39","New Feature","Tooling",13,"appcd: Create 'package' task for top-level gulp file","""The appcd daemon is made up of the bootstrap, core, a bunch of micro packages, and a bunch of plugins. While each of these can be published individually to NPM, it might be better to generate a pseudo """"appcd"""" package that combines all of the appcd-* {{package.json}} files together.    This would save hundreds of MB of hard drive space.    Furthermore, we may want to take it a step further and declare the bootstrap, core, micro packages, and plugins as """"bundledDependencies"""" and include them in the package. This would allow us to only publish """"appcd"""" to npm instead of dozens of modules every release. This would also make locking down versions much easier."""
"DAEMON-50","New Feature","appcd-response",5,"appcd-response: Add i18n system","""The Appc Daemon currently does not have any sort of i18n facilities unlike the Titanium CLI. This should be solvable using a logger middleware and a gulp task to generate the i18n files."""
"DAEMON-47","Improvement","Tooling",2,"Remove dependency on 'optional-dev-dependency'","""As a way to deal with dependency management, appcd uses """"optional-dev-dependency"""", specifically when the plan was to publish each micro-package as a separate NPM module. However, with the introduction of the {{gulp package}} task and the use of yarn links, there's no need for the """"optional-dev-dependency"""" module anymore."""
"DAEMON-46","Improvement","General",2,"appcd-*: Replace use of 'temp' module with 'tmp'","""In an attempt to standardize on a temp directory/file library, ensure we are using the tmp (https://www.npmjs.com/package/tmp) module."""
"DAEMON-45","New Feature","appcd-http",8,"appcd-http: Add unit tests","""The appcd-http package has some unit tests, but code coverage is lacking."""
"DAEMON-44","New Feature","appcd-http",8,"appcd-http: Port implementation from prototype","""Add the webserver and router from prototype to the appcd-http library."""
"DAEMON-43","New Feature","Tooling",5,"Create CI script","""The Appc Daemon needs a Jenkinsfile script that:    * Installs Node 7.6.0 or newer  * Installs NPM  * Installs Yarn  * Clone appc-daemon repo  * Runs: {{yarn}}  * Runs: {{gulp check}}  * Runs: {{gulp coverage}}  * Runs: {{gulp package}}  * Generates report from """"check"""" output, """"coverage"""" output, and package output and also includes build information  * Stores the report in some cloud-based data store    See https://github.com/appcelerator/client-generator/blob/master/Jenkinsfile for an example. Also see https://github.com/appcelerator/jenkins_dsl/blob/master/jobs/appc_cli.groovy.    -To build the bundled distribution which includes all NPM dependencies, we will need to kick off a Jenkins job on multiple slave Jenkins machines to bundle platform specific bundles. Each Jenkins slave would run {{gulp package-bundle}} instead of {{gulp-package}}, then upload the resulting tarball to Axway's Artifactory server (and possibly also S3 as a backup). We need 5 Jenkins slaves: OS X (64-bit), 64-bit Windows, 32-bit Windows, 64-bit Linux, and 32-bit Linux.-    The platform specific bundling has been moved to DAEMON-77.    The report generation has been moved to DAEMON-78."""
"DAEMON-42","New Feature","appcd-http",2,"appcd-http: Add default served root","""appcd-http needs a default served root just in case one is not specified when a web server is started."""
"DAEMON-41","Improvement","appcd-nodejs",8,"appcd-nodejs: Add unit tests","""Need to create unit tests for appcd-nodejs."""
"DAEMON-40","Bug","appcd-nodejs",5,"appcd-nodejs: Need to download signed node executable on macOS","""Downloading the node executable in the tarball is not signed and shows a dialog if the firewall is enabled, which is going to be often. Instead, we need to download the pkg installer and manually extract the node executable."""
"DAEMON-53","Improvement","Tooling",2,"Root coverage task should not stop on failures","""When running {{gulp coverage}} in the root, we should run each package's coverage tests and continue even if one or more fail, then at the very end do the {{process.exit(1)}}."""
"DAEMON-52","Improvement","Tooling",3,"Start/restart daemon when watching in dev mode","""To speed up development, it would be nice if the gulp watch task would restart the daemon when it detects a file has changed and has rebuilt the packages."""
"DAEMON-51","Improvement","appcd-dispatcher",5,"appcd-dispatcher: Add Koa middleware function","""Instead of having the daemon patch web requests into the dispatcher, just have the dispatcher return a Koa middleware that allows appcd-dispatcher to just do the routing."""
"DAEMON-55","Improvement","Tooling",8,"appcd: Add Retire.js to the 'gulp check' task","""The {{gulp check}} currently only checks NSP for security issues. It is also desired to use Retire.js (https://retirejs.github.io/retire.js/). We need to add Retire.js to the {{gulp check}} task and update the JSON results.    It is preferred to use Retire.js programmatically instead of subprocessing it, though I'm not sure if that's feasible.    Also note that Retire.js and NSP overlap and it would be ideal to unify the results and eliminate duplicates."""
"DAEMON-58","Improvement","appcd-core",2,"appcd-core: Bump Node version to 8.x (when it is released)","""We want to bump the Node.js version of appcd-core's {{package.json}} to the latest v8.x LTS release once it ships in October 2017.    In addition, the following dependencies must also be updated to take advantage of the new features of Node 8:    * appcd-http: koa-bodyparser@4.0.0"""
"DAEMON-57","New Feature","appcd-config|appcd-config-service",5,"appcd: Add support to config handler to change settings at runtime","""The config handler currently only returns the config. The handler should also support a """"data"""" payload to change the daemon's config at runtime.    Note that only a single config setting can be changed per call. Use the path to determine what is being changed. HTTP methods can be used to determine how the key should be changed. The handler returns the new value. Use the status code to determine if successful.    The appcd CLI is responsible for persisting the settings to the user's config file {{~/.appcelerator/appcd/config.json}}. The daemon does not modify the config file. The appcd CLI will validate the config change, then persist it to disk. After that, it will check if the daemon is running and attempt to change it at runtime. If the daemon is not running or it is running and the setting is changeable during runtime, then everything succeeds. If the daemon is running and the change is rejected, then the CLI will alert the user that the daemon must be restarted for the setting to take effect. If the CLI as a TTY, it can prompt to restart the daemon. Note that the CLI should also support a {{\-\-no\-prompt}} flag and a {{\-\-auto\-restart}} flag.    h4. Examples:    h5. Getting a value:        h5. Setting a value:        h5. Deleting a value:        h5. Array examples:        Delete will remove the entire value.    """
"DAEMON-60","Improvement","appcd-dispatcher",8,"appcd-dispatcher: Add ServiceDispatcher unit tests","""The {{ServiceDispatcher}} needs some unit test love."""
"DAEMON-64","New Feature","appcd-http",13,"appcd-http: Need a unified response object","""Right now HTTP responses require a status and body. However we will want to specify a response using a code that looks up the appropriate message and sets the actual response status and body.    We also want this response object to handle the content type.    This does not apply to requests for data. This only applies to requests like subscribing or registering something where we have a real message that can be internationalized."""
"DAEMON-63","New Feature","Tooling",3,"Move dependency-map.json into each package's package.json","""The {{dependency-map.json}} is a file that maps micro-package dependencies together so they can be linked with yarn. The problem is this file is becoming exceedingly large. It's time to break it up and put each package's dependencies in their {{package.json}}. Note that this is not the same as NPM dependencies, so we may need a {{appcd-depenedencies}} property in the {{package.json}}."""
"DAEMON-62","New Feature","appcd-response",13,"appcd-response: Create base error object with messages integration","""There are several errors being thrown around inside the Appc Daemon and we need a unified error object that can pull i18n strings by code or by message."""
"DAEMON-61","New Feature","appcd-response",13,"appcd-response: Create unified message and code library","""With error codes all over the place, we need a central place to store them. We also have a need for i18n. So, appcd-response can fulfill both requirements."""
"DAEMON-65","Improvement","appcd-response",3,"appcd-response: Improve i18n API","""appcd-response handles single strings only. It will probably be handy to create {{\_\_()}} and {{\_\_n()}} functions to expose the i18n engine for single strings and pluralized strings.    Strings are stored in a {{messages/<locale>/strings.json}} file where the key is the English text and the value is the translated text. We should just follow https://github.com/mashpie/i18n-node and allow the value to be an array where the first element is the singular string and the second element is the plural string."""
"DAEMON-67","Bug","appcd",5,"appcd: Logcat crashes daemon","""Running {{appcd logcat}} causes the daemon to have a bad day."""
"DAEMON-69","New Feature","appcd",5,"appcd: Implement subscription requests from appcd CLI","""{{appcd exec}} currently only supports dispatching """"call"""" requests. It does not support """"subscribe"""" requests. {{appcd exec}} needs a {{\-\-subscribe}} flag.    When the {{\-\-subscribe}} flag is set, it will pass a """"type"""" of """"subscribe"""" with the request, then the {{appcd exec}} command will need to properly not exit until the connection is closed or the {{fin}} event is emitted."""
"DAEMON-70","New Feature","appcd-core",2,"appcd-core: Drop priviledges and set uid/gid if root","""In Node, you can only change the user id if Node is launched as root. If the user launching the daemon is root, it would be essential that root privileges be dropped as soon as possible during the daemon initialization.    To check if the daemon is being run as root, check if {{process.getuid() === 0}}. If the uid is zero, then get the uid/gid from in the config and call {{process.setuid()}} and/or {{process.setgid()}}. If there is no uid/gid in the config or the uid/gid is invalid, then the daemon should fatal error and exit.    Note that this only applies to macOS and Linux."""
"DAEMON-72","New Feature","appcd-config|appcd-core",5,"appcd-core: Support for user-defined config file","""The daemon needs to support a user-defined config file. This file should live at {{~/.appcelerator/appcd/config.json}}.    This user-defined config file overrides the default config defined by the Appc Daemon.    This user-defined config file is written whenever a setting is changed via {{appcd config}} or a request to {{/appcd/config}}."""
"DAEMON-77","New Feature","Tooling",1,"appcd: Extend CI process to create platform-specific bundles","""The current Jenkinsfile introduced by DAEMON-43 runs check and coverage tasks, then bundles the daemon distribution without NPM dependencies. DAEMON-56 introduces a {{gulp package-bundle}} that will run {{npm install}} and re-package the daemon distribution tgz file.    This ticket is to add the {{gulp package-bundle}} to the CI process where it is executed on the following 5 Jenkins slave machines:    * macOS  * 64-bit Windows  * 32-bit Windows  * 64-bit Linux  * 32-bit Linux    The resulting tgz file is to be uploaded as an artifact of the CI job."""
"DAEMON-79","New Feature","appcd-subprocess",5,"appcd-subprocess: Add IPC support","""We need the ability to set up an IPC channel with a spawned process.    The way this will work starts by passing a {{ipc: true}} in the dispatcher request payload. This will cause the spawn to force the connection use file descriptor 3 as an IPC channel.    The caller receives the subprocess descriptor: {{ctx.proc}}. It extends an event emitter, so you can listen for {{""""message""""}} and send using {{ctx.proc.send()}}."""
"DAEMON-80","Improvement","appcd-agent",5,"appcd-agent: Implement processing monitoring","""We need to extract the CPU and memory monitoring from the appcd-core and move it into a new appcd-monitor package. The {{StatusMonitor}} along with the plugin host will be able to use appcd-monitor to retrieve process stats.    The goal is to feed these stats into appcd status and telemetry payloads."""
"DAEMON-82","Improvement","appcd-fswatcher",8,"appcd-fswatcher: Add ""depth"" support for recursive watching","""Recursive fs watching works good... perhaps a little too good. When it recursively watches a directory, it has to walk the directory and watch every single descendant. This takes a bunch of resources and slow to initialize. Sometimes the only thing you are interested in is just a couple directories deep. It would best if the FSWatcher could watch only to a certain depth."""
"DAEMON-84","New Feature","appcd-request",8,"appcd-request: Add http request library","""The daemon core needs an http client service. This will tie directly into the dispatcher and use the appcd config for determining proxy settings."""
"DAEMON-87","New Feature","Tooling",1,"Generate yarn.lock in distribution tarball","""When the distribution tarball is packaged, it consolidates all NPM dependencies into the top-level package.json and removes devDependencies from ALL appcd package.json files. All of the appcd-* packages are included in the tarball in the {{node_modules}} directory and declared as {{bundledDependencies}}.    This ticket is to generate a {{yarn.lock}} file for all non-appcd-* dependencies and their dependencies. There are many ways to do this, but the best for ease and performance is to simply merge the {{yarn.lock}} files from every appcd-* directory."""
"DAEMON-86","New Feature","appcd-nodejs",3,"appcd-nodejs: Update to use appcd-request for HTTP requests","""When appcd-nodejs downloads Node.js, it needs to take into account proxies and other network settings. Instead of using {{request()}}, it instead should use the provided request service in {{appcd-request}}."""
"DAEMON-85","New Feature","appcd-request",8,"appcd-request: Implement request service","""The daemon needs a centralized network library that exposes a service for making HTTP requests and takes into account network settings such as proxy settings."""
"DAEMON-88","New Feature","appcd-core",1,"appcd-core: Add heartbeat to WebsocketSession","""Currently there is no mechanism to detect if the Websocket client is borked. This can be accomplished using a ping/pong heartbeat.    Clients opt-in by setting the {{x-heartbeat}} HTTP header. When set, the {{WebsocketSession}} will send a {{""""ping""""}} event every 30 seconds to the client. The client has 5 seconds to respond with a {{""""pong""""}}, otherwise the connection is closed by the server."""
"DAEMON-89","Improvement","Tooling",8,"Migrate to Lerna.js","""I've been resisting the urge to jump to Lerna.js fearing it won't handle some of the edge cases, but once the daemon is released, managing and coordinating all the package releases is going to become more complicated.    Need to understand Lerna's support for Yarn since we depend on {{yarn check}}. npm 5 does not yet support {{node_module}} integrity checks.    Need to figure how to use Lerna.js and configure package dependencies. We will also probably ditch {{gulp}} (which isn't a bad thing) in favor of NPM scripts and a {{scripts}} directory. Everything in {{appcd-gulp}} will be moved to the {{scripts}} directory.    The hope is this will give us a more manageable repo, faster builds, coordinated publishing, and removes the dependency on a globally installed {{gulp}}."""
"DAEMON-92","New Feature","appcd-logger",5,"appcd-logger: Implement default logger","""The Appc Daemon uses {{snooplogg}} for logging, but {{snooplogg}} contains a pretty large 19MB file. To reduce the amount of disk space needed (around 270MB) and to consolidate default logger config settings, it makes sense to introduce an {{appcd-logger}} package."""
