"issuekey","type","components","storypoint","title","description_text"
"DAEMON-94","New Feature","appcd-telemetry",1,"appcd-telemetry: Switch over to appc-platform-sdk analtyics","""The Appc Daemon uses its own analytics code in {{appcd-telemetry}}. {{appc-platform-sdk}} also has an analytics library. It makes sense that there should be a single analytics library, however {{appc-platform-sdk}}'s implementation is not used by any other product (e.g. not battle tested) and is missing a few key features that {{appcd-telemetry}} supports such as sending telemetry at set intervals instead of at the end of the process.    So, we need to determine if this ticket should even be worked on in the first place. If yes, then update {{appc-platform-sdk}} to be daemon friendly and update {{appcd-telemetry}} to use {{appc-platform-sdk}}."""
"DAEMON-93","New Feature","appcd-core",5,"Persist logs to disk","""The daemon needs to persist the log to disk. We can do this pretty easily by introducing a listener to the logger and writing the data to a log file. Every time the daemon is started, a fresh log file is created in {{~/.appcelerator/appcd/log}}.    We still need to determine a few things:  * Should we rotate old logs? Keep last 5 logs? gzip older logs?  * How should we handle log files that could potentially be huge?    The log messages should be streamed as objects containing metadata such as timestamps, etc. This structure should be preserved when written to disk."""
"DAEMON-95","New Feature","appcd-plugin-system-info",13,"appcd-plugin-jdk: Implement JDK service","""The {{appcd-plugin-jdk}} needs to expose a service that detects the JDK, via {{jdklib}}. The {{jdklib}} specifics are to be implemented by DAEMON-10."""
"DAEMON-96","New Feature","appcd-detect",13,"appcd-detect: Port over detect engine from node-appc v2","""The amazing detect engine lives in node-appc v2 and needs to be ported over to an appcd-detect package. The major change involves using the {{/appcd/fswatch}} instead of the old (buggy/incomplete) fs watcher."""
"DAEMON-97","New Feature","appcd-detect",8,"appcd-detect: Wire up Windows Registry library","""The {{DetectEngine}} has the necessary plumbing to poll the Windows Registry for paths to watch, however the actual call to query the registry is commented out until a solution is dropped in.    We need to select a library that allows us to query the registry. In the past, we've used {{winreg}}, but it requires a bit of abstraction to make it nicer to work with. Need to investigate the offerings in NPM and perhaps find a solution that allows us to listen to registry changes."""
"DAEMON-98","Bug","appcd-detect",5,"appcd-detect: watch tests do not exit","""h5.Description    On Windows running the unit tests they appear to 'hang' in a certain place, namely the appcd-detect unit tests and the {{watch()}} describe and the {{should redetect after initial detection}}. skipping that test allows the suite to run through and the process exit fine"""
"DAEMON-100","Improvement","jdklib",8,"appcd-plugin-jdk: JDK 9 is not detected","""h5.Description    JDK 9 has changed the registry key of Windows to {{HLKM\Software\JavaSoft\JDK}}. This needs to be added to [here|https://github.com/appcelerator/appc-daemon/blob/7d3c1dcb3766b7c8157fd68bcd07c1e51f658909/plugins/appcd-plugin-jdk/src/jdk-info-service.js#L158-L159]     Couple notes    - CurrentVersion returns 9, for JDK 8 it was 1.8  - jdklib currently fails to recognise JDK 9, it errors due to a missing JVM library, the jre folder no longer exists it seems. Will file a separate ticket for that  - There is no 32-bit JDK distributed https://stackoverflow.com/questions/46356345/can-java-9-run-on-a-32-bit-os but it can be built, we might not need to support detecting 32-bit if it is not distributed officially"""
"DAEMON-99","Bug","appcd-plugin",5,"appcd-plugin: Plugin host spawns a new console window on Windows","""h5.Description    On Windows when calling to a plugin (for example appcd exec /jdk/latest/info) a new node console window is spawned. This window then stays open until it's either killed by a user or the daemon is stopped. This could be problematic as it means that spawned plugins can pretty much die at the whim of a user.      I'm not sure whether it's fully possible to suppress the window however, recent PR into node might add that behaviour though https://github.com/nodejs/node/pull/15380"""
"DAEMON-102","Bug","appcd",2,"appcd exec --subscribe is not printing data payloads","""When running {{appcd exec /appcd/status --subscribe}}, it doesn't display any of the events despite there being a ton in the daemon log."""
"DAEMON-101","Bug","appcd-plugin",2,"appcd-plugin: Active request counter not decrementing for reloaded external plugin","""Somehow it's possible to make a request to an external plugin using {{appcd exec /<path>}}, then modify the plugin so that it is stopped, yet the active requests counter is not decremented. It's unlikely, but possible, that the request is actually still active after the plugin is stopped."""
"DAEMON-103","Bug","appcd",5,"""appcd start"" should not exit until the daemon has actually finished starting","""When running {{appcd start}}, it will spawn the appcd-core, but then exits with a success code. It doesn't wait for the daemon to actually initialize and load the plugins.    We need the start functionality to listen for an IPC message signalling the daemon is ready to go."""
"DAEMON-105","Bug","appcd-core",5,"config: Able to set a sub-key for keys that should not allow subkeys","""h5.Description    Calling something like the below will set a key on the property even though the key is a boolean in the JSDoc, this occurs on master and my appcd config PR branch        """
"DAEMON-109","Bug","appcd-plugin",2,"appcd-plugin: Calling <plugin-name>/latest does not return the expected info","""h5.Description    When calling {{appcd exec /jdk/latest}} it returns {{404 [object Object]}} it should print the plugin info to the console. It looks like the call is going through the error handler of the request made in the exec command    """
"DAEMON-106","Improvement","appcd-dispatcher",5,"appcd-dispatcher: Create a DataServiceDispatcher class","""There are several services that have very similar functionality where there's a single observable data store that is exposed via a {{ServiceDispatcher}} that supports filtered results and subscriptions. It would super handy (and ingenious) to introduce a {{DataServiceDispatcher}} that takes care of all this boilerplate."""
"DAEMON-116","Improvement","appcd-core|appcd-default-plugins",2,"appcd-default-plugins: Create a pseudo package","""We need a package that the appcd-core can look at to load all the default appcd plugins such as the android, ios, jdk, and windows plugins."""
"DAEMON-117","Improvement","appcd-detect",5,"appcd-detect: Improve code coverage","""Since the appcd-detect refactor, code coverage dropped mainly due to the improved error handling and advanced path watching."""
"DAEMON-119","Improvement","appcd-plugin-windows",3,"appcd-plugin-windows: Allow time interval for detections to be set by user","""h5.Description    Currently the intervals in the Windows plugin are hard-coded, it would be nice to allow a user to specify these themselves if they need to. Something like {{appcd config set appcd-windows-plugin.intervals.devices 5000}} for example. Then the plugin would need to also query the config to see if this is set    More context here https://github.com/appcelerator/appc-daemon/pull/111#discussion_r149122916"""
"DAEMON-122","Bug","appcd-plugin",3,"appcd-plugin: Prerelease versions are not loaded by version ranges","""h5.Description    *This is expected imo but filing for discussion*    If I version my plugin as {{0.1.0-0}} then executing {{appcd exec /myplugin/0.1.X/}} or {{appcd exec /myplugin/^0.1.0/}} will not find my plugin. Executing {appcd exec /myplugin/^0.1.0-0/}} will. This is because semver will never view a prerelease as valid in a non-prerelease version range.    /latest will work, and will load the prerelease version         This is important as it makes how we version things problematic. If we do prereleases then if consumers decide to call with 0.1.X or similar, then they will never get prereleases plugins, and we don't want them calling latest as that will just lead to problems"""
"DAEMON-123","Improvement","appcd-plugin-windows",2,"appcd-plugin-windows: Only wireup lookups when certain condition are met","""h5.Description    As Chris pointed out, it doesn't make much sense to do the detection of devices, emulators etc. if we don't have any visualstudios. We should probably do a VS detection, and then wireup everything else if we find some.    We should also probably only do this if we're actually on Windows too"""
"DAEMON-124","Bug","Tooling",8,"""gulp check"" no longer works properly since switching to workspaces","""Since Yarn workspaces have been enabled, {{gulp check}} is no longer working properly. It checks to see what is installed in the package's {{node_modules}} instead of the top-level workspace {{node_modules}}. Since it doesn't find a particular dependency installed, it says every package is not installed.    While fixing this, we should also make it more parallel so that it can compute the security and package update checks at the same time.    We may also need/want to come up with a more robust way of checking integrity. {{yarn check --integrity}} doesn't work well with Lerna."""
"DAEMON-127","Improvement","appcd-plugin",1,"appcd-plugin: Show more plugin system details","""We need to add more information to the plugin system's status object that is returned when we run {{appcd status --json}} such as the plugin scan paths."""
"DAEMON-126","Improvement","appcd-plugin-genymotion",5,"appcd-plugin-genymotion: Add support for custom deployed directory path","""h5.Description    As it is possible to support changing the deployed genymotion directory we should look into making the lookup of the deployed directory consider this path. On Windows we can query the registry for it (under HCKU\Software\Genymobile\Genymotion), I'm not sure how to find it on OSX and linux. we should also add a config setting called genymotion.deployed just incase it is not possible to find on non-Windows"""
"DAEMON-125","Improvement","appcd-core",1,"WebSocketSession: Allow msgpack to be disabled","""We should add the ability per connection to disable msgpack responses."""
"DAEMON-135","Bug","appcd-detect",8,"appcd-detect: First change rescan emits new event eventhough nothing changed","""When the detect engine is watching a folder where something changes, it triggers a rescan. The first time the rescan is done, the results are merged into the observable model and even though nothing has changed, it will emits an event. It should only emit an event when A) something of interest happens and B) the result has actually changed."""
"DAEMON-134","Improvement","appcd-plugin-android",3,"Android Plugin: Sort NDKs and assign default","""Currently the list of detected Android NDKs is not ordered and no default NDK is selected. This is only an issue if you have more than one NDK."""
"DAEMON-133","Improvement","appcd-plugin-android",3,"Android Plugin: Sort SDKs and assign default","""Currently the list of detected Android SDKs is not ordered and no default SDK is selected. This is only an issue if you have more than one SDK."""
"DAEMON-132","Improvement","appcd",8,"appcd logcat: Add support for a filter","""It would be useful to allow a filter to be passed into {{appcd logcat}} that would only display messages where the message namespace matched the specified filter."""
"DAEMON-131","Improvement","appcd",1,"appcd logcat: Add support for --save <file>","""It would useful if the {{appcd logcat}} command supported a {{--save <file>}} option to save the contents of the log buffer to a file."""
"DAEMON-130","Improvement","appcd",5,"appcd dump: Dump config, status, and log to file or stdout","""It would be helpful to introduce an {{appcd dump}} command that dumps the config, status, and log to a file. This would make bug reporting much, much easier."""
"DAEMON-129","Bug","appcd-plugin-android",13,"Android Plugin: Populate emulator target, api level, and sdk using default Android SDK","""To get the Android emulator's target, api level, and sdk name, we need to pass in an SDK for it to pull those bits of info. The problem is there could be more than one SDK. The Android plugin needs to select the best SDK starting with the one in specified in the config, then pass it into {{getEmulators()}}."""
"DAEMON-128","Bug","appcd-fswatcher",8,"appcd-fswatch: Recursive watching does not appear to work","""In all of my recent testing, recursive filesystem watching does not appear to work regardless of whether a depth is set."""
"DAEMON-140","Bug","appcd-plugin-ios",2,"system-info doesn't return ios information","""Start daemon, load http://localhost:1732/system-info/1.x/info. {{ios}} is {{null}}.  Plugin status:      appcd exec /ios/latest/info returns {{Cannot read property 'value' of null}}  appcd --debug:   """
"DAEMON-138","Bug","appcd-gulp",3,"appcd-gulp: Coverage tests blow up when --trace-deprecation is set","""When trying to get a bit more info about unhandled rejections, Node.js has a flag that can be passed in called {{\-\-trace\-deprecation}}. The idea would be to add this to the {{gulp test/coverage}} task and then we'd see it in the CI logs.    However, when this flag is set, for some reason {{nyc}} blows up because it can't load {{mocha-jenkins-reporter}}. But the rub is {{nyc}} is not supposed to load it. The {{mocha-jenkins-reporter}} is an argument to {{mocha}}, not {{nyc}}.    When adding {{\-\-trace\-deprecation}} and running {{gulp coverage}}, we get the following error:        We can fix that by applying the following patch:        But then we run into a problem where {{mocha-jenkins-reporter}} is expecting a {{mocha}} runner object and {{nyc}} doesn't pass one in.        I believe that {{mocha-jenkins-reporter}} should remain an argument to {{mocha}} and not {{nyc}} and that we need to figure out why {{nyc}} is sniping the {{\-\-reporter}} arg to mocha. Maybe it's doing a blind scrap on {{process.argv}}?"""
"DAEMON-137","Bug","appcd-gulp",3,"appcd-gulp: Local directories are baked into source maps","""The build system uses babel to transpile and generate the source maps. One of the args is the {{sourceRoot}} which is set to an absolute path. This absolute path gets baked into the generated files which is undesirable.    Need to see if we can do relative paths. If that doesn't work, perhaps we need rewrite all of the generated source maps."""
"DAEMON-145","Bug","appcd-plugin-system-info",1,"Subscribe on /system-info/1.x/info doesn't work","""*Problem Description:*    When we subscribe on {{/system-info/1.x/info}} changes - Appcd should publish the changes if any changes in iOS devices, Android devices, Xcode changes, etc.    *To Reproduce:*    # appc appcd exec /system-info/1.x/info/ --subscribe  # Now connect iOS device    *Actual:*  No changes    *Expected:*  Return system-info with the iOS device    Note: {{appc appcd exec /system-info/1.x/info/ios/devices --subscribe}} is working fine  """
"DAEMON-143","Bug","appcd-plugin-system-info|ioslib",1,"iOS simulators are missing in the system-info - intermittent issue","""*Problem Description:*    Can't find the simulators in the /system-info/1.x/info. However, it's an intermittent issue.    *To reproduce:*  # Run sudo npm install appcelerator@4.2.11-2 -g  # Run appc use 7.0.0-master.11  # Run appcd appcd start  # Run appc appcd exec /system-info/1.x/info    *Versions:*  Appcelerator Daemon, version 1.0.0-2  CLI 7.0.0-master.11    Please find the attached system-info  [^system_info2.txt]  and  [^appcd_status_1.0.0-2.txt]   """
"DAEMON-142","Bug","androidlib",2,"system-info doesn't show android info","""I'm using appcd 1.0.0-2 and can't see the android info when I execute {{appc exec /system-info/1.x/info}}    Please find the attached appcd status and system_info files  """
"DAEMON-141","Bug","appcd-plugin-ios|ioslib",5,"Appc Daemon is crashing the terminal and studio ","""*Problem Description:*    MacOS terminal is getting crashed If you start a daemon from a terminal and leave for some time. And, I can't even start a studio due to resource unavailability - it just crashes while launching it.                    Studio crash log:  https://gist.github.com/kolipakakondal/904a50e1031a500e74ee526ec54ea423  """
"DAEMON-159","Bug","appcd-plugin",3,"appcd-plugin: Can't [force] stop a plugin that's starting","""It's possible for a plugin to be started, but activate() to be hung waiting for an unresolved promise. In this case, you can't stop the plugin until it starts.    We should allow plugins to be stopped if the plugin is started, but not activated.    We should allow plugins to be force stopped regardless if it's started, starting, or stopping."""
"DAEMON-158","Bug","appcd",1,"Querying iOS devices results with ""Cannot find module 'plist' ""","""*Description*  Running the command """"appc appcd exec /ios/latest/info/devices""""  errors out with a message cannot find plist    *Steps to reproduce*  1. Install CLI 7.0.0-master.23  2. Start the daemon with """"appc appcd start""""  3. Connect an iOS devices and check that it's recognized eg. appc ti info  4. Run the command """"appc appcd exec /ios/latest/info/devices""""    *Actual result*  This result is seen:  Failed to load plugin: Cannot find module 'plist'    *Expected Result*  An output showing some details about the iOS device that is connected. No errors should be seen."""
"DAEMON-157","Improvement","appcd",1,"appcd: Suppress banner when run through appc","""h5.Description    It was raised that the double banner when running {{appc appcd}} shouldn't happen, we should suppress this, I think we can use the APPC_ENV environment variable to do so, alternatively we could have the CLI push a {{--no-banner}} flag but I prefer the former"""
"DAEMON-156","Improvement","appcd",3,"appcd: Auto import config settings from Titanium CLI","""It would great to be able to import the Titanium CLI config into the appcd user's config in {{~/.appcelerator/appcd/config.json}}.    Mappings would be as such:    * {{android.adb.port}} (Number) -> {{android.adb.port}} (Number)  * {{android.executables.aapt}} (String) -> {{android.executables.aapt}} (String)  * {{android.ndkPath}} (String) -> {{android.ndk.searchPaths}} (Array<String>)  * {{android.sdkPath}} (String) -> {{android.sdk.searchPaths}} (Array<String>)    The list goes on and on... https://wiki.appcelerator.org/display/guides2/Titanium+CLI+Options.    Here's the unmaintained list: https://wiki.appcelerator.org/display/CLI/CLI+Config+Settings."""
"DAEMON-155","Bug","ioslib",1,"ios info is null due to ""Failed to load plugin: Cannot find module 'plist' ""","""I can't see ios info in the  {{appc appcd exec /system-info/1.x/info --json}}    *To reproduce:*  # Run appc use 7.0.0-master.22  # appc appcd exec /system-info/1.x/info --json  # Verify ios info - it's null    Please find the attached appcd dump file. """
"DAEMON-154","Bug","appcd",2,"JSON Strings should be wrapped in double quotes","""json strings are coming in single quotes but it should be in double quotes.    *To reproduce*  # Run {{appc appcd exec /system-info/1.x/info --json --no-banner}}  # Valdiate the output here https://jsonformatter.curiousconcept.com     Studio json parser validation is failing due to this.  """
"DAEMON-153","Bug","appcd",2,"appcd: appcd start --debug should respect a --no-colors flag","""h5.Description    Writing up a guide on how to provide information when reporting issues. Noticed that appcd start --debug --no-colors still logs in colour, would be nice if the debug logs provided by people didnt have the escape codes.    h5.Steps to repro    # appcd start --debug --no-colors    h5.Actual    Colours    h5.Expect    No colours"""
"DAEMON-151","Bug","ioslib",1,"Spawning the ios plugin through appc cli errors with cannot find module plist","""h5.Description      ioslib has a missing dependency which causes an error when distributed in the cli due to the legacy bundling style used.    h5.Steps to reproduce    # {{appc use 7.0.0-master.23}}  # {{appc appcd start && appc exec /ios/latest/info}}    h5.Actual    Error cannot find plist    h5.Expected    No error, environment info returned"""
"DAEMON-148","Bug","appcd-plugin-android",1,"Android emulators missing target, api-level and sdk-version information","""*Problem Description:*  Android emulators are missing target, api-level and sdk-version information - which is available in the ti info and also used in the studio     And also, it doesn't have SDK, NDK and targets information    *To reproduce:*  # appc use 7.0.0-master.19  # appc appcd exec /system-info/1.x/info/android   # Verify android emulator information    *Actual:*  No api-level,sdk-version and target in the emulator    *Expected:*  We should have all the information which is provided in the ti info    Please find the attached android info file  [^android_info.json]   """
"DAEMON-147","Improvement","appcd",2,"appc status: Hide windows-Plugin for unix / macOS machines","""When running {{appcd status}}, the following (red) line occurs:    It's not an issue because I am not running on Windows, but it would be """"UX friendly"""" to either hide it on the mac or just say """"Not available"""" like Studio does for the Windows SDK."""
"DAEMON-166","Bug","appcd-plugin-android",8,"appcd-plugin-android: Plugin activation hangs if no Android SDKs are found","""If the system does not have any Android SDKs, the detect engine will return an empty array, however since it is initialized to an empty array, there's no change and thus no notifications and the detection hangs.    The fix requires a check if the results are empty, then resolve the SDK detection. However in doing this, it exposed a timing bug with NDK detection."""
"DAEMON-163","Bug","androidlib|appcd-plugin-android",2,"Windows OS:  /system-info/1.x/info command is not responding","""/system-info/1.x/info command hangs on the windows machine. It's an intermittant issue.    Looks like it's getting into recursive loop on """"Detecting devices info"""""""
"DAEMON-162","Bug","appcd-plugin-windows|windowslib",3,"Windows system-info: 10.0 SDK emulators are not shown","""Windows Phone SDK 10.0 emulators are missing in the windows system-info.  """
"DAEMON-161","Bug","appcd-plugin-windows",1,"Windows: Visual Studio path is incorrect in the system-info","""Visual studio path is incorrect in the windows system-info path    *Actual:*  C: /ProgramFiles(x86)/MicrosoftVisualStudio14.0/    *Expected:*  C:\Program Files (x86)\Microsoft Visual Studio 14.0      Same goes for the Windows Phone SDK path    *Actual:*  C: \ProgramFiles(x86)\MicrosoftSDKs\WindowsPhone\v8.1\    *Expected:*  C:\Program Files (x86)\Microsoft SDKs\Windows Phone\v8.1  """
"DAEMON-160","Bug","appcd-plugin-ios|ioslib",5,"ioslib: Versioning of package on npm is causing issues","""h5.Description    *I know this isn't really a proper ticket but I needed somewhere to dump this*    Currently the ioslib version being pulled in is ioslib@2.0.0-beta.3 based off the version range of ^2.0.0-8. This (surprisingly to me) is correct in semver land and 2.0.0-beta.3 is considered to be greater than 2.0.0.-10 https://runkit.com/ewanharris/5a0e34d8e7d5da001228faf7    So currently we're borked and need a way out, here's the possible solutions, in no order.    # Bump ioslib to become ioslib@2.0.0-beta.4, replacing 2.0.0.-10  # Change the appcd-plugin-ios dependency to next, stay like this  # Change the appcd-plugin-ios dependency to next, ask npm nicely to remove ioslib@2.0.0-beta.3 (I dont see why they wouldnt), then eventually move back to ^2.0.0-10 version ranges.  # Release ioslib@2.0.1-0, move appcd-plugin-ios to ^2.0.1-0    I vote for 3 or 4 with an added sprinkle of promising to never do -beta.X on npm packages again :)"""
"DAEMON-169","Bug","appcd-plugin-ios",3,"Issues with Xcode info returned","""Couple of issues found in the Xcode information returned when querying """"appc appcd exec /ios/latest/info""""    1. Any Xcode that is not present in the /Applications is not returned    2. The latest xcode in the system is returned as default even after switching to another xcode for default.   Check the attached """"appcd.txt """" for output of running the """"appc appcd exec /ios/latest/info"""" and the """"appcCLI.txt"""" for output running """"appc ti info -t ios""""    The Xcode in downloads folder was made default but daemon output returns the latest code in /Applications as the default and does not list the Xcode in /downalods """
"DAEMON-168","Bug","ioslib",1,"appId is missing in the provisioning profiles","""appId is missing in the provisioning profiles"""
"DAEMON-167","Bug","androidlib",13,"Android and Genymotion emulators are empty","""Android and Genymotion emulators are shown empty on the latest daemon 1.0.0-12    Please find the attached files"""
