"issuekey","type","components","storypoint","title","description_text"
"DURACLOUD-390","Story","Security",1,"Security over UserDetailsService.getUsers()","""This improvement is to add method security over UserDetailsService.getUsers() to limit access to this call to ROLE_ADMIN."""
"DURACLOUD-394","Bug","UI",2,"Page load latency","""The Duradmin pages are built using jQuery. When the browser loads, the scripts pull data while building the page, creating a perceptible delay in rendering. A recommended solution may be to pull some of the jQuery back and not try to build the screen using as much scripting.  Browser versions and usage scenarios need to be added to this jira item."""
"DURACLOUD-398","Bug","UI",1,"UI shortcuts which are not useful should be disabled","""Holding shift + one of the arrow keys does odd things to the display. These shortcuts should be disabled."""
"DURACLOUD-397","Bug","UI",1,"Metadata editor allows for blank values","""Metadata editing via DurAdmin (using both the regular editor and the """"Edit Metadata"""" dialog) allows you to add empty name/value pairs to the metadata list. Metadata names should be required. Although the UI appears to allow empty metadata name/values, if the name is empty, the metadata does not persist."""
"DURACLOUD-401","Story","Services",1,"Use application/xml as response Content-Type for XML-returning REST API methods","""Most of the REST API methods that return XML today use text/xml, but application/xml is a actually a better choice due to character encoding issues:  According to the specification of the text/* media types (RFC2046), if a charset parameter is not specified in the declaration of mime type (at the end of the Content-Type value, ala """"text/xml; charset=utf-8"""", it must be assumed that the body is encoded in US-ASCII.  The """"encoding"""" declared in the XML declaration is supposed to be ignored.  Here are a couple online posts that further explain the problem:  *  http://annevankesteren.nl/2005/03/text-xml *  http://www.grauw.nl/blog/entry/489  It's clearly the intent that DuraCloud REST API methods that return XML are encoded in UTF-8 (because the xml declaration says so), but according to the standards, because text/xml is used instead of application/xml, and the Content-Type is not declared with a """"charset=utf-8"""" MIME parameter, the xml declaration is supposed to be ignored by clients and they should assume US-ASCII."""
"DURACLOUD-400","Bug","Storage",1,"DuraStore REST API: text/plain response from getSpaces","""Just an inconsistency I noticed while looking at the REST API. This particular method gives a response Content-Type header of """"text/plain"""". Most other methods that return XML declare their Content-Type as text/xml.  For example:  https://demo.duracloud.org/durastore/spaces?storeID=0  ...gives text/plain, but:  https://demo.duracloud.org/durastore/cwilper-test?storeID=0  ...gives text/xml."""
"DURACLOUD-402","Story","Service Infrastructure",1,"Allow for local service repository","""It is currently required that the service repository for a DuraCloud instance be hosted on another DuraCloud instance. This task is to allow the service repository to be hosted within the same instance. This will both simplify the deployment of stand-alone DuraCloud instances (for users of the open source platform) and lead the way toward allowing multiple service repositories to be associated with a single instance."""
"DURACLOUD-404","Story","Service Infrastructure",1,"Duraservice: clean re-initialization","""Currently, when re-initializing duraservice, due to caching, some elements do not take on the new re-initialize values. This improvement is to determine and implement what is required to make duraservice re-initialization work as if it were being initialized from scratch."""
"DURACLOUD-403","Story","Utility",1,"Improve binary installation package","""In the 0.9 release the first binary installation package was created. This allows system admins to deploy an instance of DuraCloud without needing to build from source. This was a good first step, but there are a few pieces which could make the process smoother:  - Include wars with names that do not include version. When the jars are dropped into tomcat with the release version included in the file name, they are not deployed to the expected context path (i.e. rather than a context path of /durastore it is instead /durastore-<version>. The installation package zip file includes the version number, this should be sufficient. - Include the app-config jar, as this is needed to configure the instance. - Include an example properties file to be used with app-config.jar for instance initialization. - Include a default/example logback.xml file which can be used within the service bundle home. - Update included run.bat file to properly pick up environment variables in a Windows environment - Allow for the use of a local service repository (handled by DURACLOUD-402) - Update the included readme.txt file to have complete instructions for standing up a DuraCloud instance using the files provided with the installation package. Parts of this document can refer to the wiki for further explanation, but ideally, the entire process would be well enough defined in the readme such that the links to the wiki would be optional reading."""
"DURACLOUD-407","Story","Services",1,"Service.xml: generate various renditions","""This feature is to have the services.xml service-repo manifest generated for each of the various DuraCloud account package types: - archiving / preservation - media access - professional - trial"""
"DURACLOUD-406","Story","Services",1,"Service.xml: generate on build, not on test","""This improvement is to have the services.xml service-repo manifest created during the mvn 'package' phase instead of during 'test'."""
"DURACLOUD-409","Bug","Services",20,"Failed to copy all files when running a large Duplicate-on-Demand service","""A small percentage of files are not copied during the execution of a large Duplicate on Demand service execution.  This can result in either a missing file or a zero length file in the target space.  This has bug has been demonstrated repeatedly both between different providers and copies back to the same provider.  However, it has only been observed in large file sets (circa 70,000)."""
"DURACLOUD-422","Bug","UI",0,"When only one storage provider is configured, the Provider display should not be a selector","""When only one storage provider is configured for an instance, the Provider selection box in the upper right corner currently provides a drop down to a small empty box. There is really no need for a selection box when there is only one provider."""
"DURACLOUD-423","Story","UI",1,"Filter display of service properties","""This feature is to omit the rendering of service properties that have names prefixed with """"System """". These are service properties that are useful for monitoring and scripting, but are probably confusing for end-users of Duradmin."""
"DURACLOUD-424","Story","Services",3,"Service completion state must be accurate: non-bulk services","""This improvement is to reflect the completion state of non-bulk services as """"success"""" or """"failure"""". Currently, the service state remains """"started"""".  Affected services: bit integrity checker bit integrity checker tools image transformer  Additionally, the end-time of the service should be captured in the service properties."""
"DURACLOUD-429","Story","Storage",3,"iRODS/Chronopolis Storage Adapter","""This feature is to add a new storage adapter to connect to iRODS/Chronopolis, ala S3, Rackspace, & Azure. The base code has already been provided by Mike Smorul."""
"DURACLOUD-431","Bug","UI",1,"Duradmin mimetype editor: 'application/atom+xml' regex","""When attempting to set the mimetype of a content item to 'application/atom+xml', the error """"Invalid Mimetype"""" is displayed. This prohibits the setting of the desired mimetype."""
"DURACLOUD-433","Story","UI",1,"Duradmin service status","""When a service is deployed via duradmin, an entry is created detailing the: - service - hostname - status  The 'status' is apparently populated when the service is deployed and never updated as the actual service status changes through the course of processing. This improvement is to keep the status info in the UI entry up-to-date by pulling the content from the """"Service Status"""" property instead of from the Deployment.status The current/accurate status info is also displayed on the right hand side, under the service details."""
"DURACLOUD-432","Bug","UI",1,"file name collisions not detected in Google Chrome","""When using DurAdmin with Google Chrome to upload a file, there is no file name collision detection or pop-up warning. The upload simply replaces the file. I am using Google Chrome on my mac os x. Note that the file name detection and pop-up did work on Firefox."""
"DURACLOUD-435","Bug","Storage",1,"Reinit should clear the cached StorageProviders","""Upon reinit the cached StorageProviders should be cleared in order to specify different stores"""
"DURACLOUD-438","Story","Service Infrastructure",1,"Add service-result to completed service properties","""This improvement is to add a new service property across all services that have a completion (success or failure) that notes the content-id of the service result file. This property should be set upon service completion."""
"DURACLOUD-436","Story","Service Infrastructure",2,"Service registry name and service.xml dependency","""This improvement is to decouple the dependency on the content-id of the service.xml file of a service registry from the space-id of the registry itself. Currently, the content-id is required to be identical to the space-id with the addition of the '.xml' extension. The service.xml content-id should be allowed to be any name."""
"DURACLOUD-439","Bug","UI",1,"Enforce space id rules for services","""Enforce space id rules when entering a space name for Duplicate on Demand and any other service"""
"DURACLOUD-440","Bug","Storage",5,"Handle all unicode characters for storing and retrieving content","""This task is to ensure that a content item can be added and retrieved from both DuraStore and DurAdmin using any characters that can be expressed via unicode.  Generally, it seems like it's possible to add content items with any unicode content ID, but the problems come in when attempting to access/update/delete those items. These problems are not consistent between DuraStore and DurAdmin. Occationally DuraStore allows for retrieving files that DurAdmin does not.  A few Ascii content IDs which currently fail this test are below. This list is not exhaustive, just a examples.  test#item   - duradmin cannot load content   - error when accessing via durastore  test%item   - duradmin cannot load content   - bad request response from durastore  test&item   - duradmin cannot load content   - works fine in durastore  test+item   - duradmin cannot even bring up metadata   - works fine in durastore  Of course, content IDs with non-ascii characters also have problems:   1. blankHélènåJör.txt 2. blankπ × { } © 佈 б ' ' —.txt  #1 seems to be only a problem in DurAdmin, the file can be retrieved and deleted via DuraStore with no problem. #2 is a problem for both DurAdmin and DuraStore, the file cannot be retrieved or deleted via either. """
"DURACLOUD-441","Story","Service Infrastructure",1,"ServiceManager and ServiceManager Client to share Interface","""This improvement is for the following two classes to implement the same interface: org.duracloud.client.ServicesManager.java org.duracloud.duraservice.mgmt.ServiceManager.java"""
"DURACLOUD-443","Story","Report",1,"Service Report: create schema and serializer for ServiceReport.getCompletedServicesReportList()","""This task is to create a schema and serializer for the list of content-ids returned from ServiceReport.getCompletedServicesReportList(). The expected xml should look something like this: <service-report-ids>     <service-report-id>Service-Report-2011-06-27.xml</service-report-id> <service-report-ids>"""
"DURACLOUD-446","Bug","Services",2,"Service Reports: Comma-delimited content-ids","""This bug is that service reports become invalid if a content-id contains a ',' since currently service reports are output as comma-delimited. A potential solution is to create tab-delimited service reports."""
"DURACLOUD-448","Bug","Services",0,"Get Bulk Image Conversion service working","""Due to a change in the AMI used to run hadoop jobs in Amazon EMR, the bulk image conversion service no longer works. The failing portion is the bootstrap task which installs ImageMagick. The error that shows up on the console when attempting to run any line in the install script is:  E: Wow, you exceeded the number of versions this APT is capable of. E: Problem with MergeList /var/lib/apt/lists/http.us.debian.org_debian_dists_testing_main_binary-amd64_Packages E: The package lists or status file could not be parsed or opened.  This is a known bug, detailed here: https://forums.aws.amazon.com/thread.jspa?messageID=254336&tstart=0. A work-around is noted in the link that has been tested to work and allow ImageMagick to install.  Ideally this issue will be fixed by Amazon with the introduction of a new EMR AMI, but if this is not the case by shortly before release time, the work-around should be employed."""
"DURACLOUD-456","Bug","UI",1,"UI: Administration tab always contains text: ""No users defined""","""This task is to only display the """"No users defined"""" text on the Administration tab when there are actually no users defined."""
"DURACLOUD-455","Bug","UI",1,"UI: Display service status correctly","""Currently, the table which lists all deployed services has a column called Status which always displays STARTED, regardless of the actual status of the services. This value is being read from """"deployment status"""" which is meaningless. This task is to read in the actual status of each service from the service properties and display that in the table."""
"DURACLOUD-454","Bug","UI",1,"UI: Adjust the service deployment box to remove scroll bars","""This task is to re-adjust the pop-up dialog used for deploying services so that scrolling is not necessary and no scroll bars are displayed."""
"DURACLOUD-453","Bug","UI",1,"UI: Use different icons for the content item Download and View links","""This task is to replace the button icon for the content item View link, as it is currently the same as the download link. Perhaps a eye icon or something similar would work."""
"DURACLOUD-452","Bug","UI",1,"UI: Remove the provider drop-down when there is only one provider","""This task is to remove the storage provider drop-down when only one provider is enabled."""
"DURACLOUD-451","Bug","UI",2,"UI: Use different icons for each service","""The goal of this task is to include a different icon beside each service, both in the deployed services listing and the available services listing."""
"DURACLOUD-450","Story","Report|Services|UI",2,"Link Service Report in service properties display","""This improvement is to add a link to the services """"Report"""" property to display (possibly as a flyout?) a tabular form of the service results."""
"DURACLOUD-457","Story","Report|Services",1,"Service Monitoring on reconfigure","""This improvement is to ensure that a monitor thread is in place when a service is reconfigured.  A service can be reconfigured while it is either still running, or after it has completed. Since a reconfigured service retains the same deployment-id, a service that is still running will continue to be monitored by the original monitoring thread. However, a service that is complete needs to have a new monitor thread started since the service is effectively restarted via a reconfiguration."""
"DURACLOUD-458","Story","Storage|UI",2,"Space Delete: Indicate to users when a space is in the process of being deleted","""Currently, when deleting a space of reasonable size there is a dialog that spins for a while, then the space is removed from the spaces list. But if the list of spaces is refreshed, the """"deleted"""" space shows up again. In the background a process is still running to delete the space, but there is no way for the user to know that this is happening.  This task is to make it clear to users when a space is in the process of being deleted.  """
"DURACLOUD-462","Bug","UI",1,"UI: Inform users that the characters '\', '?', and ';' cannot be part of a Content ID","""Three characters are not allowed in content Ids: '\', '?', and ';', as noted in IdUtil and here: https://wiki.duraspace.org/display/DSPINT/Space+and+Content+Name+Restrictions. Errors are returned from DuraStore when trying to add an item with a content Id including '\' or '?' characters, but no useful information is presented to users in DurAdmin. No error is returned with the use of the ';' character, as the character doesn't get passed through to DuraStore. There should be a validator in DurAdmin to catch these characters, and users should be provided a useful error message indicating the problem."""
"DURACLOUD-460","Bug","Storage|UI",3,"Provide informative error messages for special characters in space and content properties","""Special characters included in metadata names or values which are added to spaces or content show up immediately in the list of metadata/tags, but when those special characters aren't valid http header values, the information is not actually added to the space or content item in the provider. This task is to to check for valid characters and pass back errors to users so they know the allowable characters."""
"DURACLOUD-465","Bug","Storage",2,"Handle semicolon character","""When content whose ID contains a semicolon (;) character is added on a DuraCloud instance, the characters after the semicolon are dropped. The file is available, but the ID is wrong."""
"DURACLOUD-464","Bug","UI",2,"UI: XML files viewed in Chrome are appended with javascript code","""When using DurAdmin via the Chrome browser, selecting a file of type XML, and choosing to View the file, the XML is rendered correctly, but is followed by a block of javascript code, starting with """"try{function lpshowmenudiv(id)""""."""
"DURACLOUD-466","Task","Common",2,"DuraCloud Constants","""This task is to create a new maven project that simply holds constant values required across the other projects. Likely, these constants should be implemented as enums. Examples include: - DELIM = '\t' - ENCODING = """"UTF-8""""  Other candidates include service constants (see: org.duracloud.services.ComputeService.java) and other common, constant, classes that have no other dependencies such as: org.duracloud.common.util.DateUtil.DateFormat.java"""
"DURACLOUD-469","Story","UI",1,"UI: Display the selected service on the service configuration dialog","""The name of the service which was selected needs to be displayed on the screen used to configure the service. Currently there is just text that reads """"Configure the Service"""", which isn't very helpful."""
"DURACLOUD-468","Bug","UI",1,"UI: Add message to indicate when no other services are available to deploy","""When all services are deployed, and you click on Available Services, there is no message that there are no services available"""
"DURACLOUD-467","Bug","UI",1,"UI: Using Enter key on Add Space selects Closed space access","""Using the Enter key on the Add Space dialog to submit the request to add a space both selects the Closed access button and submits the request. The space is created correctly, but the access button indicates the default Open state before the Enter key is hit, then the space ends up with Closed access after it is created.  Tested on: Windows 7; Firefox 5.0; Chrome 12.0.742.122"""
"DURACLOUD-478","Task","Storage",1,"Facilitate integration: CDL Merritt ","""This task is to support the conversations and integration of Merritt with DuraCloud. Likely the software development will all be on the CDL side, but some time and effort will be needed as support."""
"DURACLOUD-475","Story","Dashboard",3,"Create consistent css styling for reporting","""This improvement is to restyle the Dashboard Storage and Services tabs to have a consistent styling with the rest of the duradmin application."""
"DURACLOUD-482","Story","UI",1,"Re-Add DuraCloud favicon","""This update is to re-add the DuraCloud favicon to the duradmin application. In release 1.0.0, its rendering was somehow dropped."""
"DURACLOUD-481","Story","Services",2,"CloudSync Service","""This feature is to add a new CloudSync service. The service will likely be a webapp service (ala j2kservice). Note: CloudSync itself should probably by updated to take its working directory as an initialization argument."""
"DURACLOUD-485","Story","Client|Storage",3,"StoreClient/REST support for object copy/rename","""This feature is to expose the StorageProvider.copyContent() method through the DuraStore REST API as well as update the storeclient. However, this feature should not be implemented until the patch submitted to Rackspace has been incorporated into the Rackspace java-client baseline. https://github.com/rackspace/java-cloudfiles/pull/18"""
"DURACLOUD-484","Story","UI",3,"DurAdmin support for object copy/rename","""This feature is to add UI support for single content copy/rename operations."""
"DURACLOUD-492","Story","Client",1,"StoreClient moveContent()","""This feature is to add an additional method to the storeclient, namely, moveContent(). This method will simply call copyContent() followed by deleteContent()."""
"DURACLOUD-493","Bug","Security|UI",1,"Duradmin login url","""This issue shows up in the following scenario: - Launch an instance as root user from the Management Console - the login fails (as expected); but typing in the correct root username/password continues to fail - until manually removing the trailing portion of the URL: """"login?error=true""""  It would be ideal if an incorrect login using the pattern as in the MC did not produce this URL in the browser."""
"DURACLOUD-497","Task","Services",1,"Remove Image-Conversion Services (temporarily)","""This task is to remove the two image conversion services: - bulk image conversion - non-bulk image conversion  from the list of available services for the 1.1 release. These services will become available once again when a strategy has been developed to help users manage the error cases."""
"DURACLOUD-496","Story","Storage",2,"ContentStore Duplicate Across Providers","""This feature is to provide users a way to copy a single item from one storage provider to another storage provider (or within the same storage provider). The implementation will likely be similar to the ContentStore.copyContent(), but will contain an optional source storeId. This effort should also include exposing the cross-provider copy functionality at the ContentRest level of Durastore. """
"DURACLOUD-498","Bug","Client",2,"SyncTool does not recognize chunked content","""The issue here is seen in two scenarios: 1. Content that is chunked into DuraCloud during one run of the synctool is not recognized as existing in the space on a subsequent run of the synctool. 2. Content that is chunked into DuraCloud during one run of the synctool is not recognized as existing locally on a subsequent run of the synctool, and if the --sync-deletes flag is set, then the chunks are not deleted from the DuraCloud space."""
"DURACLOUD-501","Story","Storage",1,"Throw exception on space names which are too long","""This item is to ensure that an error is thrown back to the user when a space to be created has a name which exceeds the maximum name limit. Currently the name is just truncated, and the truncated name isn't displayed until a refresh of the UI.  See S3ProviderUtil line 133 for the spot where the S3StorageProvider likely does the truncation. All current active storage providers (S3, Rackspace, Azure) should be checked for this same behavior.  Example of a space name that is too long (for S3): duracloud-1-1-0-snapshot-service-repo-trial-test """
"DURACLOUD-500","Bug","Client",1,"SyncTool does not delete empty subdirectories","""The issue here can be seen in the following scenario: # create an empty DuraStore space # create a local directory with subdirectories, add files # run synctool ** verify space/directories are the same # delete a local file at the top-level or within a subdirectory (but if in a subdirectory, make sure more content remains in that subdirectory) # run synctool with '--sync-deletes' ** verify content is deleted from the space # here is the issue: delete local content in any of the following ways: ** from a subdirectory, leaving that subdirectory empty ** remove everything from the local directory # run synctool with '--sync-deletes' # Error: notice content is not deleted in space """
"DURACLOUD-504","Bug","Report",1,"OOM on Re-Initialization of Durareport","""This issue is revealed when performing multiple re-initialization of a DuraCloud instance via the app-config or MC. It would appear that the report collection threads created during initialization are not properly shutdown on an immediate, subsequent re-initialization. After a few re-inits an OOM is seen."""
"DURACLOUD-503","Story","Services",1,"New service plan: All Services","""This task is to add a new service plan: """"all"""", that includes all services."""
"DURACLOUD-505","Bug","UI",1,"Deployed services list is not refreshing","""Once a service has been deployed, the service information is not being displayed in the deployed services list."""
