"issuekey","type","components","storypoint","title","description_text"
"DURACLOUD-286","Story","Services",2,"Allow system services to be deployed along with services which depend on them","""This task will remove the system services (imagemagick, webapp util) from the list of deploy-able services and instead have them be deployed as needed when dependent services are deployed. Likely this will mean bundling the jars for these services into the services for which they are a dependency, and updating them to start when they are deployed into OSGI."""
"DURACLOUD-285","Bug","Services",3,"Bottleneck in hadoop processing","""Two runs of the Bulk Bit Integrity service over the same 1TB set of BHL content took approximately the same amount of time (a few minutes over 8 hours.) The problem is that the first run used 10 small instances and the second run used 10 x-large instances. The x-large instance should have completed the task much faster, not only because they have higher bandwidth and compute capacities, but also because they are set to use 8 mappers per instance rather than the small instance setting of 2.   This task is to discover and fix the bottleneck which is not allowing the x-large instances to run at full capacity."""
"DURACLOUD-288","Bug","Storage",1,"MS-AZURE Space item count is off by one","""The number of items listed in an empty AZURE space is -1. The number of items listed in an AZURE space with one content item is 0. etc..."""
"DURACLOUD-287","Bug","UI",1,"Odd characters seemingly replace copyright symbol -- UTF8 issue?","""At the bottom of the DurAdmin UI it says, """"ï¿½2010 DuraSpace.org""""."""
"DURACLOUD-293","Story","Storage",1,"Improve performance for retrieve content metadata in AzureStorageProvider","""Move the generation of content checksum from getContentMetadata to addContent.  Also waiting for feedback from the Azure team to find out why they do not provide the md5 in the eTag."""
"DURACLOUD-299","Story","Services",1,"Cross-Service Clean up","""The clean should include: 1. change order of services to be logical (or possibly alphabetical) 2. change name of services in UI to have the same prefix if they are variations on the same service     - example: Bit Integrity Service - Bulk """
"DURACLOUD-298","Story","Services",1,"Bit Integrity Service: split into two services","""The clean of the Bit Integrity service should include: - remove 'salt' from UI - split the service into two services:  -- Bit Integrity Tools (generate & compare) -- Bit Integrity (verify)"""
"DURACLOUD-295","Bug","UI",1,"When using the previous and next buttons in the DuraCloud Administrator interface, the ""Space Detail"" section on the right disappears.","""When navigating through the list of content items for a space using the previous and next buttons in the DuraCloud Administrator interface, the """"Space Detail"""" section on the right disappears and only reappears once you re-select the space or click on an individual item."""
"DURACLOUD-304","Story","Services",1,"Update Image Transformer service deployment options","""These changes apply to both the Image Transformer and Bulk Image Transformer services:  - Clarify the """"Destination Color Space"""" such that it is not confused with a DuraCloud space - Move file name prefix/suffix options directly under source space"""
"DURACLOUD-303","Story","Services",3,"Simplify deployment of bulk services","""Items to simplify for bulk services (Duplicate on Demand, Bulk Image Conversion, Bulk Bit Integrity Checker):  1. Use a default setting for number and type of instances. The number and type will depend on the service and will require testing to determine a reasonable default. (10 large instances should work for Bulk Bit Integrity, testing by the pilot partners should help narrow in on good defaults for Duplicate on Demand and Bulk Image Conversion)  """
"DURACLOUD-302","Story","UI",1,"Remove ""Location"" selection on service deployment via DurAdmin","""Being able to select an alternate deployment location when deploying a service is a feature to come down the road, but in the meantime, the UI should not display this option when none of the services use it."""
"DURACLOUD-305","Task","Storage",3,"Azure Storage Provider - list space contents contains truncated contentId","""The name attribute returned from IBlobContainer.listBlobs sometimes truncates the contentId.  Instead parse the contentId from the uri attribute until Azure4J fixes this issue - https://sourceforge.net/tracker/?func=detail&aid=3116592&group_id=266876&atid=1135911  http://www.windowsazure4j.org/learn/java_docs/org/soyatec/windowsazure/blob/IBlobProperties.html"""
"DURACLOUD-309","Story","Services|Storage",3,"Audit log service","""This task is to capture and make available to users audit logs which list the activities that have occurred in DuraCloud. There will likely need to be a separate set of logs for storage and services.   Once messaging support has been completed on storage and services, a new service could be created to listen to the messages being sent and store write those to log files which are stored in the user's storage area."""
"DURACLOUD-311","Bug","Services",2,"sync tool syncing .ds_store files from mac","""The sync tool syncs .ds_store files and other peripheral files that are autogenerated by a mac in a folder but that are not actually content that needs to be synced to DuraCloud. Would be nice if the tool knew to automatically ignore these types of files."""
"DURACLOUD-312","Story","Services",1,"ServiceInfo.clone()","""The clone() method needs to be implemented in order for """"deployedServices"""" within ServiceManager.java not to have their SystemConfig data member become null after deployment when it is currently going out of scope."""
"DURACLOUD-314","Bug","Services",3,"Bulk Bit Integrity Service: error allocating memory","""This issue is to resolve the bug recorded at the following link: https://wiki.duraspace.org/display/duracloudpilot/Reported+Issues From Bryan Beecher (ICPSR) on 12/3  The hadoop logs are attached. A brief scan of the logs indicates that the hadoop servers are running out of memory. """
"DURACLOUD-313","Story","Security",2,"Security initialization","""This improvement should disallow updates to the root user security credentials via the REST API."""
"DURACLOUD-315","Story","Dashboard|Report|Storage",13,"Storage Usage Report Service","""Provide a way to generate a report with at least the following information:   - Number of files for each space - Total size of files stored in each space - Average file size for each space - File types (mimetypes) represented in each space  - Total number of files (all spaces) - Total size of all files (all spaces) - Average size of file (all spaces) - File types (mimetypes) represented (all spaces)  - All of the above information for each storage provider in use  These reports should be available for download and should be stored within DuraCloud so that they can be referenced periodically. At some point we may want to provide a way to schedule the running of such reports (monthly).  This would seem to be a good fit for a service which gathers the needed information, formats it, and stores it in an output space.  A REST-api should be exposed for client access to the reports.  This feature was suggested by Markus Wust (NCSU) during a pilot partner meeting on Dec 13, 2010. He was also interested in seeing how the information included in these reports relates to storage costs."""
"DURACLOUD-318","Bug","Services",1,"Bit Integrity Service: Incorrect report when item on list does not exist","""From David Arjanik (Columbia) on 12/15 Was unable to successfully complete Use Case 4: Preservation Monitoring Test. Here's an excerpt from my notes regarding 2.c of the use case test plan:   c. Service Test 1 i. Using the initial listing from Test0 above, create a new listing file with   some MD5s altered   some entire line items removed   some new line items  Arjanik: Done. Altered checksums of first three lines, deleted the next three lines, and added two lines at the end for files not in the DuraCloud instance. Uploaded to """"admin"""" as usecase4-service-test-1.md5  ii. Run fixity service with this altered listing as input as in the previous test  Arjanik: Reconfigured service to run against this new md5 file. Report ran successfully, generating files fingerprints-service-test-1.csv and integrity-report-service-test-1.csv (names I specified in the reconfiguration).  iii. Verify that erroneous entries were identified in the generated report  Arjanik: Downloaded fingerprints-service-test-1.csv and integrity-report-service-test-1.csv. Arjanik: Checked integrity-report-service-test-1.csv. This file is attached. Only one line of report data: | space-id | content-id | 0:admin/usecase4-service-test-1.md5 | 1:admin/fingerprints-service-test-1.csv | status | | Invalid manifest file: newspace | README.txt | Error: metadata is null | for: newspace/README.txt |  Arjanik:    Deleted the new md5 file and the generated report files for this service test from the """"admin"""" space to try again.   Reconfigured and re-deployed the service. Downloaded the results. Same results.   Edited the md5 file and replaced fictitious space """"newspace"""" with """"usecase3"""".   Deleted the old report files and re-deployed the service.   Downloaded the reports. Renamed the integrity report to integrity-report-service-test-1-2nd-try.csv and attached. Results are basically the same as before.   Opened the fingerprints file. The new lines were correctly identified as referring to files that didn't exist in DuraCloud.  The six files that I've attached:  PERFECT MATCH TEST usecase4.md5 - this is the input file listing correct space contents and correct md5 checksums fingerprints.csv - this is the md5 checksum file generated by the Bit Integrity Checker integrity-report.csv - this is the diff report generated by Bit Integrity Checker This test was successful.  ERRORS TEST: - The checksums of the first three files in the list were changed - The next three files were removed from the list. - The last two lines refer to files that are not in our DuraCloud instance. fingerprints-12-15-2010.csv - this file appears to use incorrect formatting in the last two lines, the lines with files that don't exist in the instance. integrity-report-12-15-2010.csv - this is the malformed integrity report.   Service Configuration:  Service Mode: Verify the integrity of a list of items Get integrity information from...: The storage provider Salt: empty Store: AMAZON_S3 (0) Space with input listing: admin Input listing name: usecase4-service-test-1.md5 Output space: admin Output listing name: fingerprints-12-15-2010.csv Output report name: integrity-report-12-15-2010.csv     -------------------  """
"DURACLOUD-320","Bug","UI",1,"Duradmin upload failures for multiple large files","""When uploading multiple files through duradmin, failures frequently occur causing the content to not land in durastore. scenario:  1. select a ~100-MB file 2. upload it five times in a row through duradmin using different content-ids, and not waiting for one to complete before uploading them all 3. verify all five files successfully upload  The scenario above consistently fails."""
"DURACLOUD-319","Bug","Services",2,"Duplicate on Demand: Service failing","""Duplicate on Demand service failed on 12/7  Service Configuration:   Source Space - synctest4   Copy to this store - RACKSPACE (1)   Copy to this space - replicants   Store results file in this space - replicate-out   Working Space - tmp2   Number of Server Instances - 1   Type of Server Instance - Large Instance  Service Final Status:   Job Ended - 2010-12-07 at 04:13:29 PM UTC   Service Status - Job Complete   serviceId - replication-on-demand-service-0.7.1   serviceStatus - STARTED   Job State - FAILED   Job Started - 2010-12-07 at 03:14:37 PM UTC   Job ID - j-9PDVC8SADTPQ  Additional Statistics:   - Run at icpsr.duracloud.org   - synctest4 (source) space has: 74993 items (it is a closed space)   - tmp2 (work) space has: 84 log files (all generated by one run of the service)   - job id j-9PDVC8SADTPQ ran for: 57 minutes before failing   - MapReduce job failed after 57 minutes   - 2 files were successfully duplicated   - In logs: /steps/1/stderr shows 10 task attempts which were all killed after not responding in 10 minutes"""
"DURACLOUD-324","Story","UI",1,"reverse upload history order in the upload window","""It would be nice to reverse the order of the upload history in the upload window, so that more recent and/or in-progress uploads appear at the top instead of the bottom of the popup window. Sort of what the Firefox download window does. Putting the recent ones at the bottom requires the user to scroll down to see the progress bars of the recent uploads."""
"DURACLOUD-326","Bug","UI",1,"DurAdmin incorrectly displaying 0 for space size","""When using DurAdmin to display spaces which are larger than 1000 items, the space size is often mis-reported as being 0, even though there is a listing of items in the space. Also, clicking on the space no longer refreshes the item listing or metadata of a space (this is also true for content items.)"""
"DURACLOUD-325","Bug","UI",1,"Image Viewer Flyout no longer works","""In the past, a content item that had an 'image/*' mimetype would present a link on the image thumbnail (if djatoka service was running) or on the canned picture icon. This link would display a """"flyout"""" image viewer.  Now, clicking on the thumbnail or picture icon has no effect."""
"DURACLOUD-329","Bug","UI",1,"Video streaming in duradmin:spaces","""This item is to address the issue of duradmin not showing the streaming video when clicking on a content item in a space on which the MediaStreamer has been enabled. Scenario: # create two spaces: 'video' & 'tmp' # add the mp4 file attached to this jira item to the space 'video' # deploy the MediaStreamer server using 'video' as source and 'tmp' as destination # wait until service deployment is complete # click on the mp4 item in the 'video' space # ! the video should be shown in the right-hand column at this point !  Note: If you go directly to  https://<host>/durastore/tmp/singleplayer.html the streaming video will be available."""
"DURACLOUD-327","Bug","UI",1,"DurAdmin: Delete button mis-aligned","""Hovering over a multi-line content item displays a delete button which is half-way between the current item and the next item in the list. The delete button should be displayed completely within the boundary of the content item which it will delete."""
"DURACLOUD-333","Bug","Storage",1,"Changing space access removes the space metadata","""When changing the access level of a space the space metadata is removed.  Create a space Add space metadata Change the space access Refresh the space Notice the space metadata is gone"""
"DURACLOUD-332","Bug","Services",1,"Duplicate on Change: space access is not propagated","""This item is to address the issue of the Duplicate-on-demand service not updating access state on the secondary provider when a space at the primary provider is changed from open to closed, or vice versa. Scenario: # deploy the duplicate-on-demand service # create a space in the primary store # verify that the space was also created in the secondary store # verify that both spaces have the same access state # toggle the access state of the primary space # boom!, notice the access state of the secondary space did not change"""
"DURACLOUD-331","Bug","Services",3,"NullPointerException with Duplicate-on-change service on 'delete content'","""This item is to address the issue of a NPE being thrown when the Duplicate-On-Change service is running and an item is deleted. Monitoring the duracloud-servicesadmin.log will show that upon the above action, an NPE is thrown in: org.duracloud.services.replication.Replicator.replicateContent(Replicator.java:127)  The service does successfully remove the item from the secondary store, and remains alive in the OSGi container; however, this case should probably be guarded against."""
"DURACLOUD-335","Bug","Services",1,"Media streamer: files not getting set with proper permissions","""On occasion, when starting the media streamer service, one or several of the files to be streamed is not set to have the proper permissions for streaming. Thus far, this issue has always been resolved by restarting the media streamer. It seems likely that the missing permission is due to a failed call to S3, so a retry would likely fix the problem."""
"DURACLOUD-339","Bug","UI",1,"DurAdmin: Errors on space filter","""When attempting to filter by name in a space (used the x-service-work dir as an example, need this features to get logs for a specific bulk run), I tend to get """"next page failed: error"""" and """"Get Space failed: error"""" pop-ups. The filter works and loads the list of filtered content items correctly, so the errors seem unnecessary.  It appears that a new attempts is made to get the content listing on every change to the filter box, so each letter I type creates a new call.  My guess is that just adding a """"Filter"""" button beside the text box, and only making the call when the button is pressed would fix the issue."""
"DURACLOUD-342","Story","Services",2,"Bulk Image Transformer output to be standard CSV format","""Currently the output for the Bulk Image Transformer is in a modified CSV format, similar to: name1=value1, name2=value2, name3=value3, ...  This task is to update the output to be in standard CSV format: value1, value2, value3  The first line in the file should a header which indicates the names of the values to follow: name1, name2, name3  The Bulk Bit Integrity service produces this format by allowing the hadoop reducer to produce all of the value lines, then using a post processor to insert the name line at the top."""
"DURACLOUD-341","Story","UI",1,"Duplication on Demand destination space","""When configuring the Duplication on Demand service, if you leave the destination space name blank, the service should automatically create the destination space with the source space's name.  Carissa ran the service leaving the destination space blank (assuming this would occur) and the service ran to completion... service status read: """"complete"""" but no duplicated content was to be found."""
"DURACLOUD-348","Story","Dashboard|Service Infrastructure",2,"Bulk service status message","""This improvement is to more accurately display the service status state of bulk services. Currently, bulk image conversion and bulk bit integrity checking are processed in two steps: 1. hadoop processing 2. post processing on duracloud instance  The service status shows conflicting messages. The """"Job State"""" is """"COMPLETE"""" when the hadoop step is done, but the """"service status"""" shows """"Post Job Processing"""" for bit integrity, and nothing for image conversion.  More accurate and consistent status messages need to be put in place across the services."""
"DURACLOUD-351","Story","Service Infrastructure",1,"Allow build-time specification of dependency osgi bundle version","""This improvement is to allow services built within a particular version of the baseline (say 1.4.0) to specify compatibility with dependency DuraCloud-osgi bundles from another version (say 1.3.0)."""
"DURACLOUD-352","Story","Services",2,"Bit Integrity Service: Support comparison for space manifests of up to 1 million items","""This improvement is to ensure that spaces that contain up to 1 million items can successfully perform a bit-integrity manifest verification."""
"DURACLOUD-353","Bug","Services",2,"Bulk Bit Integrity Service: shutdown of post-processor","""This item is to address the issue of shutting down not only the Bulk Bit Integrity Service on """"undeploy"""", but also shutting down the post-processor.  To reproduce this error, start the BBIS over a space containing more than 1000 items. Once the """"Job State"""" indicates """"COMPLETE"""", but while the """"Service Status"""" still indicates """"Post Job Processing..."""", undeploy the service. Undeploy fails due to the inability to remove the fixityservice OSGi bundle from the services container, as it is still processing. At this point, the BBIS remains in duraservice, but is no longer available via servicesadmin."""
"DURACLOUD-354","Bug","Services",1,"Bulk Image Conversion: failure due to Hadoop AMI upgrade","""This item is to address the breakage caused by amazon elasticmapreduce changing their default AMI for hadoop jobs. This effects the bulk image conversion service which is faulting in the bootstrap script due to a missing dependency in the apt-get initialization. """
"DURACLOUD-363","Story","Dashboard|Report|Utility",0,"API support for dashboard reports","""This new feature is to provide an extension to the REST APIs to support retrieval of usage report information. The report data would be the same that is exposed on the dashboard."""
"DURACLOUD-355","Story","Services",2,"Media Streamer: Allow streaming of multiple spaces","""This task is to allow the user to select multiple spaces for the media streaming service to stream."""
"DURACLOUD-369","Story","Services",3,"Bulk Bit Integrity Service: post-processing in hadoop","""This improvement is to change the bulk bit integrity service to run its MD5 metadata collection post-processor in hadoop instead of with a single process on the main duracloud instance. This enables the service to run within hours instead of days for spaces exceeding 50,000 items."""
"DURACLOUD-370","Story","Utility",2,"Notification/Email utility","""This feature is to expose a utility for sending emails. It should consist of both a general interface project and a corresponding implementation project."""
"DURACLOUD-371","Story","Services",3,"Remove interim bulk-bit-integrity manifests","""This improvement is to remove from the service output space the interim manifests that the bulk-bit-integrity service creates once the final report has been created. These manifests are: bit-integrity-metadata-results.csv bit-integrity-results.csv"""
"DURACLOUD-377","Story","UI",1,"Remove user management from Duradmin","""This task is to remove the user-management capabilities (""""Adminstration"""" tab) from Duradmin, since this functionality is being moved up the the account-management-app."""
"DURACLOUD-376","Bug","Services",2,"Limit time that can be spent spinning on a mapper task within hadoop","""Currently, the service code which runs in hadoop kicks off a thread to ensure that the mapper has enough time to complete. These threads are not time limited, so if the mapper process hangs, the hadoop job could potentially live forever. This task is to revisit these threads for each of the bulk jobs to set a limit for the amount of time the threads give to a mapper activity."""
"DURACLOUD-375","Story","Dashboard|Report|Services",5,"Storage Report Dashboard","""This task is to create a UI dashboard for displaying and downloading reports on storage.  REST API calls should be available from which the storage report information can be gathered. A UI will need to be created to be able to display the information in the reports.  The reports will likely be in XML, so XSLT is an option for display."""
"DURACLOUD-374","Story","Dashboard|Report|Service Infrastructure",5,"Service Report: backend utility for currently running services","""Provide a way to generate a report containing: - details from running services  The details should include at least the following information:  - tbd  The reports should also be available for retrieval through a REST-api"""
"DURACLOUD-379","Task","Services",1,"Run-away service monitor","""This task is to create a script/application that monitors DuraCloud accounts for long-running bulk services and sends an email alert upon detection."""
"DURACLOUD-380","Bug","Storage",1,"Azure Storage Provider - adding content and specifying a checksum","""When a checksum is provided upon adding content to Azure, ChecksumInputStream was incorrectly trying to calculate the checksum from the provided stream.  The provided checksum should be used instead of calculating it from the stream."""
"DURACLOUD-382","Task","Services",1,"Create Example ServiceClient","""This task is to create a sample ServiceClient analogous to the Sample StoreClient."""
"DURACLOUD-384","Bug","Services",1,"Bit Integrity Service: Pass into comparison phase content-id of csv input","""The comparison phase of an 'all-in-one-for-space' run of the bit-integrity-service tries to guess the content-id of the input csv files. With date/timestamps appended to the content-ids, this becomes difficult. Therefore, the input content-ids should be passed into the comparison phase."""
"DURACLOUD-383","Bug","Services",1,"Bit Integrity Service: support retries of interrupted content downloads","""This task is to add retries to the bit-integrity-service when a content item that is downloaded to calculate its MD5 does not match the expected MD5 from metadata."""
"DURACLOUD-385","Task","Services",2,"Image Viewing URL Stability","""This task is to investigate the stability of image viewing URLs across upgrades of DuraCloud instances. As each DuraCloud instance has an allocated static I.P. address, the behavior is unexpected. If there are specific uses cases for demonstrating this issue, please add them as comments below."""
"DURACLOUD-389","Story","Service Infrastructure",1,"Service Registry Naming","""This update is needed to support creating a service-config.xml document that is named the same as the allowable service registry name. The old convention was: duracloud-0.9.0-service-repo The new convention is: duracloud-0-9-0-service-repo """
