"issuekey","type","components","storypoint","title","description_text"
"FAB-925","Sub-task","fabric-sdk-node",1,"Improve coding styles in headless-tests.js for chaining Promise-based APIs","""the current headless-tests.js have a lot of embedded promise-based calls, like below:    functionA()  .then(     function(result) {        // do stuff        functionB()        .then(           function(result) {...});     });    this is defeating the purpose of the design of Promise-based APIs, it should have been chained like below (note the """"return"""" statement on the call to functionB()):    functionA()  .then(     function(result) {        // do stuff        return functionB();     })  .then(     function(result) {...});  );  """
"FAB-950","Sub-task","fabric-sdk-node",1,"Have self-contained chaincode deployment setup so no manual prep is needed","""Tests that need to deploy chaincode need the following setup:  - GOPATH environment variable  - chaincode available at the folder corresponding to $GOPATH/src/<the GO package>    have this be part of the test fixture so contributors don't have to manually set it up locally. set process.env.GOPATH in the code to the test fixture folder just for the test execution."""
"FAB-998","Task","fabric-orderer",1,"Write test client that sends configuration envelope for new chain creation","""This is part of the FAB-819 story. The goal is to use the """"broadcast_configuration"""" client to send out a transaction that calls for the creation of a new channel. Then we will use the """"bd_counter"""" client to make sure messages show up on the new channel."""
"FAB-996","Task","fabric-orderer",1,"Add a commons/util package","""The point is to not have to rewrite the same common utility functions again and again.    This is what I have so far:    # Marshal(pb proto.Message) []byte  # Hash(data []byte) []byte  # ExtractEnvelope(block *ab.Block, index int) (envelope *ab.Envelope, err error)  # ExtractPayload(envelope *ab.Envelope) *ab.Payload    The Hash function exists in the core util package as ComputeCryptoHash, so I may have to remove that in the end. I'm doing it now cause I want to switch to SHA-2 (FAB-887)."""
"FAB-995","Task","fabric-orderer",2,"Rewrite Broadcaster so as to support ChainPartitions and DataHolders","""The Broadcaster creates a DataHolder reference and spawns a cutBlock goroutine for every chain that is created. It keeps track of which goroutines are running, and can terminate them if need be."""
"FAB-994","Task","fabric-orderer",1,"Create DataHolder type","""Holds all the data that the Broadcaster needs to keep track of, in order to eventually send a new block on the chain. There is a 1-to-1 mapping between chains and DataHolders."""
"FAB-993","Task","fabric-orderer",1,"Create ChainPartition type","""This maps to a Kafka partition, and is related to the two partitions per chain idea we're exploring for FAB-621. """
"FAB-1019","Story","fabric-quality",2,"Add unit tests for ledger applications on Fabric 1.0","""Add unit tests to example.go application in ledger examples."""
"FAB-1013","Task","fabric-orderer",0,"Turn validated new-chain configuration envelope into proper genesis block","""The ordering node should be able to turn a validated new-chain configuration envelope into a proper genesis block. The ordering logic will then be able to get that block directly and push it to the new chain, and also set-up all the related logic (cutBlock goroutine, etc.) based on the parameters extracted from that genesis block (batchTimeout, batchSize), etc."""
"FAB-1094","Sub-task","fabric-orderer",1,"Need utilities to break out a Block and get the ConfigurationEnvelope","""We have multiple places in the code where we need to unmarshall multiple things to get from Block to ConfigurationEnvelope.    Create a set of utility functions that can be called from anywhere"""
"FAB-1141","Epic","fabric-peer",3,"Bootstrap BDD","""Implement bootstrap BDD feature.  This feature will for the basis from which all future features will be based wrt to system composition."""
"FAB-1151","Epic","fabric-ledger",40,"Side DB - Channel Private Data - experimental feature","""* As a Fabric deployer, I would like to maintain data such that only its evidence is exposed to the chain, ordering service, and channel peers while the data itself is disseminated to peers based on policy, so that we can achieve finer-grained data confidentiality for transactions while still maintaining ledger consistency and still being able to leverage Fabric for both data evidence and dissemination of the data (but in a more private fashion).    *Design*     Slides attached."""
"FAB-1174","Task","fabric-orderer",1,"Specify path to orderer.yaml via an environment variable","""Allow an user to specify where on the file system the orderer configuration yaml file is located.    This makes orderer consistent with peer ( and its PEER_CONFIG_PATH ) and allows for easier creation of the docker image."""
"FAB-1257","Story","fabric-ledger",8,"As a chaincode developer, I want to use JSON-based data structures instead of table-based data structures, so that I have more control over queries","""Remove Table API from Hyperleger Fabric in v1.  * The v0.5/v0.6 Pseedo-table API does not map well to current or next generation Fabric capabilities   * Project teams have been confused and frustrated with table API limitations    Encourage all new chaincode to use JSON-based data structures  * Additional query benefits when using CouchDB state database  * Provide JSON-based samples to help community update table-based chaincode  * Initial sample: https://github.com/denyeart/table_to_json/blob/master/chaincode/table_to_json_chaincode.go    In the future Fabric may add support for relational state databases  * At that time it will make sense to introduce a ‘real’ table API without the limitations of the current pseudo-table API  """
"FAB-1280","Story","fabric-orderer",1,"Create fabric common components directory and move orderer shared components there","""The orderer has some common code which is of broader use to the fabric at large, not just the orderer.    In particularly, the configuration block parsing, and the policy parsing and evaluation are prime candidates for being shared in a modular way between the orderer and peer (and possibly other components).    This is being created in part by the request of [~muralisr] to faciliate some VSCC ESCC work."""
"FAB-1278","Story","fabric-orderer",3,"Introduce generic notion of execution in the orderer","""For the impending chain creation work, a second type of transaction will need to be 'executed' beyond a configuration transaction. This store is to generalizes the old configuration specific code paths into a re-usable path.    In particular, the broadcast filters must be generalized to be a more generic filtering mechanism.  Instead of replying with the matched rule type, and then having the invoker make decisions based on the match, the filters should return a Committer which can perform those actions with no specific knowledge from the caller."""
"FAB-1304","Story","fabric-orderer",13,"Hook into fabric ledger for rawledger implementation","""The orderer currently relies on its own rawledger implementations, a simple ram based ledger (which does not persist anything to disk) and a simple file based ledger which uses a very naive JSON encoding with 1 block per file.    Neither of these are likely to scale well for real systems and have always been intended to be testing tools while the real ledger is developed.    A shim needs to be written between the orderer rawledger API and the fabric ledger api to support deploying with the fabric backing ledger for production deployments."""
"FAB-1302","Story","fabric-orderer",3,"Add config inspection validation on chain creation transaction","""Today, chain creation requests are only validated based on the fact that they are well formed, and signed according to the policy for chain creation.    There is no checking to make sure that the orderers are specified correctly, that the orderer MSPs are included, etc.    What these checks are need to be determined as part of this story, as well as their implementation.  There is a plug point in the multichain systemChain.go code which is meant to handle this, but it currently is mostly a no-op."""
"FAB-1300","Story","fabric-orderer",5,"Provide metrics for the common orderer service endpoints","""In order to assess the health of the ordering service, we should expose basic metrics about the state of the ordering network like number of clients connected, transaction rates, chains and chain heights, etc."""
"FAB-1298","Story","fabric-orderer",2,"Remove queueing concept from Broadcast","""The broadcast API suffers from a deficiency today, that it immediately returns success/failure before the request has actually entered consensus.    The desired behavior would be to return success only after the request has entered consensus, but, this poses a problem when the broadcast queue overflows.  In the event that the broadcast queue overflows, incoming requests should be rejected to alert the client to slow down.    This results in the situation of:  1. Wait until after the queue drains to return the failure (which will not throttle the client and not provide immediate feedback, this is bad)  2. Return the success before the queue drains (which will not inform the client if for whatever reason the consensus system never actually accepts the request)    Since these options both have drawbacks and are mutually exclusive, a different solution is required.    This story is to add windowing to the broadcast API to mirror the deliver API.  If the client knows how big the buffer is at the server, then the client can delay sending new messages until it receives the success/failure after processing the queue.  If the client violates the protocol and overflows the queue, the client can be dismissed as malicious and hung-up on."""
"FAB-1308","Story","fabric-ledger",8,"I want to be able to read from CouchDB state database as an 'external' user (not using the peer's admin user)","""Currently only two modes are available when using CouchDB - completely open (no user security) and completely locked down (user security enabled).  Production environments utilize the locked down configuration, while development environments may decide to skip user security in order to allow direct access.    If user security is enabled, only the peer's admin user can read/write to CouchDB.  No other 'external' users can access CouchDB - access is locked down and all requests must go through the peer's CouchDB user.    If it is desired to have 'external' users be able to read (only) CouchDB directly, two changes would be required:    1) Add the 'external' users to the CouchDB database security object as members.  See http://docs.couchdb.org/en/2.2.0/api/database/security.html .  Currently peer writes the database security object with just the peer's admin user upon each startup (allowing for the ability to change the username).  Note - it may be possible to use a server admin instead of setting the admins role on each database, and only populate the members role.     2) Any database 'member' would have both read and write access.  To lock it down for read access only, a CouchDB 'validation function' (deployed as a design document to CouchDB) would be required, it could enforce that only the peer's admin user could perform writes."""
"FAB-1335","Sub-task","fabric-orderer|fabric-quality",3,"BDD tests: Kafka orderer should be resilient to faults","""     The following are the details for these tests.   * +Component+:  orderer   * +Description+:  Test scenarios with faults in the Kafka brokers, and the orderer shims.   * +Artifact Locations+:  test/feature/orderer.feature   * +Network Topology+:  3 orderers, 3 zookeepers, 4 kafka brokers, 4 peers   * +Client Driver+: behave    This test should show that as the partition leader changes, the network still functions as expected."""
"FAB-1334","Story","fabric-orderer",3,"Decide on block hashing specifics","""Today, the orderer is using the functions defined in `fabric/protos/common/block.go` for hashing the block header and data.    These functions are _definitely_ wrong, and were never intended to be long term solutions.  These functions need to be fixed to use a hashing algorithm and marshalling scheme (and possibly using a wide Merkle Tree for the BlockData).    This was discussed somewhat extensively in https://gerrit.hyperledger.org/r/#/c/1361/ but no conclusion was reached."""
"FAB-1333","Story","fabric-orderer",3,"Make orderer logging configurable (in a centralized way)","""Today, the orderer initializes loggers in almost every package, and statically sets their logging levels.  This was easy to speed development along, but this really needs to be configurable for the whole ordering process in a sane way, ideally lifted from the peer flogging stuff."""
"FAB-1349","Story","fabric-orderer",1,"Enforce restrictions on acceptable chain IDs","""This is motivated by the fact that Kafka imposes restrictions on the allowed topic names:  https://github.com/apache/kafka/blob/trunk/core/src/main/scala/kafka/common/Topic.scala#L29    Regardless of that, we should adopt similar restrictions.    Ideally, these will be a superset of the Kafka restriction set so that we don't have to add any extra code for the Kafka consenter case."""
"FAB-1352","Story","fabric-orderer",3,"Add time-based block cutting to Kafka consenter","""In the version that was rebased on top of the common components, this option was kept out in order to minimize the complexity of the changeset. The deliverable of this story is a Kafka consenter that respects the BatchTimeout config option.    """
"FAB-1351","Story","fabric-orderer",1,"Update broadcast_config sample client so that it posts appropriate config for Kafka consenter","""As things stand right now, the config it posts only works for solo. The client should have an extra flag that allows us to specify the consenter type, and then, by using the provisional bootstrapper, it should create the appropriate config."""
"FAB-1374","Task","fabric-orderer",1,"Remove bd_counter sample client","""I wrote this while developing the Kafka orderer for testing. The existing sample clients (broadcast_timestamp and deliver_stdout) provide the same functionality and in a more modular, Unix-like way. Keeping the bd_counter around just increases maintenance burden."""
"FAB-1366","Task","fabric-orderer",1,"Update Docker Compose files for Kafka consenter","""We should either list only those ENV vars where we need to modify the default values, or list all possible ENV vars to allow for easy editing later on. The Docker Compose files in their present form adopt a middle-ground solution: list only some ENV vars, and have several of them set to the default values."""
"FAB-1365","Task","fabric-orderer",1,"Introduce Kafka-specific container message types","""The revised Kafka consenter needs two special messages:    # A time-to-cut message that is used to mark the end of a block, and  # A no-op message that each shim posts when bootstrapped by the multichain manager to prevent the possibility of """"listening in"""" (seeking and consuming) on a topic/partition that nobody has posted to yet [1]. This is an operation that panics in Kafka: """"[ERROR] Cannot retrieve required offset from Kafka cluster: kafka server: The request attempted to perform an operation on an invalid topic.""""    These messages are special because they don't carry transactions, and because the Kafka consenter will treat them in a special way: it will ignore every time-to-cut message (for a specific block number) besides the first one, and it will ignore all """"no-op"""" messages when processing incoming messages from the chain partition.    A preview of these in action can be found here:  https://github.com/kchristidis/fabric/blob/47752ed61fcab1b26207a9e9075c1c793d723912/orderer/kafka/main.go#L142  https://github.com/kchristidis/fabric/blob/47752ed61fcab1b26207a9e9075c1c793d723912/orderer/kafka/main.go#L164  https://github.com/kchristidis/fabric/blob/47752ed61fcab1b26207a9e9075c1c793d723912/orderer/kafka/main.go#L204"""
"FAB-1364","Task","fabric-orderer",2,"Replace static bootstrapper with provisional one","""All consenters read several of their config settings (think sharedconfig) from the genesis block that is generated by a bootstrapper. The only bootstrapper available so far is the static one. However, when testing we need to be able to modify several of these config values on the fly.    Therefore the bootstrapper should be able to read a config object (which is itself created by reading the orderer.yaml file and -if set- its associated ENV vars).    An example of that would be the KafkaBrokers value. For unit tests the """"right"""" value is """"127.0.0.1:9092"""", whereas for the current Docker Compose-based BDD tests the right value is """"kafka0:9092"""".    Since this bootstrapper is no longer static, renaming the package seems appropriate.    For production we will need to introduce file-based bootstrapper that reads the genesis block created by the genesis block tool."""
"FAB-1363","Task","fabric-orderer",1,"Move ChainID method to ConsenterSupport","""What necessitates this move is that the Kafka multichain.Chain object returned/expected by HandleChain(), needs to be able to allocate the resources necessary to keep up with its respective chain when the Start() method is invoked by the multichain manager, as the contract of the Chain interface (defined in chainsupport.go) dictates.    Keeping up with the respective chain means that the Kafka multichain.Chain object needs to bring up a producer/consumer that connects to the corresponding chain partition, so it needs to know the chain ID. The only object passed to us during the HandleChain call is an object of type multichain.ConsenterSupport. Therefore, this interface needs to be extended with the ChainID() method.    I've noted the need for this during my review of this changeset:  https://gerrit.hyperledger.org/r/#/c/2763/ (skip to the comment timestamped 11-27 18:52, and its follow-up comment)    If you want to see how this will look in action for the Kafka consenter (coming in a follow-up changeset), please see:  https://github.com/kchristidis/fabric/blob/47752ed61fcab1b26207a9e9075c1c793d723912/orderer/kafka/main.go#L128  https://github.com/kchristidis/fabric/blob/47752ed61fcab1b26207a9e9075c1c793d723912/orderer/kafka/main.go#L143"""
"FAB-1362","Task","fabric-orderer",1,"Add KafkaBrokers to shared config","""The list of Kafka brokers used for ordering needs to be shared across the shims (ordering service nodes)."""
"FAB-1360","Task","fabric-orderer",1,"Introduce ChainPartition construct for Kafka","""The ChainPartition construct will be used to identify the Kafka topic/partition that the ordering shims should interact with when dealing with a particular chain."""
"FAB-1359","Task","fabric-orderer",1,"Drop custom flag support for Kafka orderer","""As we are slowly moving to a setup where the behavior of the orderer is controlled by the config options captured in the genesis block and the orderer YAML file (and their overrides via ENV vars), it's time to drop the flag support that the Kafka orderer provided.    * Remove all flags from the Kafka orderer.  * Add a """"verbose"""" option to the YAML file to control logging for the package that we use to interact with the Kafka cluster (sarama)."""
"FAB-1358","Task","fabric-orderer",1,"Convert all batchSize refs to the uint32 type","""Address the mismatch between the batchSize type as expressed in the localconfig package versus the sharedconfig package and the orderer configuration proto."""
"FAB-1382","Story","fabric-orderer",3,"Remove windowing concept from the Deliver API","""Per some performance testing feedback from [~bcbrock] it's much more efficient if we allow HTTP2/gRPC to handle the connection data windowing rather than attempting to implement it ourselves at a higher layer.    In order to remove windowing from deliver, there must be some other mechanism supplied to allow a client to retrieve a specific number of blocks.  This means that the Deliver API must also be enhanced to allow range specification."""
"FAB-1422","Story","fabric-ledger",2,"Ledger setInfo(): As a chaincode author, I want to pass information to VSCC for transaction validation context","""Proposal is to add a setInfo() on the simulator, for the chaincode to pass some transaction context that is to be used later for validation in VSCC, without anything getting written to permanent state (therefore don't want to use WriteSet).  This information would get included in the simulation results in the transaction, and VSCC would be able to reference it when performing custom validation logic.    (Murali, please fill in your immediate use case for it)."""
"FAB-1418","Sub-task","fabric-orderer",1,"Convert Policy from oneof to enum","""The Policy type for configuration is currently oneof{ SignaturePolicyEnvelope }.    This is somewhat convenient but is not extensible without modification of the common protos.    Instead, this should be switched to be the standard enumerated type, bytes model."""
"FAB-1416","Story","fabric-orderer",3,"Make policy manager pluggable with different policy providers","""Per discussion with [~ellaki] [~adecaro] and [~ales] the MSP managers would like to provide their own policy evaluation options.  This would be in addition to the NOutOf policies, but would exist within the current framework.    This story is to make the existing policy manager pluggable with different policy providers, so that the MSP manager may provide a policy provider for MSP type policies."""
"FAB-1441","Story","fabric-quality",5,"Behave backend utilities","""A test writer should be able to write feature tests using backend utilities to drive the tests such that any new test scenario can utilize the APIs while keeping the modification of the backend to a minimum.    *Output:* back-end utility functionality that drives the feature files. These utilities will include (but not limited to):    * docker_util    * remote_util   * grpc_util   * shell_util  """
"FAB-1430","Story","fabric-orderer",5,"Implement epoch and timestamp message replay protection","""The envelope header contains a timestamp and epoch both of which are ignored by the ordering service today. But, these should be leveraged for message replay prevention.    This will require synchronizing with the SDK/peer team to make sure these parameters are correctly set."""
"FAB-1446","Task","fabric-quality",2,"Add safesql to CI for go-based components","""Add https://github.com/stripe/safesql to our CI pipelines for all golang components that utilize a database. This will enhance our security by finding any potential SQL injection vulnerabilities before they are merged."""
"FAB-1503","Story","fabric-ledger",8,"Ledger history: When looking at the ledger history for a key, I want to see history with full transactional context ","""In addition to seeing the history of key values, we should be able to see the full transaction details for every update to the key.  This will require defining a new transaction structure to be returned."""
"FAB-1524","Sub-task","fabric-orderer",1,"Appropriately get configuration from block metadata on orderer restart","""The orderer needs to initialize the configuration for every chain, identify the ordering system chain specially, and initialize the other chains."""
"FAB-1523","Sub-task","fabric-orderer",1,"Populate metadata last configuration field","""Each block is supposed to contain a reference to the last configuration block, the configuration of which that block was generated under.    Although this is a separate requirement needed for instance for gossip, this is also useful for supporting restart of the ordering service so is being classified as a sub-task of FAB-1299."""
"FAB-1521","Sub-task","fabric-orderer",2,"Fix orderer rawledger interface to support restart","""The rawledger interface was originally implemented as a single chain initialized with a genesis block.  This causes problems on restart because a newer genesis block may already exist and passing the genesis block becomes nonsensical."""
"FAB-1574","Story","fabric-orderer",1,"Deliver API needs to check signatures against egress policy","""The deliver API will support signatures after FAB-1573, so it then needs to actually respect these signatures and only allow readers which are authorized by policy for a given chain."""
"FAB-1573","Story","fabric-orderer",2,"Deliver messages need to be signable","""The deliver message currently has no authentication associated with it.  Rather than invent yet another signing scheme, we should adapt the Envelope message to be used to send SeekInfo requests."""
"FAB-1563","Story","fabric-orderer",2,"Orderers need to filter incoming Broadcast messages by signature","""The framework to filter incoming transactions exist, as does the framework to manage policies, but currently the filtering framework does no policy enforcement on incoming broadcast messages, this needs to be fixed."""
"FAB-1611","Story","fabric-orderer",3,"Create configuration template for orderer user to consume","""The orderer is currently hackily copying code from the orderer bootstrapper to generate the new chain request.  This is not a real path, as this needs to be supplied by the orderer, this story should address that."""
"FAB-1603","Sub-task","fabric-peer",1,"Incorrect marshalling of transaction into block during block event generation","""Block delivered by events is not in the correct format."""
