"issuekey","type","components","storypoint","title","description_text"
"FAB-30","Story","fabric-ledger",2,"Endorser simulation of transactions.","""Story: Developer needs the ability to gain signatures from endorsers as defined by a policy by simulating a transaction without writing to the ledger create, so that they can submit a transaction.    Endorsers simulate tx with state and reply with rw set of all keys that were modified.    A submitter composes a transaction consisting of [header, payload, rw-set] where rw-set is the set containing the state variables that the transaction reads from (read-set) and the state variables that the transaction writes to (write-set). The rw-set is created via transaction execution simulation (not writing to database). This simulation is also done by the endorsers of the transaction to fulfill the endorsement policy of the transaction."""
"FAB-149","Story","fabric-orderer",2,"BFT Orderers need to sign batches","""BFT orderers have to provide signatures so that validator peers can use the set of signatures to accept validity of a batch without having to connect to f+1 orderers.    All orderers already sign with their own key."""
"FAB-200","Story","fabric-ledger",8,"Ledger simple provenance: I want to see the full history of key values across time","""Querying for full history of keys will require a new history database. See attached slides for details."""
"FAB-196","Story","fabric-ledger",8,"Ledger APIs to query Blocks/Transactions, including rich query and history of key values","""- Ledger APIs have been implemented and need to be exposed to SDK:    -- GetBlockchainInfo    -- GetBlocksByNumber    -- GetBlockByNumber    -- GetBlockByHash    -- GetTransactionById    -- ExecuteQuery    """
"FAB-192","Story","fabric-ledger",2,"Ledger advanced simulation: As a consumer of the ledger APIs (Endorser peer chaincode), I need the ability to manipulate keys in various ways, so that I have flexibility in chaincode to get and set the state I need","""- Implement QueryExecutor.GetStateRangeScanIterator()    - Implement QueryExecutor.GetStateMultipleKeys()    - Implement TxSimulator.DeleteState()    - Implement TxSimulator.SetStateMultipleKeys()"""
"FAB-254","Sub-task","fabric-sdk-node",8,"node.js SDK - add API to send endorsed deployment transaction to orderer","""This initial phase is to send to an orderer based on SOLO. The API should take a proper parameter assembled from the returned data of the sendDeploymentProposal() call, and send to the orderer for consensus, which will then deliver to committers for validating and committing to ledger.    Note that the event notification on transaction """"complete"""", """"error"""" will be tracked separately."""
"FAB-277","Task","fabric-quality",2,"Enable power node in Jenkins CI","""@bsmitha requested us to setup Power node in Jenkins CI."""
"FAB-318","Story","fabric-sdk-node",8,"[node-SDK] Technical debt","""This will help with creating a cleaner workspace for node.js developers working on the node.js SDK, and eliminate sub-optimal parts that are prone to breaks:  - build scripts that does -g installs  - reliance on vagrant  - """"make"""" based build scripts are not best suited for node.js development"""
"FAB-325","Task","fabric-orderer",2,"Create Rawledger API","""Create a Rawledger API which can be used by any orderer.    This should also cover moving the ramledger implementation of Solo out into its own package, and converting solo to depend on the new abstraction."""
"FAB-359","Epic","fabric-peer",8,"Bootstrapping a blockchain network with Orderers and Peers","""Bootstrapping Fabric network including bootstrapping 2 components: Orderers and Peers. Orderers make up a network of nodes with mesh connections. Peers network uses gossip to communicate with one another but direct connection with the Orderer network. All connections are TLS.    Each Orderer is configured by an administrative CLI command, which provides the necessary bootstrapping data, including a list of trusted roots, a list of Orderer certificates and IP addresses, a set of specific consensus algorithm properties, and access control policies. With this information, an Orderer may start up and connect with other Orderers.    Each Peer requires at least the following configurations:  # An enrollment certificate to participate in the network. The certificate may come from any CA as long as the CA is part of the trusted roots on the consensus service that the Peer will connect to  # A list of the Orderer certificates and IP addresses, which the administrative CLI from the consensus service can generate  # A list of trusted root certificates  # An optional list of channels that the Peer should subscribe. Unless explicitly configured, the Peer does not subscribe to any channels upon starting up    """
"FAB-356","Task","fabric-crypto",8,"As an infrastructure developer i want to ensure that all crypto calls within the nodejs client go through the fabric crypto library (BCCSP)","""This requires that this library defined in FAB-354, and whose software provider was implemented in FAB-355/FAB-823, is used throughout the fabric client sdk in Node.  """
"FAB-355","Story","fabric-crypto",8,"As an infrastructure developer and application developer i want to have availale a software based crypto provider implementing the interface of FAB-354 in golang.","""Implement a software provider implementing the interface described in FAB-354 in Golang to be used by the peer core code."""
"FAB-349","Task","fabric-ledger",1,"Control rockdb logging","""Fabric peer uses default configurations for logging RocksDB - which produces massive logs in the LOG files. For better managing RockDB logs, RocksDB allows setting following logs related properties  - 1) max_log_file_size, 2) keep_log_file_num, and 3) info_log_level    Though a newer version (4.3) of RocksDB allows loading properties from an `ini` file (https://github.com/facebook/rocksdb/wiki/RocksDB-Options-File) - gorockdb package is yet to catch up for exposing this option into golang.    Current possibility is to expose these configs into core.yaml and programmatically set these on RocksDB options while opening the DB. """
"FAB-386","Story","fabric-orderer",2,"Add robust configuration mechanism for the orderer package","""The orderer service uses piecemeal configuration using environment variables today.  This should be done using Viper, but using the newer API which allows error on extraneous variables.    In the event that the newer version of Viper is not available, the similar but older version of the call can be used temporarily.    This should be re-usable across Solo, Kafka, and the RawLedger implementations."""
"FAB-383","Task","fabric-orderer",1,"Verify manual state transfer works","""As we discussed over the weekend, following Gari's suggestion. Needed in case things go terribly bad."""
"FAB-418","Story","fabric-orderer",8,"Enhance atomicbroadcast API to support channels","""In order to support delivering batches to only a subset of peers, the atomicbroadcast API must be enhanced to allow channel creation, channel membership polling or notifications, and broadcast or delivery to one or more channels.    This will require modifications to the `atomicbroadcast/ab.proto`.  This will cascade into modification of solo to support the new API."""
"FAB-497","Story","fabric-peer",3,"Create system chaincode at the peer to handle configuration changes","""When the peer receives a configuration transaction, as defined in FAB-496, it needs to call the Configuration System Chaincode (CSCC) which performs the following:  # map the changes into the correct read-write-set for the ledger to store  # process the configuration changes if applicable;  ex, removing a member CA from the chain, calling gossip  # commit the transaction to ledger    CSCC will provide the following functions:  # process """"join channel"""" for the peer to start receiving transactions on the specified channel  # process transaction on commit  # process """"queries"""" to return configuration data on channel (status, members, crypto)    For now, we will not require any endorsement of the transaction though this may be added in the future.  """
"FAB-496","Story","fabric-orderer",5,"Generate initial configuration transaction for orderer genesis block","""The orderer needs to be able to take its initial configuration and deterministically generate a configuration transaction which all orderers will agree on.  This transaction should be well formed, and must be able to be interpreted by both the ordering service and the peer."""
"FAB-492","Story","fabric-quality",8,"leverage GO obcsdk to use node.js API instead of REST","""Our GO obcsdk is used by a set of tests written in GO for consensus acceptance and regression, ledger stress tests, concurrency, and longrun testing. To talk to the Peers, client threads use REST calls. To leverage all these tests in v1.0 and beyond using node.js (especially needed if REST is deprecated), we must:  # Decouple the REST functions from the GO application layer, and create a well-defined API.  # Implement the node.js SDK communication interface methods, to perform the same functions as the existing REST functions.  # Provide a test environment variable for the GO application tests to choose either REST or node.js. """
"FAB-475","Story","fabric-orderer",8,"generic check for correct requests","""The consensus network should not add garbage data to the batches it produces.  Especially under byzantine assumptions, it is possible that byzantine nodes (client, primary) introduce invalid data into the batches.  To protect against this, requests proposed by a leader need to be validated for a correct signature from an authorized client.  This way a leader (or unauthorized client) can not add invalid requests.  This can be implemented as a generic component that can be shared by different consensus implementations.  In the case of bft, replicas check the batch preprepared by the primary and perform a view change when requests are invalid.  This component would be used by FAB-474 to filter requests before they get added to the fresh pool."""
"FAB-474","Story","fabric-orderer",8,"generic censorship prevention and duplicate request purge for BFT consensus","""We want to prevent the primary of sBFT (but really any replica in any BFT atomic broadcast) to censor requests (i.e., drop individual requests).      Proposal: Per discussion with [~vukolic], this could be addressed by a generic component (not be part of sbft core, nor specific to sbft), which keeps track of new requests (""""fresh""""), in-flight requests (""""pending"""", only at primary), and recently completed requests.  Timestamped entries are serviced infrequently (several second scale), and fresh requests will be brought to the attention of the remaining network, including the primary.  When a second, longer, timeout expires, the component signals to the atomic broadcast implementation that the leader should be changed.    Every time the atomic broadcast implementation observes a change in leader, this is communicated to the component and timeouts are adjusted to give the new leader time to act.    The leader also uses the registry of fresh requests to assemble a new batch.    This sounds deceivingly simple and probably will turn out to be more complicated than expected."""
"FAB-473","Story","fabric-orderer",8,"sbft: create standalone consensus peer","""create executable that will act as atomic broadcast client and use sbft as backend"""
"FAB-470","Task","fabric-orderer",2,"Make logging level configurable for solo orderer and config package","""I think a command-line flag (as we do in the Kafka orderer) will do to begin with, but we probably want to add this to the YAML file as well."""
"FAB-468","Task","fabric-orderer",2,"Add support MaxWindowSize and QueueSize","""MaxWindowSize sets an upper bound on a client's requested window, and QueueSize sets an upper bound on the maximum number of messages a client may have pending. These are not necessary to have but they are good features and they align the Kafka orderer with the Solo one."""
"FAB-467","Task","fabric-orderer",2,"Add support for orderer/config package","""Switch over the Kafka orderer to the config package introduced in FAB-386: https://gerrit.hyperledger.org/r/1153"""
"FAB-507","Task","fabric-orderer",2,"Each solo orderer client should have a separate flow control window","""The QueueSize configuration option is being applied across all orderer clients. Change this to apply on a per-client basis."""
"FAB-526","Task","fabric-orderer",1,"Add reconnection logic","""If the Kafka brokers are not up yet, the orderer should attempt to reconnect to them every X seconds for a period of Y seconds, instead of panicking right away.    This means there's no need for """"sleep 5s"""" hacks when bringing up a network for BDD tests via Docker Compose."""
"FAB-539","Story","fabric-crypto",5,"Implement crypto in python SDK","""Follow SDK spec and refer to nodeJS SDK implementation."""
"FAB-580","Story","fabric-crypto",8,"As a fabric developer working on endorser logic I want to do all the required security checks on a client proposal","""This is in accordance to FAB-351, and FAB-489."""
"FAB-601","Story","fabric-ledger",2,"Ledger versioning scheme: I want to use the block/transaction height as a variable's version, instead of an incrementing version number, so that I have traceability between state data and transaction data","""Ledger versioning scheme: I want to use the block/transaction height as a variable's version, instead of an incrementing version number, so that I have traceability between state data and transaction data"""
"FAB-600","Story","fabric-ledger",8,"As an endorser performing simulation, I want the state database to always be in sync with the blockchain ledger on the file system","""ledgernext was initially delivered in sprint1 to quickly unblock dependent components, in this task the simulation and state management code will be hardened, for example to ensure the state index is always consistent with the blockchain ledger."""
"FAB-618","Sub-task","fabric-sdk-node",2,"Add error paths to endorser-tests.js","""In the initial changeset there's only happy path. Need to add more error paths like what's done in ca-tests.js."""
"FAB-617","Sub-task","fabric-sdk-node",2,"Add headless unit tests for Peer.js and Member.js","""So that each function are tested for handling good and bad params, etc."""
"FAB-666","Task","fabric-orderer",2,"As an orderer I want to retrieve the genesis block and join the network","""Implement bootstrap startup procedure that accepts genesis block file containing configuration for orderer. Make sure the data is organized as specified in FAB-359."""
"FAB-659","Sub-task","fabric-sdk-node",8,"Merge master branch's bug fixes and tests into fabric-sdk-node","""the new repository """"fabric-sdk-node"""" was based on a pre-v0.6 version of the master branch. The master branch has since been further enhanced with bug fixes. We want to bring those into the new repo where make sense.    [~pmullaney] has already started working on migrating over the event hub feature into the new repo, so this effort doesn't need to take into account any code related to event hub."""
"FAB-706","Sub-task","fabric-orderer",1,"Create orderer common components dir","""The complexity with introducing pluggable pieces for filtering and validation into ordering is making the 'throw everything into the orderer directory' policy not make sense.  The directory structure should be re-arranged."""
"FAB-705","Sub-task","fabric-orderer",2,"Create a policy manager","""With the ability to specify policy in FAB-704 it is necessary for the orderer to track what policies are currently in effect and be able to evaluate whether a policy is satisfied by a given transaction.    Therefore, a framework for updating and evaluating policies is necessary."""
"FAB-704","Sub-task","fabric-orderer",2,"Create signature validation DSL for use by filtering framework and later more broad use","""At a high level, the initial configuration defines things like """"Only allow clients who have a certificate which is signed by one of these 6 parties"""", but there is no obvious way to express this in a datastructure.  Especially as more complicated signature schemes must be specified such as """"It must be signed by the network owner, and, it must also have 4 of the 7 stake holders sign off as well"""" the need for a domain specific language arises to express these concepts.    This should be defined in protobuf, as it is how we store and marshal things on the blockchain today."""
"FAB-702","Story","fabric-gossip",8,"Dynamic set of peers.","""Dissemination layer has to provide an ability of dynamic addition for new peer members, it has to be able to recover from network partition and congestion. Moreover it has to preserve node state integrity.    New coming or lagging peers will use the capabilities of this module to synchronize their state from the neighbor peers. """
"FAB-701","Story","fabric-orderer",8,"Connections between shims and Kafka cluster should be authenticated","""As of 0.9, Kafka supports TLS for client/broker and inter-broker communication.    We need to enable it, and also make sure that when a shim or broker is added/removed, the ACLs are updated accordingly.    There are no APIs provided by Kafka for this, so we will have to resort to executing scripts.    https://cwiki.apache.org/confluence/display/KAFKA/Kafka+Authorization+Command+Line+Interface  http://www.confluent.io/blog/apache-kafka-security-authorization-authentication-encryption/    Some more context here: https://hyperledgerproject.slack.com/archives/fabric-consensus-dev/p1477597906002876    Feel free to break this story into tasks, but let's use this as a point of reference for comments and discussion."""
"FAB-742","Sub-task","fabric-gossip",1,"Create and define gossiping node meta object","""Once new node appears in the network it has to complete the state based on the information of the ledger height in other nodes. This information is disseminated during gossip keep alive mechanism, e.g. each node transfer its meta-state which should include information about ledger.    Need to provide an ability to store relevant info within nodes, serialize and de-serialize this information."""
"FAB-761","Story","fabric-orderer",1,"Orderer GRPC API","""Define a GRPC API for client to submit a transaction to Orderer (ie broadcast and deliver).     This is currently in ab.proto, which we need to beef up the description on error conditions."""
"FAB-789","Story","fabric-ledger",8,"As a fabric developer, I want to understand CouchDB performance as a ledger state database","""Initial assessment is complete.  Senthil please attach a community-friendly copy of the performance assessment to this work item."""
"FAB-788","Story","fabric-ledger",8,"As a fabric developer, I want to replace RocksDB with another key/value datastore","""RocksDB has a patent infringement license in it from Facebook. The legal team is therefore not comfortable with using it. For details read: https://github.com/facebook/rocksdb/blob/master/PATENTS    The alternatives include  1. LevelDB (https://github.com/google/leveldb) with a go wrapper (https://github.com/jmhodges/levigo),  2. *goleveldb* (https://github.com/syndtr/goleveldb) - a porting of leveldb in golang  3. BoltDB (https://github.com/boltdb/bolt)    BoltDB is suitable for read heavy workloads (e.g., LDAP) but has a relatively poor performance for read-write workloads.  Of the other two options, *goleveldb* is chosen because it is implemented in golang and hence easy to intergate and maintain.  In addition, as a precedent, ethereum go implementation also uses this package (https://github.com/ethereum/go-ethereum/blob/master/ethdb/database.go)"""
"FAB-782","Sub-task","fabric-sdk-node",2,"Remove sdk/node folder from ""fabric"" project in master","""[~cdaughtr] has done the work to merge all subsequent changes to v0.6 and master in the original location (fabric/sdk/node) to the new project (fabric-sdk-node), tracked in FAB-659. so there's no need to keep the old code around in fabric.    [~greg.haskins] [~rameshthoomu] want to make sure you guys are aware of this planned action. Hoping to do it asap. Would there be any concerns w.r.t the build steps and CI jobs? we'll for sure clean up the make file as part of this."""
"FAB-780","Sub-task","fabric-sdk-node",1,"Update readme for the fabric-sdk-node repo to be more contributor friendly","""should prominently include steps to build, set up test environment and run tests."""
"FAB-821","Task","fabric-orderer",0,"Size broadcaster's batchChan appropriately","""See https://gerrit.hyperledger.org/r/#/c/1627/3/orderer/kafka/broadcast.go@50 and [~bcbrock]'s comment for details.    batchChan is the buffered channel where the broadcaster part of the Kafka shim holds incoming messages until it's time to cut a new block. In the current solo-like implementation, setting the number of elements of this buffer equal to the number of messages a block is expected to have is short-sighted.    We are now moving towards a model where the shim just relays each message to the broker as it receives it, so the original problem goes away, but we should still come up with an appropriate capacity for this.    Do we expose this as a configuration parameter with a sensible default and call it a day? (And what makes for a sensible default?)"""
"FAB-839","Task","fabric-orderer",2,"Create per-session buffered channel for broadcast responses","""The Recv path should as clear from blocks as possible. An appropriately-sized buffered response channel per connected client and a non-blocking write to it is the way to go.    See https://gerrit.hyperledger.org/r/#/c/1627/5/orderer/kafka/broadcast.go@129 for more details."""
"FAB-835","Story","fabric-orderer",2,"As a Fabric user, I want to know how the Kafka-based ordering service works","""We've designed this out in the open, and all the logic is written down in the various JIRA issues that belong to FAB-32, and in #fabric-consensus-dev.    However, it's necessary to wrap everything up in a single document that acts as a point of reference."""
"FAB-833","Sub-task","fabric-crypto",8,"As an application developer I want to implement an application library to offer confidentiality of transaction data.","""This task relates to the implementation of the interface defined in previous work item of 830."""
"FAB-829","Story","fabric-crypto",8,"As an application/infrastructure developer I want to design a generic membership service interface","""This item reflects the work needed to design an interface for membership services operations (issuing/managing certificates, and authentication mechanisms using those certificates) in a way that that interface does not depend on the exact implementation/cryptographic primitives that the membership service uses.   This interface is to be integrated to core operations of the fabric, such that a fabric deployer who wishes to substitute only membership service component of the system, is able to do so without affecting the code of fabric core/transaction processing.   Wee need to define one interface used by the infrastructure (verification MSP interface) and one for the client to construct transactions (retrieving the corresponding certificates), and signing with its secret key.  """
"FAB-828","Story","fabric-ledger",2,"Create couchdb database automatically for main system ledger","""The assumption is that all chaincode will run in one CouchDB database for the system ledger, and there will be separate databases for each subledger."""
"FAB-826","Task","fabric-crypto",8,"As an infrastructure developer i want to implement ACLs on (channel) events","""Implement the technique designed in FAB-637 for registration (access control enforcement) to a channel's events. Extend that implementation to have a aper-channel access policy/check."""
"FAB-885","Task","fabric-peer",1,"Enable successful execution of endorser.feature without bootstrap","""This will not take into account bootstrapping, but will test the engine flow from the client prespective."""
"FAB-892","Story","fabric-orderer",2,"As an orderer I have to authenticate the peer that connects to me","""The orderer/shim needs to check that the peer's certificate links back to a CA that's referenced in the channel's genesis/reconfiguration block."""
"FAB-900","Story","fabric-quality",3,"Test Bootstrapping","""An admin would bootstrap the network and would need the following:  * users and certs for each peer  * orderer certs and URL/IP address for the network  * any possible subchannel information if network will be configured with such    The output is:  * the genesis block that contains cert info for all peers in the network  * a hash that is sent to each peer for determining if the genesis block that they receive from the network is genuine.  """
"FAB-924","Sub-task","fabric-sdk-node",2,"Develop an end-2-end test to drive all v1.0 APIs","""this is a happy path test that ensures all peer APIs have not regressed or changed, to ensure the SDK API and peer stay in sync"""
"FAB-932","Sub-task","fabric-sdk-node",1,"Add a gulp task for running tests with coverage reports","""""""gulp test"""" to run the whole test bucket  """"gulp test-headless"""" to run just the headless tests    both should print a report in the output and generate the HTMLs for the coverage report"""
