"issuekey","type","components","storypoint","title","description_text"
"SERVER-38336","Bug","Storage",1,"Coverity analysis defect 105145: Copy without assign","""Class has user-written copy constructor but no user-written assignment operator  Defect 105145 (STATIC_C)   Checker COPY_WITHOUT_ASSIGN (subcategory none)   File:  {{/src/mongo/db/storage/kv/temporary_kv_record_store.h}}   Parse Warning (no function name available)     /src/mongo/db/storage/kv/temporary_kv_record_store.h, line: 46     {color:red}Class """"mongo::TemporaryKVRecordStore"""" has a user-written copy constructor """"mongo::TemporaryKVRecordStore::TemporaryKVRecordStore(mongo::TemporaryKVRecordStore &&)"""" but no corresponding user-written assignment operator.{color}  {code:first-line=46}     class TemporaryKVRecordStore : public TemporaryRecordStore {   """
"SERVER-38396","Task","Storage",8,"Improve the IndexBuildsCoordinator unit testing after it was made into an interface with two implementations","""SERVER-38323 added an embedded implementation, and the original unit test only tests the original implementation. This task is to cover both implementations with unit testing."""
"SERVER-38395","Task","Testing Infrastructure",1,"Python global logger is polluted when importing certain resmokelib modules","""It was discovered that the global {{logging}} in {{buildscripts/update_test_lifecycle.py}} gets overriden by {{buildscripts/mobile/adb_monitor.py}} because of the resmokelib imports.    The file {{buildscripts/mobile/benchrun_embedded_setup_android.py}} also has similar issue.    The {{logging}} setting should not be done in the global scope but in the {{main}} function:  """
"SERVER-38478","Task","Concurrency",8,"Remove UninterruptibleLockGuard in query yield","""restoreLockState() is used by [query yielding|https://github.com/mongodb/mongo/blob/a66a5578d5b006cef85b16eac05c96b58c877ebe/src/mongo/db/query/query_yield.cpp#L92] and [transaction reaper|https://github.com/mongodb/mongo/blob/a66a5578d5b006cef85b16eac05c96b58c877ebe/src/mongo/db/transaction_reaper.cpp#L165]. To make sure they don't conflict with prepared transactions on stepdown and shutdown, we need to guarantee they only restore IS or IX locks or they restore locks that won't conflict with transactions."""
"SERVER-38477","Task","Storage",13,"Index build lock acquisitions should be interruptible","""Index build avoids interruptions in several places, especially for background index build. They will conflict with prepared transactions on stepdown and shutdown. We can either make index build interruptible, or use IX or IS locks instead of X or S locks.    Here's a list of all occurrences of UninterruptibleLockGuard for index build.  [src/mongo/db/catalog/multi_index_block_impl.cpp:156|https://github.com/mongodb/mongo/blob/86fab3ee0e1570c6743b314fddc0af418bba9015/src/mongo/db/catalog/multi_index_block_impl.cpp#L156]  [src/mongo/db/commands/create_indexes.cpp:325|https://github.com/mongodb/mongo/blob/86fab3ee0e1570c6743b314fddc0af418bba9015/src/mongo/db/commands/create_indexes.cpp#L325]  [src/mongo/db/index_builder.cpp:195|https://github.com/mongodb/mongo/blob/86fab3ee0e1570c6743b314fddc0af418bba9015/src/mongo/db/index_builder.cpp#L195]  [src/mongo/db/index_builder.cpp:299|https://github.com/mongodb/mongo/blob/86fab3ee0e1570c6743b314fddc0af418bba9015/src/mongo/db/index_builder.cpp#L299]  """
"SERVER-38509","Improvement","Testing Infrastructure",2,"Handle degraded mode for test history in generate_resmoke_suites","""Evergreen is going to implement a """"degraded"""" mode if it cannot respond to test history queries due to load. In that mode, queries to the test history will return HTTP 503 (See https://jira.mongodb.org/browse/EVG-5633). We should detect this condition when attempting to split up test suites and divide up the suites randomly (we may want to define an expansion on the project of how much to divide up in this situation, that would allow us to change the value without needing to commit new code)."""
"SERVER-38532","Improvement","Indexing|Logging",1,"Add index ns and name to ""build index done"" log line","""A lack of final log details make it hard to reconstruct index build timelines from {{mongod}} logs using {{grep}} etc.    When a build starts we get a log like:    but when it ends, only:      Can we add at least the {{ns}} and index name to the """"build index done"""" so that we can use grep for analysis?  """
"SERVER-38531","Improvement","Testing Infrastructure",3,"Increase parallelism in test lifecycle update script and perform more rollups server-side","""The {{update_test_lifecycle.py}} script only parallelizes the requests across tasks for a given batch of tests.    We should be able to parallelize all requests to improve the overall run time.    Additionally we can take advantage of the {{group_num_days}} parameters of the Evergreen API to fetch stats results already aggregated for the reliable and unreliable periods."""
"SERVER-38562","Task","Storage",5,"Implement IndexBuildsCoordinator::voteCommitIndexBuilds","""Consider moving the [Client::setLastOpToSystemLastOpTime|https://github.com/mongodb/mongo/blob/597b4748fc36210c61cf4d6c086d364013df740a/src/mongo/db/commands/vote_commit_index_builds_command.cpp#L77-L80] logic into the function logic.    A flag must be set in-memory on the index build whether or not to proceed without voting or end the thread after voting successfully or finding the flag set after the fact. commitIndexBuild, if the build has already reached the 'committing' phase, will set the flag and start a new asynchronous thread for the commit; else, the in-memory flag will be set such that the index build discovers it later and bypasses voting, proceeding straight to commit. This is necessary because stalling commit, and thereby stalling replication on the secondary, cannot be permitted to take as long as a network call can potentially take -- a matter of seconds, presumably. The alternative would be to make the voteCommitIndexBuild command sent by the secondary have a short enough timeout that we don't mind stalling replication for that amount of time: but this is risky given that determining a reasonable time for all network and replication latencies might be impossible.    The index build thread would exist after finishing voting, as opposed to waiting on a condition variable for the commitIndexBuild signal, as ReplIndexBuildState is currently expecting with its condition variable already set up and waiting to be used -- need to change that.    The flag must also be initialized correctly on index build recovery, depending on the persisted state."""
"SERVER-38615","Bug","Testing Infrastructure",1,"The psutil module should be installed on all platforms","""We are now using {{psutil}} in {{buildscripts/tests/test_evergreen_resmoke_job_count.py}} and this runs on every platform (see SERVER-38115)."""
"SERVER-38589","Bug","Packaging",2,"service mongod stop may produce No /usr/bin/mongod found running; none killed.","""A fix should be applied to https://github.com/mongodb/mongo/blob/6c8dc5e004bf2c91df10975adef861bcf00af6cd/debian/init.d to prevent this error when stopping mongod."""
"SERVER-38667","Task","Storage",5,"Notify IndexBuildsCoordinator of replica set member stepup and stepdown","""Add step-up and step-down hooks for the IndexBuildsCoordinator.     There's a field on the mongod implementation that indicates primary/secondary state https://github.com/mongodb/mongo/blob/5eca4a77da863bd4e68bf4eb7c2d0c920982f8b9/src/mongo/db/index_builds_coordinator_mongod.h#L137    And there are interface functions for setting primary and secondary, which look like they've been implemented in the mongod and embedded already. https://github.com/mongodb/mongo/blob/5eca4a77da863bd4e68bf4eb7c2d0c920982f8b9/src/mongo/db/index_builds_coordinator.h#L197-L198    We'll need to call the state change functions in here https://github.com/mongodb/mongo/blob/4d09b2e0a605aefd7adefda28e01e309bbf30883/src/mongo/db/repl/replication_coordinator_external_state_impl.cpp#L483 and it looks like stepdown hooks go in here maybe https://github.com/mongodb/mongo/blob/4d09b2e0a605aefd7adefda28e01e309bbf30883/src/mongo/db/repl/replication_coordinator_impl.cpp#L2800 -- check in with someone from repl to find out their preferences for new hook additions."""
"SERVER-38710","New Feature","Testing Infrastructure",2,"Support dependencies when generating evergreen tasks","""Support depends_on and requires when generating tasks"""
"SERVER-38749","Bug","Testing Infrastructure",1,"Concurrent stepdown suites on 3.6 branch still use 5-second election timeout","""The changes from [3aa3155|https://github.com/mongodb/mongo/commit/3aa315557bef775c5291068e365a59a3a810fc41] as part of SERVER-30642 were ineffective at increasing the election timeout for the {{concurrency_sharded_with_stepdowns*.yml}} test suites because the JavaScript version of the stepdown thread reconfigures the replica set and sets a 5 second election timeout by default. We should additionally additional set {{electionTimeoutMS=1 day}} as part of the stepdown options specified to [the {{ContinuousStepdown.configure()}} function|https://github.com/mongodb/mongo/blob/r3.6.9/jstests/concurrency/fsm_libs/cluster.js].    *Note*: This is no longer an issue for the 4.0 or master branches because they've switched to using the Python version of the stepdown thread, which doesn't reconfigure the replica set."""
"SERVER-38779","Improvement","Storage",8,"Build a mechanism to periodically cleanup old WT sessions from session cache","""The way session cache is maintained, idle sessions keep accumulating in the session cache.  If the workload doesn't use all the idle sessions, the oldest sessions stay open forever. In some cases these sessions might hold some resources inside WiredTiger, which can cause problems. eg: dhandles that never close in WiredTiger.    This ticket is to build a mechanism around the session cache, to cleanup old sessions that have been idle for too long.    More details in the linked tickets."""
"SERVER-38822","Bug","Testing Infrastructure",1,"Linux Repeated Execution variant does not repeat the tests","""The change for SERVER-36613 introduced a second definition of the {{test_flags}} expansions for {{linux-64-repeated-execution}} buildvariant:      The second definition overrides the first."""
"SERVER-38818","Improvement","Testing Infrastructure",3,"Better handle dependencies between generated tasks","""With generated tasks, dependencies between tasks gets complicated. The dependencies should exist on the generator tasks and when generating a task should query the evergreen api to determine which dependent tasks were generated and add all of them as dependencies on the tasks being created."""
"SERVER-38817","Improvement","Testing Infrastructure",3,"Use generate.tasks on all resmoke tasks","""Migrate any resmoke tasks that are not using generate.tasks to use generate.tasks."""
"SERVER-38816","Improvement","Testing Infrastructure",2,"Use generate.tasks for required tasks over target runtime","""Apply generate.tasks to resmoke tasks on required builders that have an average runtime greater than the target runtimes.     The target runtimes are:  * RHEL 6.2: 10 minutes  * Enterprise Windows 2008R2: 20 mins  * Linux DEBUG: 15 mins"""
"SERVER-38886","Improvement","Storage",1,"refactor RecordStore::validate implementations","""All storage engines currently have one that's almost identical. The storage-engine independent iteration should be factored out, and only the storage-engine specific part should be left. There also is an implementation in {{RecordStoreValidateAdaptor::traverseRecordStore}}."""
"SERVER-38931","Task","Storage|Testing Infrastructure",3,"Apply relevant changes to snapshot_read_kill_operations.js to 4.0 branch","""SERVER-37009 fixed an error in the [{{snapshot_read_kill_operations.js}}|https://github.com/mongodb/mongo/blob/0ffb6bc78dc1219692b294215c97d48a7e9f1fdd/jstests/concurrency/fsm_workloads/snapshot_read_kill_operations.js] test that caused the {{killSessions}} portion of the test to silently fail to kill the session if the corresponding session document did not exist. This fix uncovered other issues with the test that have been fixed in master but not backported to 4.0. All relevant fixes to this test, including the fix in SERVER-37009, should be applied to the 4.0 version of this test.    One possible way to do this would be to replace the 4.0 version of the test with the corresponding version in master, being mindful of any changes made to the test that are specific to master."""
"SERVER-38927","Task","Catalog|Storage",3,"Cache collection 'temp' status on Collection object","""We cache things like validators and 'capped' status on the Collection object so we do not need to go all the way to storage and open up a storage transaction every time we want to check the value.     As far as I know, 'temp' cannot change with 'collMod', but it can with 'renameCollection', and on rollback.    This is needed for SERVER-38139 to ban temporary collections in transactions without having to consult the storage engine an extra time for every transaction statement."""
"SERVER-39007","Task","Testing Infrastructure",1,"Switch to use rhel62-large distro for concurrency* tasks on Enterprise RHEL 6.2 (InMemory) builder","""We're seeing OOM failures with the InMemory storage engine [occur consistently|https://evergreen.mongodb.com/task/mongodb_mongo_master_enterprise_rhel_62_64_bit_inmem_concurrency_replication_2f67f3c66271e724b48afa2db88e8b6c3317f6ab_19_01_11_18_02_54] after the changes from [2f67f3c|https://github.com/mongodb/mongo/commit/2f67f3c66271e724b48afa2db88e8b6c3317f6ab] as part of SERVER-33161. Changing to the {{rhel62\-large}} distro for the {{concurrency*}} tasks on the Enterprise RHEL 6.2 (InMemory) builder is a stopgap for getting the build back to being green until whether the increased memory consumption can be declared as """"expected""""."""
"SERVER-39004","Improvement","WiredTiger",5,"Introduce a quota mechanism for the overflow file","""We don't currently have a quota mechanism to prevent {{WiredTigerLAS.wt}} from growing and eventually running out of disk space.    It would help to have such a configuration in place so that once a file reaches a configured size, we reboot mongod process, which will effectively clean up the {{WiredTigerLAS.wt}} file"""
"SERVER-39068","Task","Storage",8,"Replication of simultaneous index builds startIndexBuild and commitIndexBuild oplog entries","""A temporary command, twoPhaseCreateIndexes, already exists. SERVER-39066 sets up the OpObserver and oplog.cpp. Wait for SERVER-37643 to set up builders in the IndexBuildsCoordinator/Manager.    Then, set up a code path into the Coordinator/Manager that will do a two phase index build, and have the {{twoPhaseCreateIndexes}} command call it. The [{{twoPhaseIndexBuild}}|https://github.com/mongodb/mongo/blob/e990d25622d96897d78e72b362db61f2a4f9d99c/src/mongo/db/repl_index_build_state.h#L88] flag in the {{ReplIndexBuildState}} object should be set. A startIndexBuild oplog entry should optionally (based on the Coordinator's twoPhaseIndexBuild setting) be written in the same WUOW as the index catalog entry initialization write: this should parallel the oplog write on commit seen [here|https://github.com/mongodb/mongo/blob/e990d25622d96897d78e72b362db61f2a4f9d99c/src/mongo/db/catalog/multi_index_block.cpp#L664-L666] and [here|https://github.com/mongodb/mongo/blob/e990d25622d96897d78e72b362db61f2a4f9d99c/src/mongo/db/commands/create_indexes.cpp#L402-L406]. The {{startIndexBuild}} oplog entry should start an index build, which I think is [already hooked up|https://github.com/mongodb/mongo/blob/e990d25622d96897d78e72b362db61f2a4f9d99c/src/mongo/db/repl/oplog.cpp#L280-L292], just inactive and not tested. The commitIndexBuild oplog entry should optionally be swapped out with the createIndexes oplog entry currently written on index commit, based on the {{twoPhaseCreateIndexes}} setting. Secondaries don't do anything on receipt of commitIndexBuild, and we will leave that to implement in a separate patch."""
"SERVER-39064","Task","Storage",3,"Storage interface changes for specifying durable_timestamp","""The storage interface must allow specifying a {{durable_timestamp}} when committing a prepared transaction."""
"SERVER-39106","Bug","Replication|Storage",3,"GlobalLock acquisition should throw when ticket acquisition times out if there is a max lock timeout and no deadline","""If global lock acquisition times out acquiring a ticket, then the constructor will not throw, but the resource will be unlocked. This leads to invariant failure when we attempt to acquire the global lock [here|https://github.com/mongodb/mongo/blob/89c3502129303b41b8d35bf5d64eb0a242f061da/src/mongo/db/transaction_participant.cpp#L788] then call {{canAcceptWritesForDatabase()}} [here|https://github.com/mongodb/mongo/blob/89c3502129303b41b8d35bf5d64eb0a242f061da/src/mongo/db/transaction_participant.cpp#L800], which invariants that the lock is held [here|https://github.com/mongodb/mongo/blob/89c3502129303b41b8d35bf5d64eb0a242f061da/src/mongo/db/repl/replication_coordinator_impl.cpp#L1947].    If the caller did not provide a deadline, then they are not checking for lock acquisition failure, so the lock acquisition should throw. Consider applying the following patch:  """
"SERVER-39094","Task","Testing Infrastructure",1,"Update jasper_process.py in resmoke to reflect Jasper RPC changes","""The current implementation for [{{jasper_process.py}}|https://github.com/mongodb/mongo/blob/master/buildscripts/resmokelib/core/jasper_process.py] has [some lines of code|https://github.com/mongodb/mongo/blob/master/buildscripts/resmokelib/core/jasper_process.py#L63-L67] for handling RPC errors from Jasper when it does things like signal a process that has already terminated somehow.    This is not reflective of how Jasper actually handles such errors after the completion of MAKE-525, and therefore should be changed to check for these conditions in the [{{val}} case|https://github.com/mongodb/mongo/blob/master/buildscripts/resmokelib/core/jasper_process.py#L59-L62].    Not doing this causes a test failure in {{replica_sets_kill_secondaries_jscore_passthrough}}, in which resmoke exhibits inconsistent behavior where it sends {{SIGKILL}}/{{SIGTERM}} to processes, and then expects the same processes to be alive at a later time. The full description of this problem can be found at [this comment|https://jira.mongodb.org/browse/MAKE-523?focusedCommentId=2117281&page=com.atlassian.jira.plugin.system.issuetabpanels%3Acomment-tabpanel#comment-2117281]."""
"SERVER-39087","Task","Storage",13,"move initial sync index creation logic into IndexBuildsCoordinator","""Index creation during initial sync should be delegated to the IndexBuildsCoordinator"""
"SERVER-39086","Task","Storage",8,"Move startup recovery index creation logic into IndexBuildsCoordinator","""Index creation during startup recovery should be delegated to the IndexBuildsCoordinator"""
"SERVER-39085","Task","Storage",8,"move secondary oplog application logic for index creation into IndexBuildsCoordinator","""During secondary oplog application, we should delegate index creation to the IndexBuildsCoordinator."""
"SERVER-39127","Improvement","Testing Infrastructure",2,"Use generate.tasks for already converted tasks on all variants","""Several tasks already use generate.tasks on required builders. These should be switched to use generate.tasks on all builders and the non-generate.tasks tasks removed."""
"SERVER-39239","Task","Storage",5,"Two-phase index builds on secondaries will wait for the commitIndexBuild oplog entry before committing.","""The secondary's index build thread should spin in a loop before finishing up and committing the index.    The secondary will do nothing while spinning in a loop. It should drop all locks. SERVER-39458 will add functionality to the loop, of periodically reacquiring the lock and running side table draining.    On receipt of the commitIndexBuild oplog entry, the secondary should signal the index build to commit with a timestamp passed in the oplog entry. The oplog applier thread will need to drop locks to allow the index build to take the X lock for index commit -- I believe this should be safe, since 'c' oplog entries are applied serially, and so dropping the lock is OK. IndexBuildsCoordinator::commitIndexBuild will need to fetch a Future from the index build to return to the oplog applier thread to wait upon for commit completion.    SERVER-39533 will be done after this ticket and will hook up the abortIndexBuild oplog entry so that alternatively the index build on the secondary can be aborted while it's spinning in that loop waiting for commit. In case that's a design consideration.    Do not try to act on abort/commit signals earlier in the index build on secondaries than that spinning loop that waits for commit/abort. This is the simple first iteration implementation, we'll make it fancier in a subsequent ticket."""
"SERVER-39225","Task","Storage",3,"Update kill_rooted_or.js / IndexBuildsCoordinator to gracefully handle index build already in-progress errors","""""""The Coordinator registers each index spec by name that comes in, before the indexes are set up in the index catalog as in-progress. Then subsequent requests with the same index names hit an error in the Coordinator. Without the Coordinator, spec requests are normally automatically filtered out if they're already found to be built or building via the index catalog.    The concurrency test has 10 threads, potentially all running the same createIndexes requests at the same time, so """"There's already an index with name..."""" errors make sense -- previously they'd get filtered out and the redundant commands return OK.    Perhaps a new error code IndexBuildAlreadyInProgressForName to fix tests, and we can consider the final behavior changes later, and easily identify the changes by error code if we want to undo them.  This is related to our problem regarding spec checking being scattered all over the place at different levels of the code."""""""
"SERVER-39224","Task","Storage",5,"Explore why queryoptimizer3.js fails using the IndexBuildsCoordinator, then fix it","""""""So that test has one thread repeatedly recreate a collection with indexes, bulk insert a bunch of docs and do a single index table scan. And a second thread drop the collection repeatedly, to check that index table scan cursors get aborted on dropCollection."""""""
"SERVER-39279","Bug","Internal Code",2,"Race between ServiceContext::ClientDeleter and waitForClientsToFinish()","""{{ServiceContext::ClientDeleter::operator()(Client* client)}} accesses the serviceContext outside the serviceContext's mutex to call the registered observers on {{onDestroy()}}, while the serviceContext may have already been destroyed by [service_context_test_fixture|https://github.com/mongodb/mongo/blob/e12dcc7fdbdb44fb7806dfb42a49bd740f361d82/src/mongo/db/service_context_test_fixture.cpp#L52], since the client vector is empty, checked by [waitForClientsToFinish|https://github.com/mongodb/mongo/blob/cdf319123d8e5d3cd169e2a11aec6aea0b951bf1/src/mongo/db/service_context.cpp#L344].  {code:c++}  void ServiceContext::ClientDeleter::operator()(Client* client) const {      ServiceContext* const service = client->getServiceContext();      {          stdx::lock_guard<stdx::mutex> lk(service->_mutex);          invariant(service->_clients.erase(client));          if (service->_clients.empty()) {              service->_clientsEmptyCondVar.notify_all();          }      }      // The serviceContext may have already been destroyed.      onDestroy(client, service->_clientObservers);      delete client;  }  {code}"""
"SERVER-39313","New Feature","Testing Infrastructure",3,"Create burn_in_tests metric tracking script","""A script to track the effectiveness of burn_in_tests will be manually run. This script should be called buildscripts/metrics/burn_in_tests.py.    The script will invoke the task history of patch and mainline builds over a user specific period (default 4 weeks). It will provide the following, for builds which ran burn_in_tests:   * Number of patch builds   * Number of failing tasks   * Number of failing burn_in_tests tasks   * Number of patch builds where only burn_in_tests failed   * Number of tasks generated   * Number of tests executed   * Number of times task exceeded the expected run time    +AWS costs+   Computing the AWS costs for associated to each burn_in task (and the sub-tasks it spawned) will be useful in understanding what additional cost there is to run burn_in more than twice. These costs can be computed using task history time for all generated tasks and the main burn_in task weighted with the type of distro the tasks ran on. Contrasting this result with prior burn_in tasks runs will provide some metric for the increased cost.    The aws costs for burn_in can be computed with the following splunk query:  {{index=evergreen stat = task-end-stats task = burn_in_tests* project = mongodb-mongo-master | timechart span=1h avg(cost)}}"""
"SERVER-39311","New Feature","Testing Infrastructure",2,"Enable burn_in repetition count","""Update evergreen.yml to use burn_in_tests_gen task and update burn_in_test.py to pass the new repeatTests options to resmoke"""
"SERVER-39308","New Feature","Testing Infrastructure",3,"Update burn_in_tests.py to generate sub-tasks JSON file","""Modify burn_in_tests.py to support the following new option  * --generateTasksFile (default False): Generate the JSON tasks file which is used in generate.tasks  """
