"issuekey","type","components","storypoint","title","description_text"
"SERVER-16612","Task","Storage",5,"Implicitly zeroed files in WiredTiger","""There is a problem with the implicit zeroing of files by the kernel on certain platforms - see SERVER-15369 for more details. A workaround was put into place for this issue for mmapv1 files to explicitly zero .ns files.    The purpose of this ticket is to determine:  * in what areas will WiredTiger have similar vulnerabilities to this issue?  * what will be the customer impact of this issue to WiredTiger?  * beyond advising customers to avoid using WiredTiger on platforms with the issue, can we reasonably work around the problem by explicitly zeroing all files rather than relying on the kernel's implicit zeroing?"""
"SERVER-17014","Bug","Indexing",0,"foreground index build blocks database reads and writes","""Some discussion is at https://groups.google.com/forum/#!topic/mongodb-dev/_1IrogzovEQ. When I create an index with background:false then many (all?) operations in the db are blocked even for engines like WiredTiger that don't require a per-db writer lock. The URL above shows thread stacks where background jobs (TTLMonitor, ClientCursorMonitor) get blocked on a per-db lock by a background:false index create. I assume bad things can happen when TTL enforcement doesn't run for too long.  This creates other problems as """"show collections"""", db.$foo.getIndexes() and queries from other collections in the same database will be blocked for the duration of the index create.   While background:true is the workaround background index creation can take more time."""
"SERVER-18840","Improvement","Testing Infrastructure",1,"resmoke should indicate status of test in abbreviated log output during run, before logging everything at the end","""When resmoke is running a batch of tests and logging to buildlogger, after each test finishes it prints a line like:        It would be helpful to indicate here if the test passed/failed, so if a suite is running in evergreen but hasn't finished yet, i can eyeball if the suite is going to fail by looking at the logs.      """
"SERVER-19895","Improvement","Testing Infrastructure",2,"resmoke failures should self-document","""When resmoke fails, it should print out steps to help the user debug the failure. E.g. when resmoke detects that it's run in Evergreen, it should print out the places that the user should look for symptoms.    Original description:  At shutdown time, a fixture (Replication or Sharding) checks the return status of all the process shutdown procedures.  If any of them have returned 'false' (which means that the process returned a non-0 exit status), it fails the test suite associated with that fixture.  It would be helpful if the fixture wrote a message to the log stating which process caused the suite failure.  Currently, the only way to diagnose this is to scour the logs looking for the exit status of each process; since we are looking for a line that is *not* """"exited with code 0."""", this is not a simple search to undertake."""
"SERVER-20056","Improvement","WiredTiger",3,"Log a startup warning if wiredTigerCacheSizeGB is > 80% of RAM","""Currently you can set wiredTigerCacheSizeGB to be 100% of available memory, which will almost certainly lead to problems.    Perhaps a startup check here to confirm that wiredTigerCacheSizeGB is < 80% of available Memory.  """
"SERVER-20960","New Feature","Indexing",0,"Default index build option support in config/runtime","""Add support for index build preferences in the config file and/or mongod runtime parameters.    Specifically to control preferences for background or foreground index build options.    *EDIT*: in SERVER-24041 the following request was added:  {quote}  It would be great if I can block foreground index creation by configuration.  {quote}"""
"SERVER-21861","Improvement","Shell",3,"Better Timestamp object comparison in mongo shell","""It would be great if the <, >, <=, >= operators on Timestamp objects would work as expected. The bsonWoCompare can be used for the mean time even though it will end up comparing the member functions as well as long as 't' fields are compared first over the 'i' fields."""
"SERVER-24918","Task","Performance",2,"perf.yml is not using Evergreen modules","""The control file for the performance project in Evergreen 'perf.yml' is not using the Evergreen module support. We should move to use modules to make testing changes in mongo-perf and dsi easier.    Module for DSI and for mongo-perf repos. """
"SERVER-25548","Improvement","Testing Infrastructure",2,"resmoke should not continue after a shell crash","""Currently, resmoke stops the test if a mongo server has crashed in {{job.py}}. We should have it do the same for a shell crash.    For suites that use the shell to spawn servers, a shell crash would cause the servers to not be terminated. Subsequent tests will then run on servers from previous tests, causing either test failures or hangs.    Having these additional failures defeat the purpose of running with continueOnFailure."""
"SERVER-26319","Improvement","Testing Infrastructure",1,"Deleting a test results in ""ValueError: Unrecognized jstest""","""When a file is included or [excluded explicitly by name|https://github.com/mongodb/mongo/blob/r3.4.0-rc1/buildscripts/resmokelib/selector.py#L237] (i.e. not by glob pattern or tag), then an error is raised if the test isn't found. This is done to ensure that the blacklist for a suite is updated when a test is renamed or deleted. We should consider improving [the """"ValueError: Unrecognized jstest"""" error message|https://github.com/mongodb/mongo/blob/r3.4.0-rc1/buildscripts/resmokelib/selector.py#L295] to be clearer about potentially needing to update an entry in the blacklist.    h6. Original description    In master, deleting the test loglong.js causes a failure:  https://evergreen.mongodb.com/task/mongodb_mongo_master_enterprise_rhel_62_64_bit_sharded_collections_jscore_passthrough_c172cc49e735b6e48f58662e5588961216d3cff0_16_09_25_23_17_00    In this patch, I moved loglong.js to a new location and it causes the compile to fail:  https://evergreen.mongodb.com/version/57e577943ff12239ba00ab4f"""
"SERVER-26625","Improvement","Indexing",2,"Make collStats command consistent on background index reporting","""The collStats command includes indexes that are undergoing background index build in the 'indexSizes' section. It does not include them in 'nindexes' or 'indexDetails'. We should make reporting consistent, and make clear which indexes are undergoing background build (if any)."""
"SERVER-26867","Improvement","Testing Infrastructure",2,"Timeout-related assert.soon failures should trigger the hang analyzer","""When an test fails due to a timeout, it would be nice if that would trigger the hang analyzer before tearing down the processes. This would let us see what the server is doing that is preventing it from doing what we expect.    -Timeout-related failures include:-   * -assert.soon()-   * -wtimeout expiring-   * -$maxTimeMs expiring-    Update: Per discussion below we will be limiting this to {{assert.soon}}, {{assert.soonNoExcept}}, {{assert.retry}}, and {{assert.assert.retryNoExcept}}."""
"SERVER-26953","Improvement","Diagnostics|WiredTiger",0,"Track bytes read into cache per query","""When slow queries are logged we include information about documents and index entries scanned to help diagnose performance issues. However that information doesn't tell us whether the documents or index entries scanned were in cache or not, and if they are not in cache they can have a much more significant performance impact. Reporting bytes read into cache for each query logged would help diagnose the cause of performance issues related to cache pressure.    This might be accomplished by tracking bytes read into cache per cursor or per session in WT, and computing the difference between the value of this counter before and after each query. Query performance impact would need to be evaluated."""
"SERVER-26988","Bug","WiredTiger",5,"Secondary delay causes large drop in insert rate on the primary due to cache full condition","""With a heavy insert load and a secondary that is delayed the cache on the primary fills to 100% and operation rates drop. Here's a run showing behavior on the primary with the secondary delayed due to lag, but a similar effect is seen if the secondary is intentionally delayed using slaveDelay.    !lagging.png|width=100%!    * from D-E the cache is 95% full and insert rate drops considerably, possibly due to application threads doing evictions?  * F-G and H-I seem to be seem to be related to checkpoints, possibly also in combination with the full cache?  * the rate of pages walked for eviction is generally very high, about 6k times the rate of pages actually evicted, suggesting that the issue is difficulty finding pages to evict to keep the cache at target levels    The high rate of pages walked for eviction suggests a connection to SERVER-22831, which also showed that symptom in connection with a full cache; however the above run was on 3.2.5-rc1 where SERVER-22831 was fixed, so it seems there is a different issue here.    The above test involved  * 3.2.5-rc1  * 2-node replica set  * 25 GB cache  * 100 GB oplog  * 5 threads inserting 800 byte documents into 5 separate collections      """
"SERVER-28940","Improvement","Testing Infrastructure",5,"Make resmoke fixture setup/teardown their own testcases.","""The fixture setup and teardown logs only go to logkeeper, but don't show up on the Evergreen sidebar. So the assertions can't be extracted without figuring out the logkeeper URL from the task log.    Since everything else that logs to logkeeper (i.e. test and hooks) is a testcase that shows up on the sidebar, the fixture events should get their own spots as well."""
"SERVER-29999","Improvement","Testing Infrastructure",5,"Implement FSM workload scheduler for concurrency_simultaneous task","""We'll want to port [the {{scheduleWorkloads()}} function|https://github.com/mongodb/mongo/blob/r3.7.7/jstests/concurrency/fsm_libs/runner.js#L148-L206] from JavaScript to Python so that resmoke.py is in control over the groups of FSM workloads that are run together. The behavior around the number of subsets an individual FSM workload can be a part of should be identical to what it is for the {{concurrency_simultaneous.yml}} test suite today.    Additionally, specifying {{\-\-suites=concurrency_simultaneous jstests/concurrency/fsm_workloads/workloadA.js jstests/concurrency/fsm_workloads/workloadB.js}} should run those two FSM workloads together rather than in sequence. That is to say, if a list of files is omitted then {{numSubsets}} groups of FSM workloads should be run and if a list of files is present then exactly 1 group of FSM workloads should be run. The latter aims to serve an engineer who wishes to reproduce a particular failure by running the same group of FSM workloads together."""
"SERVER-30204","Task","Testing Infrastructure",3,"Create resmoke.py hook that drops all databases without restarting the cluster","""-Add support for including background/perpetual workloads.- Background/perpetual workloads should be done as background threads in resmoke.py and don't need any special handling other than ensuring adequate documentation in our internal wiki.    Also, add a new hook to drop all DBs and collections after every FSM test. When running in """"the same"""" DB Or """"same collection"""" FSM modes, pass the DB or collection that are not dropped to the new cleanup hook. CleanupOption of not dropping certain DBs will be taken into account as needed.    The new hook will be used in place of CleanEveryN to avoid the overhead of spinning up a large cluster multiple times."""
"SERVER-31535","Task","Build|Packaging",3,"Platform Support: remove Ubuntu 12.04 builds","""Ubuntu 12.04 is EOL, so we should drop support for it in 3.6."""
"SERVER-31570","Improvement","Replication|Testing Infrastructure",3,"Adjust mongobridge port allocations for easier debugging","""Mongobridge assigns ports sequentially so you have to use modular arithmetic to figure out which bridges are associated with which mongods. If we assigned (bridge port) = (mongod port) + 10000, it would be very easy to map them to each other. """
"SERVER-32223","Improvement","Testing Infrastructure",2,"Add burn-in tests for configurations in other variants in addition to other suites","""Many tests accidentally forget to mark """"requires_persistence"""" or other things that are only tested on non-required builders. Similarly, mmap is now run on its own builder. Incorporating some of these """"variant"""" flags into burn-in tests on the required builders could avoid easy test failures."""
"SERVER-33000","Task","Build",8,"Platform Support: add Ubuntu 18.04","""This can go to the backlog for now, but Ubuntu 18.04 will be available soon, so we should be ready to add this platform as soon as there are images out there."""
"SERVER-32443","Task","Replication",1,"Create a sys-perf task for running linkbench automatically against a replica set","""Once the MongoDB linkbench implementation is relatively stable and is utilizing the new transactions API, we should work on integrating an automated benchmark into sys-perf. It would probably be good to run this benchmark against both a 1-node and 3-node replica set, at least."""
"SERVER-32437","New Feature","Packaging",8,"Platform Support: add Amazon Linux 2","""On December 13th, Amazon released Amazon Linux 2. The installation of our current package for AMZL fails:        I guess the missing dependencies could be manually added but still, Amazon Linux 2 is not officially supported at the moment"""
"SERVER-32642","Improvement","Testing Infrastructure",2,"Return raw command response in the validate JS hook","""Modify {{CollectionValidator.validateCollections}} to return the raw command response to make the class more flexible."""
"SERVER-32825","Improvement","Storage",3,"Add the infrastructure for upgrade/downgrade of V2Unique indexes","""Addition of new index format allows use of both V2 and V2Unique format. Initially we would add a gating variable to select the unique index format. Switch to FCV as the deciding factor for which format should be used.     * Setting FCV=4.2 will cause all unique indexes to be updated to V2Unique. Do not update the content of the indexes.  * Having FCV=4.0 would create older V2 format indexes"""
"SERVER-32883","Task","Replication|Testing Infrastructure",8,"Enhanced FSM testing for reading from secondaries","""1. Change the {{secondary_reads_passthrough.yml}} test suite which was added as part of SERVER-34384 to use the """"forceSyncSourceCandidate"""" failpoint as a server parameter to force secondary #2 to sync from secondary #1.    2. Add a new version of the {{concurrency_replication.yml}} test suite that uses a 5-node replica set with each secondary syncing in succession of each other (i.e. a linear chain), writeConcern=\{w: 1\}, readConcern=\{level: """"local"""", afterClusterTime: ...\}, and readPreference=\{mode: """"secondary""""\}. We'll also likely want to make a wrapper around a {{Mongo}} connection object to the primary and to a specific secondary so that an individual worker thread talks to a particular secondary all the time rather than some secondaries potentially never being read from.    {quote}  I think there's some additional complexity here because we want FSM worker thread to do reads from different secondary. (We'll probably pin it to a particular secondary similar to how we """"round-robin"""" when using multiple mongos processes.) It seems like we'll want to have a Mongo connection object implemented in JavaScript that for commands which are present in [this list|https://github.com/mongodb/mongo/blob/6841ce738419923002958acc760e150769b6f615/jstests/libs/override_methods/set_read_preference_secondary.js#L10-L23] are routed via a direct connection to the secondary and commands not present in that list are routed via a direct connection to the primary. I think the existing """"connection cache"""" in the concurrency framework makes it relatively straightforward to have direct connections to other nodes in the cluster.  {quote}    In creating this wrapper around two separate {{Mongo}} connection objects, we may also want to change how SERVER-34383 was implemented to construct a wrapper around a secondary's connection from the connection cache instead of creating a replica set connection for the worker thread.    h6. Original description    As part of SERVER-32606 it turned out that our testing of tailing the oplog on secondaries, including the case of chained replication, is light, while the code paths for secondary reads have gotten quite different now from reads on primaries.    We should have a passthrough test where we test these behaviors. This is related to SERVER-32606, but was too big a task to do as part of that ticket."""
"SERVER-33002","Task","Build",8,"Platform Support: add MacOS 10.13 (High Sierra)","""1. Add image and distro to evergreen  2. Run test build  3. Communicate availability to Storage  4. Once functional, we want to put this in rotation.   5. Review performance and open subsequent investigation ticket if makespan is substantially different"""
"SERVER-32999","Task","Build",3,"Platform Support: remove Debian 7","""[Debian 7 is going EOL soon|https://wiki.debian.org/LTS]. Opening a ticket to deprecate and ultimately remove this platform."""
"SERVER-32997","Bug","Storage",13,"Mobile SE: Design and implement multi-reader or single-writer concurrency","""SERVER-32675 resolved Mobile SE's some of the major issues with concurrency. I still see a few tests hitting either write conflicts or DB locked. These tests need to be investigated and a fix made accordingly. This ticket will track that effort."""
"SERVER-33149","Bug","Indexing",3,"createIndexes fails to report an error when index is not created with the specified name","""The createIndexes command fails to report an error when an index is not created with the specified name because an index already exists with the same keys but with a *different* name."""
"SERVER-33146","Bug","Packaging",3,"mongod.service does not source system-wide environment variables as stated in the documentation","""Following the [Kerberos tutorial|https://docs.mongodb.com/manual/tutorial/control-access-to-mongodb-with-kerberos-authentication/#krb5-ktname] I am unable to configure the keytab environment variable for the rpm installed mongod.    The [service file|https://github.com/mongodb/mongo/blob/master/rpm/mongod.service] does not source /etc/sysconfig/mongod    As a workaround I modified the service file to include        """
"SERVER-33342","Task","Build",3,"Turn on shared scons cache for shipping builders.","""enterprise-linux-64-amazon-ami  ubuntu1204  ubuntu1404  ubuntu1604  amazon  rhel62  rhel70  enterprise-ubuntu1204-64  enterprise-ubuntu1404-64  enterprise-ubuntu1604-64  enterprise-suse12-64  suse12  enterprise-suse11-64  suse11  enterprise-debian71-64  enterprise-debian81-64  debian71  debian81"""
"SERVER-33340","Task","Build",8,"Turn on shared cache for non-shipping (non-push) builders","""We originally planned to test for two weeks - but we may be able to shorten this since we began testing with: SERVER-33278    linux-64-repeated-execution  linux-64-duroff  linux-64-lsm  enterprise-rhel-62-64-bit-inmem  linux-64-ephemeralForTest  ubuntu1404-rockdb  ubuntu1604-debug-asan  ubuntu1604-asan  enterprise-rhel-62-64-bit-coverage"""
"SERVER-33427","Improvement","Testing Infrastructure",2,"improve detectability of test failing because ShardingTest/ReplSetTest not shut down","""{quote}  > Max Hirschhorn Kevin Albertson, I noticed that failing to shut down a ShardingTest/ReplSetTest doesn't cause the test to log a """"failed to load"""" line or a javascript stack trace (which makes sense, since which line would you error on?).    As an outcome of SERVER-25777, the mongo shell could already exit with a non-zero return code without printing a """"failed to load"""" message.    > The line that _is_ logged (""""a call to MongoRunner.stopMongod(), ReplSetTest#stopSet(), or ShardingTest#stop() may be missing from the test"""") also isn't/can't be logged at LogSeverity::Error, since it's not logged by a server process (and which makes the log line contain """" E """", which is another thing I typically look for when a test fails without """"failed to load"""").  >   > It took some confusion and additional scrolling through the logs for me to realize why my new test was reporting failure when it seemed like the test ran to completion successfully. Just a thought, in case there's something that can be done to make this failure easier to detect.    Esha Maharishi, I think your confusion is understandable. The goal of the message was to make it more obvious to the user what the remediation ought to be. Since that message isn't being surfaced clearly enough, we should change the logic in the mongo shell so that it is.    I don't see a reason that the mongo shell must use {{cout}} for logging the """"exiting with a failure due to unterminated processes"""" message, so we could replace it with a call to {{severe()}} instead (and prefix the log message with 'F'). Do you think that would be sufficient for your purposes? Would you mind filing a new SERVER ticket for this improvement request?    > For example, even just moving the """"a call to MongoRunner.stopMongod(), ReplSetTest#stopSet(), or ShardingTest#stop() may be missing from the test"""" just before/after the """"Summary: 1 test(s) ran in 35.86 seconds (0 succeeded, 0 were skipped, 1 failed, 0 errored)"""" could help.    Those messages are logged by two different processes (the mongo shell with the former and resmoke.py with the latter) so that isn't really something we'd consider. A related feature in resmoke.py would be to have special handling around certain exit codes from known processes. This case in the mongo shell would be one, but a memory leak detected by ASan/LSan would be another.  {quote}    See comment thread on SERVER-25640; one good idea from that thread is to make the mongo shell log an error message at a more severe log level."""
"SERVER-33470","Task","Testing Infrastructure",1,"Log archival message, even if successful, in hook_test_archival.py","""The archival message is only logged if there is an [error submitting files for archive|https://github.com/mongodb/mongo/blob/e3f361769cd13ba88aa24c1c0a71c76b187f64dd/buildscripts/resmokelib/testing/hook_test_archival.py#L115-L116].    We should have a logger.info message even on success, as there could be files that were skipped during the tar process."""
"SERVER-33641","Improvement","Replication|Testing Infrastructure",3,"Call checkOplogs when checkReplicatedDataHashes fails","""We should do the following to improve the relevance of diagnostics we have in the face of data inconsistency issues:    # Update {{ReplSetTest#stopSet()}} to call {{ReplSetTest#checkOplogs()}} [in addition to {{ReplSetTest#checkReplicatedDataHashes()}}|https://github.com/mongodb/mongo/blob/r3.7.7/src/mongo/shell/replsettest.js#L2174-L2189]. Care should be taken to ensure that tests do not run significantly longer because they need to verify a large oplog when shutting down the replica set.  # Update the {{PeriodicKillSecondaries}} hook to run the {{CheckReplOplogs}} hook [in addition to the {{CheckReplDBHash}} and {{ValidateCollections}} hooks|https://github.com/mongodb/mongo/blob/r3.7.7/buildscripts/resmokelib/testing/hooks/periodic_kill_secondaries.py#L137-L147].    h6. Original description    We now save all of the data files, but it would be great if the test could check the oplogs automatically and note any differences."""
"SERVER-33848","Task","Performance",2,"Update compile flags for sys-perf and performance projects","""MongoDB Community Server has had SSL support since 2.6 or 3.0, yet we weren't compiling with SSL support in sys-perf tests. Julian will fix that as part of his work.    We should review our compile code to make sure it reflects what is actually shipped to users. (Of course, we may have debug symbols and other differences, if they are intentional.)"""
"SERVER-33651","Improvement","Storage",1,"Mobile SE: Use full synchronous mode for SQLite writes","""SQLite allows some startup configuration options. The defaults should work for most of our use cases, but might still need some fine tuning. This ticket is to study the available options, and come up with any non default that might better suit us.    Also, at the conclusion of the ticket, update the design doc to specify these setting we come up with."""
"SERVER-33695","Improvement","Testing Infrastructure",2,"Include the loop name in the before and after recovery files in powertest.py","""Powercycle rsyncs the data files before and after a recovery runs (mongod started after power cycle event). We should name the resulting directory to also include the loop number, i.e., {{beforerecovery-1}}. We can still use rsync, and then rename the directory."""
